"Theme","Topic","Views","Author","Posted","Link","Replies"
"Assessment and Surveillance","Significance test for stunting results",5607,"Anonymous 394",2016-05-31,"https://www.en-net.org/question/2503.aspx",4
"Assessment and Surveillance","Trigger  levels for Overweight/obese",4773,"Merlyn Tapuwa Chapfunga",2016-05-25,"https://www.en-net.org/question/2498.aspx",0
"Assessment and Surveillance","acute malnutrition in double burden contexts",5733,"SUSANA RAFFALLI",2016-05-07,"https://www.en-net.org/question/2486.aspx",7
"Assessment and Surveillance","Anthropometric survey target group: 0-59 months vs. 6-59 months and implications",8261,"Miriam Chang",2016-05-03,"https://www.en-net.org/question/2480.aspx",3
"Assessment and Surveillance","Rapid MUAC Screening for Nutrition Assessment Purposes",6832,"Leah Richardson",2016-04-21,"https://www.en-net.org/question/2465.aspx",4
"Assessment and Surveillance","KAP Guidance",6005,"Leah Richardson",2016-04-21,"https://www.en-net.org/question/2464.aspx",4
"Assessment and Surveillance","community based nutrition surveillance system",5855,"Yibo Wood",2016-04-13,"https://www.en-net.org/question/2449.aspx",2
"Assessment and Surveillance","Household Dietary Diversity Score - 24 hours recall questions administering",5446,"Nick",2016-04-13,"https://www.en-net.org/question/2448.aspx",2
"Assessment and Surveillance","MUAC cut offs for 6 - 10 years",8275,"Anselimo Makokha",2016-04-11,"https://www.en-net.org/question/2440.aspx",8
"Assessment and Surveillance","When analysing birthweight data, should we exclude premature babies?",5238,"Anonymous 3070",2016-04-08,"https://www.en-net.org/question/2438.aspx",1
"Assessment and Surveillance","Integrated Database",6007,"Navid",2016-04-07,"https://www.en-net.org/question/2435.aspx",5
"Assessment and Surveillance","Criteria followed in determining minimum SPHERE standards",4836,"Diane Baik",2016-03-23,"https://www.en-net.org/question/2422.aspx",0
"Assessment and Surveillance","Survey for lactating women",5142,"Anonymous 3267",2016-03-22,"https://www.en-net.org/question/2417.aspx",3
"Assessment and Surveillance","Dietary Diversity Assessment",5418,"Anonymous 3261",2016-03-14,"https://www.en-net.org/question/2405.aspx",2
"Assessment and Surveillance","Clarification on women dietary diversity score food groups - use of Zatar",6671,"COOPI",2016-03-09,"https://www.en-net.org/question/2397.aspx",7
"Assessment and Surveillance","Small Area Estimation",5126,"Anonymous 249",2016-03-09,"https://www.en-net.org/question/2394.aspx",4
"Assessment and Surveillance","Deciding on sampling design: cluster sampling or stratified random sampling",7391,"Jordana Leitão",2016-03-03,"https://www.en-net.org/question/2384.aspx",10
"Assessment and Surveillance","Using Thresholds in analyzing health facility based data",5281,"Anonymous 1405",2016-02-16,"https://www.en-net.org/question/2362.aspx",1
"Assessment and Surveillance","Nutrition prevalence measurement",5920,"AS",2016-02-04,"https://www.en-net.org/question/2355.aspx",5
"Assessment and Surveillance","FSMS test",4500,"Anonymous 3117",2016-01-29,"https://www.en-net.org/question/2337.aspx",0
"Assessment and Surveillance","Result comparison of two SMART surveys",5798,"Anonymous 3445",2016-01-28,"https://www.en-net.org/question/2336.aspx",2
"Assessment and Surveillance","GAM <10% and SAM >2%",5116,"Karim Bougma",2016-01-23,"https://www.en-net.org/question/2331.aspx",2
"Assessment and Surveillance","LQAS for health facility surveys to measure program and data quality",8663,"Anonymous 3419",2016-01-14,"https://www.en-net.org/question/2324.aspx",1
"Assessment and Surveillance","Alternative Nutrition Diagnostics/Assessments",5765,"Meghan O'Hearn",2016-01-14,"https://www.en-net.org/question/2323.aspx",1
"Assessment and Surveillance","Small for Gestational Age",5927,"Nick",2016-01-14,"https://www.en-net.org/question/2322.aspx",3
"Assessment and Surveillance","Stratified randomization",7560,"Nick",2015-12-26,"https://www.en-net.org/question/2311.aspx",5
"Assessment and Surveillance","Baseline and Endline KAP survey villages_Matching",6913,"Tammam Ahmed",2015-12-20,"https://www.en-net.org/question/2306.aspx",2
"Assessment and Surveillance","Acute malnutrition caseload in emergency preparedness",5478,"Tomas Zaba",2015-12-16,"https://www.en-net.org/question/2301.aspx",1
"Assessment and Surveillance","Assessing malnutrition in school-age indigenous (pygmy) children in Republic of Congo",4736,"Margit Bach",2015-12-10,"https://www.en-net.org/question/2295.aspx",0
"Assessment and Surveillance","HiNi quality assessment",5213,"Anonymous 3049",2015-12-09,"https://www.en-net.org/question/2292.aspx",2
"Assessment and Surveillance","PLW and children under measurements in survey",8258,"Anonymous 3267",2015-12-01,"https://www.en-net.org/question/2282.aspx",3
"Assessment and Surveillance","How to assess stunting rate per year??",5123,"Tammam Ahmed",2015-11-22,"https://www.en-net.org/question/2272.aspx",0
"Assessment and Surveillance","un weighting of Barriers and Boosters",7630,"Bumba Erinest",2015-11-22,"https://www.en-net.org/question/2271.aspx",1
"Assessment and Surveillance","IYCF Assessment",5588,"Shishay",2015-11-13,"https://www.en-net.org/question/2261.aspx",4
"Assessment and Surveillance","What nutrition indicators should be use for evaluating the SDG2 nutrition goal? What are the data gaps that need to be filled?",5427,"Suneetha Kadiyala",2015-11-11,"https://www.en-net.org/question/2254.aspx",1
"Assessment and Surveillance","A final note",6821,"Mark Myatt",2015-11-02,"https://www.en-net.org/question/2235.aspx",27
"Assessment and Surveillance","Bayes Calculator",8094,"Felicity Munene",2015-10-28,"https://www.en-net.org/question/2230.aspx",2
"Assessment and Surveillance","SMART HHs Sampling",8170,"Sameh Al-Awlaqi",2015-10-23,"https://www.en-net.org/question/2226.aspx",10
"Assessment and Surveillance","interpreting weight for height standard deviation from ENA plausibility check",6012,"Anonymous 1740",2015-10-19,"https://www.en-net.org/question/2221.aspx",2
"Assessment and Surveillance","SMART Flagging Criteria (Technical)",7914,"Mark Myatt",2015-10-14,"https://www.en-net.org/question/2214.aspx",20
"Assessment and Surveillance","IYCF Index",5427,"Anonymous 3210",2015-10-08,"https://www.en-net.org/question/1949.aspx",2
"Assessment and Surveillance","Before and an after holiday effect-on nutritional indices",5953,"Asmelash",2015-10-07,"https://www.en-net.org/question/1948.aspx",7
"Assessment and Surveillance","Key questions regarding MUAC only programming - towards a research agenda",7515,"Mark Myatt",2015-10-05,"https://www.en-net.org/question/1945.aspx",8
"Assessment and Surveillance","Looking to contact Simon Kiarie Karanja",8405,"Mark Myatt",2015-09-22,"https://www.en-net.org/question/1930.aspx",2
"Assessment and Surveillance","Surveillance System to be established during El Niño",6084,"Frederich Christian Tan",2015-09-18,"https://www.en-net.org/question/1924.aspx",9
"Assessment and Surveillance","WFH  versus MUAC",11861,"Anonymous 81",2015-09-04,"https://www.en-net.org/question/1915.aspx",21
"Assessment and Surveillance","Discrepancise between ENA version April 2015 and July 2015",5502,"Anonymous 81",2015-08-29,"https://www.en-net.org/question/1903.aspx",1
"Assessment and Surveillance","scale model for adults",6124,"Sara Belleni",2015-08-24,"https://www.en-net.org/question/1890.aspx",5
"Assessment and Surveillance","IMCI service percentage",5613,"Tammam Ahmed",2015-08-22,"https://www.en-net.org/question/1887.aspx",6
"Assessment and Surveillance","does EN software work for more  than 5 years",5829,"Anonymous 3126",2015-08-19,"https://www.en-net.org/question/1881.aspx",2
"Assessment and Surveillance","Is there a way to present coverage when we do not have required number of SAM as sampled??",8003,"MAChowdhury",2015-08-18,"https://www.en-net.org/question/1879.aspx",1
"Assessment and Surveillance","Essential Nutrition Actions Practices questions in KAP survey",8028,"Nick",2015-08-16,"https://www.en-net.org/question/1877.aspx",6
"Assessment and Surveillance","Systematic random sampling from a list for rapid MUAC Assessment of U5s",5925,"Anonymous 3066",2015-08-13,"https://www.en-net.org/question/1876.aspx",3
"Assessment and Surveillance","SENSTIVITY OF MUAC TO MALNUTRITION",7643,"MUBANGIZI HUMPHREY",2015-07-31,"https://www.en-net.org/question/1848.aspx",3
"Assessment and Surveillance","SQUEAC after (health) disaster",7811,"Suzanne",2015-07-31,"https://www.en-net.org/question/1847.aspx",2
"Assessment and Surveillance","Is it possible to use LQAS methodology to assess the prevalence of stunting in non-emergency settings?",8802,"Amanda Agar",2015-07-22,"https://www.en-net.org/question/1837.aspx",10
"Assessment and Surveillance","Adolescent anthropometry analysis questions",7903,"Amelia Reese Masterson",2015-07-15,"https://www.en-net.org/question/1832.aspx",6
"Assessment and Surveillance","Urgent: Weight for Height Z-scores: Unisex Z-score table used in West African countries vs. calculated Z score values",11602,"Miriam Chang",2015-07-10,"https://www.en-net.org/question/1826.aspx",11
"Assessment and Surveillance","Emergency standards for SAM/MAM when using MUAC",6508,"Leah Richardson",2015-07-06,"https://www.en-net.org/question/1821.aspx",7
"Assessment and Surveillance","Calculating a sample size to detect associations between maternal nutrition, HH food security status and dietary diversity.",7769,"Briony",2015-07-06,"https://www.en-net.org/question/1820.aspx",4
"Assessment and Surveillance","Calculation of Mortality Rates",21048,"Leah Richardson",2015-07-01,"https://www.en-net.org/question/1813.aspx",4
"Assessment and Surveillance","Nutritional indicator baseline/evaluation",5659,"Kris",2015-06-25,"https://www.en-net.org/question/1805.aspx",1
"Assessment and Surveillance","GETTING AN ALPHA AND BETA VALUE",7597,"Stanley Macharia",2015-06-22,"https://www.en-net.org/question/1796.aspx",1
"Assessment and Surveillance","GUIDE TO PRECISION VALUE IN BAYESQUEAC CALCULATOR",7427,"Stanley Macharia",2015-06-22,"https://www.en-net.org/question/1795.aspx",2
"Assessment and Surveillance","REASON FOR GREAT REDUCTION OF STUNTING WITHIN A YEAR",6006,"Stanley Macharia",2015-06-15,"https://www.en-net.org/question/1780.aspx",10
"Assessment and Surveillance","Dietary macro-nutrient and micro-nutrient intake estimation in children",6378,"Tibebu Moges",2015-06-10,"https://www.en-net.org/question/1779.aspx",6
"Assessment and Surveillance","Nutrition Assessments in 8-19 years",5688,"james majaha",2015-06-01,"https://www.en-net.org/question/1758.aspx",2
"Assessment and Surveillance","Using Weight For Height (WFH) for CMAM coverage survey.",6822,"Lovely Amin",2015-05-30,"https://www.en-net.org/question/1757.aspx",3
"Assessment and Surveillance","DESIGN EFFECT FOR MULTIPLE SMART SURVEY",8564,"Stanley Macharia",2015-05-29,"https://www.en-net.org/question/1756.aspx",18
"Assessment and Surveillance","SE Asian Growth Standards",8312,"Aisling",2015-05-29,"https://www.en-net.org/question/1755.aspx",15
"Assessment and Surveillance","Assessment of Adult Malnutrition in ""Long-legged"" populations",6818,"Anonymous 502",2015-05-27,"https://www.en-net.org/question/1750.aspx",9
"Assessment and Surveillance","MUAC cut off points for school aged children",7194,"fe",2015-05-25,"https://www.en-net.org/question/1744.aspx",4
"Assessment and Surveillance","growth monitoring",6474,"Massimo Serventi",2015-05-24,"https://www.en-net.org/question/1743.aspx",5
"Assessment and Surveillance","Probable reasons for a significantly higher rates of acute malnutrition in boys than girls",8502,"MAChowdhury",2015-05-13,"https://www.en-net.org/question/1730.aspx",13
"Assessment and Surveillance","GAM vs Mortality rate",5489,"Anonymous 490",2015-05-11,"https://www.en-net.org/question/1723.aspx",1
"Assessment and Surveillance","Estimation of New Pregnant Mother for cash transfer programme",5358,"Nick",2015-05-11,"https://www.en-net.org/question/1722.aspx",1
"Assessment and Surveillance","Epi Info equivalent for Mac",12604,"Briony",2015-05-11,"https://www.en-net.org/question/1721.aspx",2
"Assessment and Surveillance","Weighted Analysis",5505,"Mutegi K",2015-05-08,"https://www.en-net.org/question/1718.aspx",2
"Assessment and Surveillance","% of Stunting prevelence or Mean WHZ score",5861,"Nick",2015-05-05,"https://www.en-net.org/question/1709.aspx",3
"Assessment and Surveillance","Is stunted children less prone to be wasted than normal children during emergency context?",6404,"Frederich Christian Tan",2015-05-05,"https://www.en-net.org/question/1708.aspx",7
"Assessment and Surveillance","SQUEAC Second Stage Hypothesis",7836,"Anonymous 2227",2015-04-28,"https://www.en-net.org/question/1701.aspx",3
"Assessment and Surveillance","Can you import by tablet collected data to be analysed in ENA?",7976,"Petr Schmied",2015-04-22,"https://www.en-net.org/question/1696.aspx",8
"Assessment and Surveillance","Nutrition Causal Analysis: usefulness and application",6286,"Blessing Mureverwi",2015-04-09,"https://www.en-net.org/question/1678.aspx",5
"Assessment and Surveillance","Anthropometric assessments in pregnant adolescents",5202,"Merlyn Tapuwa Chapfunga",2015-04-07,"https://www.en-net.org/question/1676.aspx",1
"Assessment and Surveillance","Representative sample",6061,"Anonymous 490",2015-04-01,"https://www.en-net.org/question/1675.aspx",2
"Assessment and Surveillance","ENQUETE SLEAC",8191,"Anonymous 2885",2015-03-30,"https://www.en-net.org/question/1669.aspx",1
"Assessment and Surveillance","weight - quality of surveys",5724,"Severine Frison",2015-03-19,"https://www.en-net.org/question/1654.aspx",2
"Assessment and Surveillance","NCA Methodology",6907,"Anonymous 2352",2015-03-03,"https://www.en-net.org/question/1640.aspx",7
"Assessment and Surveillance","Ratio of severe:moderate wasting and ratio of severe:moderate stunting",5815,"Ranjith",2015-02-28,"https://www.en-net.org/question/1637.aspx",2
"Assessment and Surveillance","how many of the target facilities to assess for judging quality of CMAM service",8520,"Anonymous 680",2015-02-18,"https://www.en-net.org/question/1623.aspx",1
"Assessment and Surveillance","Do you use scales in your work ? Please take part in our survey",5700,"Alison Fleet",2015-02-05,"https://www.en-net.org/question/1608.aspx",0
"Assessment and Surveillance","Calculation of under 2 years MAM children.",5277,"Anonymous 12345",2015-02-02,"https://www.en-net.org/question/1603.aspx",1
"Assessment and Surveillance","Field investigation of acute malnutrition cases in a village",6032,"Lilia TUrcan",2015-02-01,"https://www.en-net.org/question/1602.aspx",2
"Assessment and Surveillance","sample size diagnostic questionnaite-urgent help",5944,"Anonymous 2525",2015-01-29,"https://www.en-net.org/question/1600.aspx",1
"Assessment and Surveillance","Combining of multiple an independent surveys through weighting",6316,"Anonymous 81",2014-12-21,"https://www.en-net.org/question/1579.aspx",2
"Assessment and Surveillance","Geeting the alpha and beta values",8605,"Stanley Macharia",2014-11-19,"https://www.en-net.org/question/1543.aspx",5
"Assessment and Surveillance","Seasonality - IDDS",5355,"Sabine Triemer",2014-11-19,"https://www.en-net.org/question/1542.aspx",1
"Assessment and Surveillance","Nutrition Sentinel Survey",5697,"benylali@yahoo.com",2014-11-12,"https://www.en-net.org/question/1538.aspx",1
"Assessment and Surveillance","Trends in malnutrition",5671,"Sabine Triemer",2014-11-05,"https://www.en-net.org/question/1531.aspx",1
"Assessment and Surveillance","HYPOTHESIS DEVELOPMENT IN URBAN SETTLEMENT",9802,"Anonymous 2707",2014-10-28,"https://www.en-net.org/question/1519.aspx",1
"Assessment and Surveillance","How to assess the nutritional status of pregnant woman?",7836,"Frederich Christian Tan",2014-10-24,"https://www.en-net.org/question/1515.aspx",3
"Assessment and Surveillance","Mass screening in a district",6099,"Anonymous 684",2014-10-15,"https://www.en-net.org/question/1502.aspx",5
"Assessment and Surveillance","Nutrition Assessment for Refugiees & Host mixed population",5758,"Anonymous 2688",2014-10-08,"https://www.en-net.org/question/1500.aspx",7
"Assessment and Surveillance","Integrated SMART and KPC Survey",6312,"Mahaman Elhadji Hallarou",2014-10-07,"https://www.en-net.org/question/1499.aspx",3
"Assessment and Surveillance","What is the meaning of Z-test and P value in SQUEAC estimate calculator?",9085,"Anonymous 1310",2014-10-06,"https://www.en-net.org/question/1498.aspx",1
"Assessment and Surveillance","Guidelines on deciding WHEN to conduct different types of Nutrition Assessment in Emergencies",6371,"Frederich Christian Tan",2014-10-02,"https://www.en-net.org/question/1495.aspx",8
"Assessment and Surveillance","indicator for measuring wasting and stunting in Adults",7864,"Atif",2014-09-22,"https://www.en-net.org/question/1485.aspx",3
"Assessment and Surveillance","Estimating prevalence using health records",5822,"Anonymous 2655",2014-09-15,"https://www.en-net.org/question/1480.aspx",2
"Assessment and Surveillance","SQUEAC Slide Show",7802,"Mark Myatt",2014-09-09,"https://www.en-net.org/question/1469.aspx",2
"Assessment and Surveillance","Error message in ENA SMART software",5586,"Beulah Jayakumar",2014-08-25,"https://www.en-net.org/question/1457.aspx",2
"Assessment and Surveillance","Using nutrition surveys data for secondary analysis?",6309,"Tariq Khan",2014-08-19,"https://www.en-net.org/question/1450.aspx",10
"Assessment and Surveillance","clear definition of Small Scale SMART Survey",8142,"Anonymous 81",2014-08-19,"https://www.en-net.org/question/1449.aspx",18
"Assessment and Surveillance","SMART advocacy.SMART vs other methods",6529,"Blessing Mureverwi",2014-08-07,"https://www.en-net.org/question/1440.aspx",9
"Assessment and Surveillance","How to assess coverage and challenges to coverage in home fortification program",9661,"Roman",2014-08-04,"https://www.en-net.org/question/1434.aspx",2
"Assessment and Surveillance","Request advice: equipment to assess nutritional status 0-5 yrs in field study PNG",6205,"Janny Goris",2014-07-28,"https://www.en-net.org/question/1430.aspx",2
"Assessment and Surveillance","ENA for SMART on MacBook Pro operating System",8659,"Barbara Nalubanga",2014-07-17,"https://www.en-net.org/question/1422.aspx",17
"Assessment and Surveillance","Total population estimation",5995,"Anonymous 2571",2014-07-02,"https://www.en-net.org/question/1406.aspx",2
"Assessment and Surveillance","result of Goronyo squeac coverage",8167,"Muhammad Hassan Goronyo",2014-07-01,"https://www.en-net.org/question/1405.aspx",1
"Assessment and Surveillance","Participatory Review of Coverage Methodologies",8136,"Jose Luis Alvarez Moran",2014-06-25,"https://www.en-net.org/question/1402.aspx",0
"Assessment and Surveillance","Optifoods software",6319,"Martin Njoroge",2014-06-23,"https://www.en-net.org/question/1400.aspx",2
"Assessment and Surveillance","24-hours dietary recall",5582,"Martha.N",2014-06-21,"https://www.en-net.org/question/1399.aspx",2
"Assessment and Surveillance","IYCF and Nutritional Assessment Survey during Ramadan",7830,"Frederich Christian Tan",2014-06-20,"https://www.en-net.org/question/1396.aspx",12
"Assessment and Surveillance","what to do with adolescent men taller  than 1.75 m in WfH?",5716,"Mija Ververs",2014-06-10,"https://www.en-net.org/question/1391.aspx",1
"Assessment and Surveillance","Echantillonnage LQAS",8831,"Mohamed MAIGA",2014-06-07,"https://www.en-net.org/question/1390.aspx",6
"Assessment and Surveillance","Minimum Number of Clusters in a SMART Survey",9057,"Anonymous 2352",2014-05-31,"https://www.en-net.org/question/1385.aspx",7
"Assessment and Surveillance","Causal Analysis in SQUEAC",8784,"Adamu Abubakar Yerima",2014-05-23,"https://www.en-net.org/question/1383.aspx",4
"Assessment and Surveillance","Correlation Analysis for Cross Sectional Survey",5636,"Samuel Kirichu",2014-05-23,"https://www.en-net.org/question/1381.aspx",5
"Assessment and Surveillance","Urgent Help!! Please!! Sampling and study design!!!",6683,"Anonymous 2525",2014-05-22,"https://www.en-net.org/question/1380.aspx",6
"Assessment and Surveillance","How to Interpret Index of Dispersion (ID) in ENA  SMART Output?",7762,"Abbas Kedir Jelde",2014-05-20,"https://www.en-net.org/question/1375.aspx",3
"Assessment and Surveillance","Epi Info command syntax error",9756,"Suzanne Fuhrman",2014-05-13,"https://www.en-net.org/question/1362.aspx",5
"Assessment and Surveillance","Discrepancies of malnutrition prevalence among boys and girls",6156,"Anonymous 2515",2014-05-06,"https://www.en-net.org/question/1355.aspx",2
"Assessment and Surveillance","Coverage survey using Blocked Weighted Bootstrap",9965,"Roman",2014-04-24,"https://www.en-net.org/question/1349.aspx",15
"Assessment and Surveillance","When the survey SD value is out of aceptable range, especially < 0.8, how the prevalence  estimation should proceed?",6365,"nicky",2014-04-08,"https://www.en-net.org/question/1332.aspx",1
"Assessment and Surveillance","When sampled cluster doen't have enough HH demanded by sample size because of urgent and sudden population movement",6618,"nicky",2014-03-31,"https://www.en-net.org/question/1324.aspx",8
"Assessment and Surveillance","Calculating variance and DEFF for stratified sampling",6891,"Blessing Mureverwi",2014-03-28,"https://www.en-net.org/question/1322.aspx",4
"Assessment and Surveillance","Qualitative stage 1(SQUEAC) for both OTP and SFP",8838,"Mutegi K",2014-03-26,"https://www.en-net.org/question/1317.aspx",5
"Assessment and Surveillance","CMN training/assessment",7796,"Ranjith",2014-03-03,"https://www.en-net.org/question/1288.aspx",1
"Assessment and Surveillance","developing a methodology for a highly security compromised area. need guidence",5862,"Dr Mohammad Najeeb",2014-02-26,"https://www.en-net.org/question/1281.aspx",1
"Assessment and Surveillance","MUAC tapes",16259,"Jan Komrska",2014-02-13,"https://www.en-net.org/question/1274.aspx",12
"Assessment and Surveillance","Survey Sample for Pastoral Communities",5612,"Abbas Kedir Jelde",2014-02-11,"https://www.en-net.org/question/1272.aspx",1
"Assessment and Surveillance","SMART on-site selection of village",5814,"Frederich Christian Tan",2014-02-11,"https://www.en-net.org/question/1271.aspx",1
"Assessment and Surveillance","conversion of sample size to household",10950,"Anonymous 81",2014-02-09,"https://www.en-net.org/question/1270.aspx",22
"Assessment and Surveillance","Check list or guidance note (summarize) for before starting & during conduction of SQUEAC (Preparation of SQUEAC)",7919,"Anonymous 739",2014-02-07,"https://www.en-net.org/question/1269.aspx",0
"Assessment and Surveillance","Minimum Union Councils (UC) for SQUEAC due to any reasons",7848,"Anonymous 739",2014-02-07,"https://www.en-net.org/question/1268.aspx",1
"Assessment and Surveillance","SMART urban sampling",7161,"Maja Kuhar",2014-02-05,"https://www.en-net.org/question/1263.aspx",5
"Assessment and Surveillance","Establishment of Nutrition Surveillance System",6216,"Frederich Christian Tan",2014-01-31,"https://www.en-net.org/question/1260.aspx",4
"Assessment and Surveillance","SQUEAC, when CMAM program ends",9031,"Anonymous 739",2014-01-31,"https://www.en-net.org/question/1258.aspx",8
"Assessment and Surveillance","NCA",8426,"Dr. Kamal Raj",2014-01-09,"https://www.en-net.org/question/1240.aspx",2
"Assessment and Surveillance","SLEAC and SQUEAC",10296,"Anonymous 2352",2013-12-05,"https://www.en-net.org/question/1221.aspx",1
"Assessment and Surveillance","Is mortality survey a must to be conducted along with SMART?",6392,"Anonymous 81",2013-12-03,"https://www.en-net.org/question/1217.aspx",3
"Assessment and Surveillance","Individual data entry in mortality data set of ENA for HH size > 20",6785,"Anonymous 2411",2013-11-29,"https://www.en-net.org/question/1215.aspx",10
"Assessment and Surveillance","SQUEAC - Weighted boosters and barriers",9433,"Anonymous 81",2013-11-25,"https://www.en-net.org/question/1211.aspx",5
"Assessment and Surveillance","Vulnerability Assessmnet: Indepth analysis of nutrition versus socio-economic indicators",5502,"Anonymous 2354",2013-11-19,"https://www.en-net.org/question/1207.aspx",2
"Assessment and Surveillance","Setting up of Nutrition serveillance",8589,"Anonymous 81",2013-11-16,"https://www.en-net.org/question/1201.aspx",9
"Assessment and Surveillance","KAP surveys",9461,"Anonymous 557",2013-11-06,"https://www.en-net.org/question/1194.aspx",2
"Assessment and Surveillance","Why Credibility Interval (CI) is slightly changing while estimating Posterior Coverage by using SQUEAC coverage estimate calculator (Version 3.01)",8551,"Anonymous 1310",2013-10-30,"https://www.en-net.org/question/1187.aspx",4
"Assessment and Surveillance","Low OTP Coverage",8767,"Anonymous 2352",2013-10-28,"https://www.en-net.org/question/1185.aspx",4
"Assessment and Surveillance","sampleXS and things that I should know!",5357,"Anonymous 557",2013-10-11,"https://www.en-net.org/question/1170.aspx",1
"Assessment and Surveillance","SQUEAC Coverage survey",10706,"Anonymous 2264",2013-10-08,"https://www.en-net.org/question/1163.aspx",20
"Assessment and Surveillance","Discrepancy between BayesSQUEAC calculator and Manual calculation",8628,"Anonymous 81",2013-09-30,"https://www.en-net.org/question/1152.aspx",3
"Assessment and Surveillance","SQUEAC Stage",9278,"Anonymous 81",2013-09-27,"https://www.en-net.org/question/1151.aspx",3
"Assessment and Surveillance","malnutrition rate",9470,"Anonymous 2180",2013-09-24,"https://www.en-net.org/question/1144.aspx",24
"Assessment and Surveillance","Appropriate effect size in estimating sample size",6279,"Anonymous 2356",2013-09-19,"https://www.en-net.org/question/1142.aspx",1
"Assessment and Surveillance","Smart Survey Methodology versus 30 by 30 cluster sampling -comparison of results",7951,"Anonymous 2354",2013-09-13,"https://www.en-net.org/question/1141.aspx",1
