"Theme","Topic","Views","Author","Posted","Link","Replies"
"Announcements & Nutritionists needed","Launching the Rapid Assessment Method for Older People (RAM-OP)",9464,"Pascale Fritsch",2015-11-25,"https://www.en-net.org/question/2276.aspx",NA
"Announcements & Nutritionists needed","Humanitarian Programme Coordinator ? Health and Nutrition",8862,"Pascale Fritsch",2015-11-24,"https://www.en-net.org/question/2274.aspx",NA
"Announcements & Nutritionists needed","LSHTM Master degree summer projects",9255,"Severine Frison",2015-11-23,"https://www.en-net.org/question/2273.aspx",NA
"Announcements & Nutritionists needed","Nutrition Specialist, World Food Programme, Nepal (closing 18 November)",9837,"Lindsey Horton",2015-11-12,"https://www.en-net.org/question/2259.aspx",NA
"Announcements & Nutritionists needed","Job Posting: 15-1037: Nutrition Program Manager",8589,"Dani Tucker",2015-11-11,"https://www.en-net.org/question/2256.aspx",NA
"Announcements & Nutritionists needed","Job posting: 15-972: Emergency Nutrition Coordinator",9033,"Dani Tucker",2015-11-11,"https://www.en-net.org/question/2255.aspx",NA
"Announcements & Nutritionists needed","Clinical Lead - Improving Care for Undernourished Children with Acute Illness",9918,"Tamsin",2015-11-10,"https://www.en-net.org/question/2251.aspx",NA
"Announcements & Nutritionists needed","SPRING seeks Instructional Design Consultant - Ag and SBC focused",9316,"Abhi Goyal",2015-11-06,"https://www.en-net.org/question/2242.aspx",NA
"Announcements & Nutritionists needed","UNHCR seeks P3 Food & Nutrition Officer based in Dadaab Kenya",10328,"Anonymous 40",2015-11-06,"https://www.en-net.org/question/2241.aspx",NA
"Announcements & Nutritionists needed","UNHCR seeks P3 Nutrition & Food Security Officer based in Juba South Sudan",10415,"Anonymous 40",2015-11-06,"https://www.en-net.org/question/2239.aspx",NA
"Announcements & Nutritionists needed","Food Security Advisor",8615,"Alan Mason",2015-10-28,"https://www.en-net.org/question/2232.aspx",NA
"Announcements & Nutritionists needed","Senior Health and Nutrition Advisor",8857,"Alan Mason",2015-10-28,"https://www.en-net.org/question/2231.aspx",NA
"Announcements & Nutritionists needed","POLICY COORDINATOR, SIERRA LEONE (IPA/JPAL PARTNERSHIP)",9089,"Anonymous 675",2015-10-27,"https://www.en-net.org/question/2229.aspx",NA
"Announcements & Nutritionists needed","GOAL is recruiting Roving Nutrition Advisor",8790,"Anonymous 3237",2015-10-26,"https://www.en-net.org/question/2228.aspx",NA
"Announcements & Nutritionists needed","GOAL is recruiting Nutrition Impact & Positive Practice (NIPP) Global Manager",9699,"Anonymous 3237",2015-10-26,"https://www.en-net.org/question/2227.aspx",NA
"Announcements & Nutritionists needed","Progressio is recruiting for a Communications and Advocacy Adviser placement, based in Malawi, working on nutrition",9147,"Georgina Nicoli",2015-10-23,"https://www.en-net.org/question/2225.aspx",NA
"Announcements & Nutritionists needed","Consultant needed for scoping study to inform capacity building and institutionalisation strategy (LinkNCA)",9124,"Julien Morel",2015-10-23,"https://www.en-net.org/question/2224.aspx",NA
"Announcements & Nutritionists needed","15-963: Nutrition Program Manager",9706,"Anonymous 1494",2015-10-13,"https://www.en-net.org/question/2213.aspx",NA
"Announcements & Nutritionists needed","HelpAge International seeks a Humanitarian Programme Coordinator - Health and Nutrition",8804,"Pascale Fritsch",2015-10-09,"https://www.en-net.org/question/1950.aspx",NA
"Announcements & Nutritionists needed","Consultant(s) needed: Review of GNC Handbook",10387,"Nicki Connell",2015-10-05,"https://www.en-net.org/question/1947.aspx",NA
"Announcements & Nutritionists needed","Deputy Chief of Party - Programs (Tamale, Ghana) - The SPRING Project",9033,"Abhi Goyal",2015-10-05,"https://www.en-net.org/question/1946.aspx",NA
"Announcements & Nutritionists needed","A SENIOR RESEARCH ADVISOR - ACTION CONTRE LA FAIM",9285,"Michael ALVES",2015-09-29,"https://www.en-net.org/question/1941.aspx",NA
"Announcements & Nutritionists needed","Nutrition Expert (immediate need)",8061,"Anonymous 3176",2015-09-25,"https://www.en-net.org/question/1935.aspx",NA
"Announcements & Nutritionists needed","15-812: Technical Surge Advisor- SBC",8567,"Anonymous 1494",2015-09-25,"https://www.en-net.org/question/1934.aspx",NA
"Announcements & Nutritionists needed","Hiring! Nutrition Advisor (6.5 months maternity cover) London and immediate start",8315,"Anonymous 2382",2015-09-25,"https://www.en-net.org/question/1933.aspx",NA
"Announcements & Nutritionists needed","UNICEF and Save the Children seek an IYCF in Emergencies Consultant",10050,"Alison Donnelly",2015-09-25,"https://www.en-net.org/question/1932.aspx",NA
"Announcements & Nutritionists needed","Emergency Nutritionist with Concern Worldwide in South Sudan",9560,"Ciara Passmore",2015-09-08,"https://www.en-net.org/question/1919.aspx",NA
"Announcements & Nutritionists needed","ACF recherche UNE SAGE FEMME (H/F) au TCHAD",10251,"Michael ALVES",2015-09-02,"https://www.en-net.org/question/1914.aspx",NA
"Announcements & Nutritionists needed","ACF is looking for A NUTRITION AND HEALTH PROGRAM MANAGER in  LIBERIA",8836,"Michael ALVES",2015-09-02,"https://www.en-net.org/question/1913.aspx",NA
"Announcements & Nutritionists needed","ACF recherche UN RESPONSABLE DE PROGRAMME DE RECHERCHE (H/F) au BURKINA FASO",8311,"Michael ALVES",2015-09-02,"https://www.en-net.org/question/1912.aspx",NA
"Announcements & Nutritionists needed","ACF is looking A CONSULTANT FOR A STUDY ON RUTF",9568,"Michael ALVES",2015-09-02,"https://www.en-net.org/question/1911.aspx",NA
"Announcements & Nutritionists needed","ACF is looking for A NUTRITIONAL CAUSAL ANALYSIS EXPERT in ETHIOPIA",9042,"Michael ALVES",2015-09-02,"https://www.en-net.org/question/1910.aspx",NA
"Announcements & Nutritionists needed","ACF recherche UN EXPERT EN RENFORCEMENT DU SYSTEME DE SANTE (H/F) à  DJIBOUTI",8446,"Michael ALVES",2015-09-01,"https://www.en-net.org/question/1909.aspx",NA
"Announcements & Nutritionists needed","HelpAge International needs a Nutritonist in Suth Sudan",9168,"Pascale Fritsch",2015-09-01,"https://www.en-net.org/question/1906.aspx",NA
"Announcements & Nutritionists needed","Nutrition in Emergencies consultant, UNICEF East Asia Pacific Regional Office",10144,"Christiane Rudert",2015-09-01,"https://www.en-net.org/question/1905.aspx",NA
"Announcements & Nutritionists needed","ACF is looking for A NUTRITION AND HEALTH COORDINATOR in MYANMAR",8789,"Michael ALVES",2015-08-31,"https://www.en-net.org/question/1904.aspx",NA
"Announcements & Nutritionists needed","ACF is looking for A NUTRITION AND HEALTH PROGRAM MANAGER in Yemen (Aden)",8783,"Michael ALVES",2015-08-28,"https://www.en-net.org/question/1902.aspx",NA
"Announcements & Nutritionists needed","Welthungerhilfe seeks an Advisor on Food and Nutrition Security in Pakistan",8875,"Tamsin",2015-08-27,"https://www.en-net.org/question/1900.aspx",NA
"Announcements & Nutritionists needed","Nutrition Advisor",8783,"Alan Mason",2015-08-26,"https://www.en-net.org/question/1897.aspx",NA
"Announcements & Nutritionists needed","ACF recherche UN RESPONSABLE DE PROGRAMME NUTRITION ET SANTE  en  RCA",8236,"Michael ALVES",2015-08-26,"https://www.en-net.org/question/1896.aspx",NA
"Announcements & Nutritionists needed","International consultant (Oct-Dec 2015) to support the nutrition unit at WHO IST/WA office Based in Ouagadougou",9206,"Elisa Dominguez",2015-08-26,"https://www.en-net.org/question/1895.aspx",NA
"Announcements & Nutritionists needed","ACF is looking for A NUTRITION AND HEALTH PROGRAM MANAGER in MYANMAR",8567,"Michael ALVES",2015-08-26,"https://www.en-net.org/question/1894.aspx",NA
"Announcements & Nutritionists needed","New app to calculate the size of babies using the INTERGROWTH-21st Standards",8755,"Tamsin",2015-08-20,"https://www.en-net.org/question/1886.aspx",NA
"Announcements & Nutritionists needed","Health & Nutrition Director RWANU, Uganda, Concern Worldwide",9990,"Ciara Passmore",2015-08-20,"https://www.en-net.org/question/1884.aspx",NA
"Announcements & Nutritionists needed","Emergency Response Team (ERT) Nutrition Project Manager",9085,"Alan Mason",2015-08-19,"https://www.en-net.org/question/1882.aspx",NA
"Announcements & Nutritionists needed","Senior Emergency Nutrition Advisor (50% position)",9070,"Colleen Emary",2015-08-18,"https://www.en-net.org/question/1878.aspx",NA
"Announcements & Nutritionists needed","15-820: Technical Surge Advisor- CMAM",8992,"Anonymous 1494",2015-08-13,"https://www.en-net.org/question/1875.aspx",NA
"Announcements & Nutritionists needed","15-812: Technical Surge Advisor- SBC",8892,"Anonymous 1494",2015-08-13,"https://www.en-net.org/question/1874.aspx",NA
"Announcements & Nutritionists needed","Health and Nutrition Programme Manager, Chad, Concern Worldwide",9495,"Ciara Passmore",2015-08-13,"https://www.en-net.org/question/1872.aspx",NA
"Announcements & Nutritionists needed","Health & Nutrition Coord (Maternity), Malawi, Concern Worldwide",9274,"Ciara Passmore",2015-08-13,"https://www.en-net.org/question/1871.aspx",NA
"Announcements & Nutritionists needed","Senior Nutritionist in Karamoja, Uganda with Concern Worldwide",9419,"Ciara Passmore",2015-08-13,"https://www.en-net.org/question/1870.aspx",NA
"Announcements & Nutritionists needed","15-812: Technical Surge Advisor- SBC",8431,"Anonymous 1494",2015-08-13,"https://www.en-net.org/question/1869.aspx",NA
"Announcements & Nutritionists needed","15-820: Technical Surge Advisor- CMAM",8884,"Anonymous 1494",2015-08-13,"https://www.en-net.org/question/1868.aspx",NA
"Announcements & Nutritionists needed","Infant and Young Child Feeding in Emergencies - Technical Surge Advisor SCUK",8760,"Megan",2015-08-12,"https://www.en-net.org/question/1865.aspx",NA
"Announcements & Nutritionists needed","15-648: Food Security and Livelihoods Consultant",9500,"Anonymous 1494",2015-08-11,"https://www.en-net.org/question/1864.aspx",NA
"Announcements & Nutritionists needed","Vacancy Job #15-820 Technical Surge Advisor - CMAM",8903,"Anonymous 1494",2015-08-11,"https://www.en-net.org/question/1863.aspx",NA
"Announcements & Nutritionists needed","Vacancy - Job# 15-812 Technical Surge Advisor - SBC",8702,"Anonymous 1494",2015-08-11,"https://www.en-net.org/question/1862.aspx",NA
"Announcements & Nutritionists needed","Nutrition Coordinator, Zambia Female Youths Livelihood and Nutrition Enhancement Project",9834,"Ciara Passmore",2015-08-11,"https://www.en-net.org/question/1861.aspx",NA
"Announcements & Nutritionists needed","Project Coordinator, Zambia Female Youths Livelihood and Nutrition Enhancement Project",8978,"Ciara Passmore",2015-08-11,"https://www.en-net.org/question/1860.aspx",NA
"Announcements & Nutritionists needed","Nutrition Coordinator, Concern Worldwide Zambia, for the Female Youths Livelihood and Nutrition Enhancement Project",9367,"Regine Kopplow",2015-08-10,"https://www.en-net.org/question/1859.aspx",NA
"Announcements & Nutritionists needed","Project Coordinator, Concern Worldwide Zambia, for the Female Youths Livelihood and Nutrition Enhancement Project",9310,"Regine Kopplow",2015-08-10,"https://www.en-net.org/question/1858.aspx",NA
"Announcements & Nutritionists needed","Internship Opportunity inquiry",8563,"nakyanzi teddy",2015-08-06,"https://www.en-net.org/question/1855.aspx",NA
"Announcements & Nutritionists needed","CMAM Forum Coordinator",10461,"Jose Luis Alvarez Moran",2015-08-06,"https://www.en-net.org/question/1854.aspx",NA
"Announcements & Nutritionists needed","Vacancy - 5 weeks home based consultancy for Helen Keller International",9476,"David Doledec",2015-08-05,"https://www.en-net.org/question/1853.aspx",NA
"Announcements & Nutritionists needed","15-575: Nutrition Coordinator",8590,"Anonymous 1494",2015-08-04,"https://www.en-net.org/question/1852.aspx",NA
"Announcements & Nutritionists needed","15-648: Food Security and Livelihoods Consultant",8594,"Anonymous 1494",2015-08-04,"https://www.en-net.org/question/1851.aspx",NA
"Announcements & Nutritionists needed","Infant and Young Child Feeding in Emergencies (IYCF-E) Consultancy  - Save the Children",10127,"Christine Fernandes",2015-08-03,"https://www.en-net.org/question/1850.aspx",NA
"Announcements & Nutritionists needed","Consultancy: 5 weeks consultancy to update a survey database and conduct initial analysis",9215,"Rosalia Lorenzen",2015-08-03,"https://www.en-net.org/question/1849.aspx",NA
"Announcements & Nutritionists needed","Nepal Nutrition and Food Security Portal",8561,"Sophiya Uprety",2015-07-29,"https://www.en-net.org/question/1845.aspx",NA
"Announcements & Nutritionists needed","Global Knowledge Management Coordinator",10484,"Tamsin",2015-07-27,"https://www.en-net.org/question/1842.aspx",NA
"Announcements & Nutritionists needed","Nutrition & Health Advisor , New York, Concern Worldwide",9047,"Regine Kopplow",2015-07-23,"https://www.en-net.org/question/1839.aspx",NA
"Announcements & Nutritionists needed","Communications and Advocacy Adviser vacancy",9091,"Georgina Nicoli",2015-07-22,"https://www.en-net.org/question/1838.aspx",NA
"Announcements & Nutritionists needed","15-750: Nutrition Associate - Mercy Corps",9835,"Tamsin",2015-07-21,"https://www.en-net.org/question/1834.aspx",NA
"Announcements & Nutritionists needed","Job Vacancy: Community Management of Acute Malnutrition (CMAM) Advisor, India",9932,"Joseph Galabuzi",2015-07-20,"https://www.en-net.org/question/1833.aspx",NA
"Announcements & Nutritionists needed","Action Contre la Faim is looking for a consultant position on writing an Operational Manual for promoting the WASH in Nutrition Strategy",9481,"Julien Morel",2015-07-10,"https://www.en-net.org/question/1827.aspx",NA
"Announcements & Nutritionists needed","IAEA Nutrition Specialist (P4)",10359,"Victor Owino",2015-07-07,"https://www.en-net.org/question/1823.aspx",NA
"Announcements & Nutritionists needed","Advertisement",9384,"Anonymous 2725",2015-07-01,"https://www.en-net.org/question/1816.aspx",NA
"Announcements & Nutritionists needed","ACF is looking for UN COORDINATEUR TECHNIQUE SANTE MATERNELLE ET INFANTILE ET NUTRITION (SMIN) (H/F) in Haiti",8997,"Michael ALVES",2015-07-01,"https://www.en-net.org/question/1815.aspx",NA
"Announcements & Nutritionists needed","ACF is looking for A SQUEAC OFFICER in Afghanistan",8235,"Michael ALVES",2015-06-30,"https://www.en-net.org/question/1812.aspx",NA
"Announcements & Nutritionists needed","ACF is lookinf for A NUTRITION AND HEALTH PROGRAM MANAGER in YEMEN",8698,"Michael ALVES",2015-06-29,"https://www.en-net.org/question/1811.aspx",NA
"Announcements & Nutritionists needed","Catholic Relief Services is looking for a Senior Technical Advisor in Nutrition!",9013,"Anonymous 3044",2015-06-25,"https://www.en-net.org/question/1808.aspx",NA
"Announcements & Nutritionists needed","Research Officer - Market Based Approaches to Poverty & Nutrition (678)",8666,"Kat Pittore",2015-06-24,"https://www.en-net.org/question/1803.aspx",NA
"Announcements & Nutritionists needed","Consultancy opportunity with World Vision for Nutrition Assessment in Sierra Leone",9341,"Judith Haase",2015-06-24,"https://www.en-net.org/question/1802.aspx",NA
"Announcements & Nutritionists needed","Consultancy opportunity with UNICEF",8998,"Tamsin",2015-06-22,"https://www.en-net.org/question/1798.aspx",NA
"Announcements & Nutritionists needed","Director, Global Initiatives / Deputy Project Director, SPRING (HKI)",8611,"Tamsin",2015-06-22,"https://www.en-net.org/question/1797.aspx",NA
"Announcements & Nutritionists needed","Health and Nutrition Manager for vulnerable populations in South Sudan",8880,"Alan Mason",2015-06-17,"https://www.en-net.org/question/1793.aspx",NA
"Announcements & Nutritionists needed","UN MEDECIN VOLTIGEUR (H/F)",9138,"Michael ALVES",2015-06-16,"https://www.en-net.org/question/1790.aspx",NA
"Announcements & Nutritionists needed","15-451: Community Health and Hygiene Promotion Manager",9174,"Anonymous 1494",2015-06-15,"https://www.en-net.org/question/1783.aspx",NA
"Announcements & Nutritionists needed","Regional Maternal, Child Health and Nutrition Specialist - East Asia",9267,"Colleen Emary",2015-06-15,"https://www.en-net.org/question/1781.aspx",NA
"Announcements & Nutritionists needed","Online survey on health research priorities  - commissioned by DFID. Opportunity to ensure nutrition priorities are included",8791,"Tamsin",2015-06-08,"https://www.en-net.org/question/1777.aspx",NA
"Announcements & Nutritionists needed","15-536: Monitoring, Evaluation, Accountability and Learning (MEAL) Manager",9607,"Anonymous 1494",2015-06-04,"https://www.en-net.org/question/1775.aspx",NA
"Announcements & Nutritionists needed","Independent Contractor, Haiti Country Program Manager",8471,"Anonymous 3007",2015-06-03,"https://www.en-net.org/question/1773.aspx",NA
"Announcements & Nutritionists needed","Research Associate position with the Tata-Cornell Agriculture and Nutrition Initiative (TCi)",9366,"Tamsin",2015-06-02,"https://www.en-net.org/question/1772.aspx",NA
"Announcements & Nutritionists needed","15-575: Nutrition Coordinator",9510,"Anonymous 1494",2015-06-02,"https://www.en-net.org/question/1769.aspx",NA
"Announcements & Nutritionists needed","15-333: Nutrition Coordinator",9217,"Anonymous 1494",2015-06-02,"https://www.en-net.org/question/1768.aspx",NA
"Announcements & Nutritionists needed","15-522: TECHNICAL WASH & NUTRITION DIRECTOR",9032,"Anonymous 1494",2015-06-02,"https://www.en-net.org/question/1767.aspx",NA
"Announcements & Nutritionists needed","15-402: Country Director - Afghanistan",8531,"Anonymous 1494",2015-06-02,"https://www.en-net.org/question/1766.aspx",NA
"Announcements & Nutritionists needed","15-560: NUTRITION ADVISOR",9116,"Anonymous 1494",2015-06-02,"https://www.en-net.org/question/1765.aspx",NA
"Announcements & Nutritionists needed","15-496: OPERATIONS AND FINANCE DIRECTOR",8848,"Anonymous 1494",2015-06-02,"https://www.en-net.org/question/1764.aspx",NA
"Announcements & Nutritionists needed","15-468: COMMUNITY ENGAGEMENT AND SOCIAL AND BEHAVIOR CHANGE ADVISOR",8860,"Anonymous 1494",2015-06-02,"https://www.en-net.org/question/1763.aspx",NA
"Announcements & Nutritionists needed","15-467: SENIOR CAPACITY DEVELOPMENT ADVISOR",8672,"Anonymous 1494",2015-06-02,"https://www.en-net.org/question/1762.aspx",NA
"Announcements & Nutritionists needed","15-465: MONITORING AND EVALUATION DIRECTOR",9170,"Anonymous 1494",2015-06-02,"https://www.en-net.org/question/1761.aspx",NA
"Announcements & Nutritionists needed","15-374: Chief of Party, USAID Afghanistan Initiative for Hygiene, Sanitation, and Nutrition (IHSAN).",8716,"Anonymous 1494",2015-06-02,"https://www.en-net.org/question/1760.aspx",NA
"Announcements & Nutritionists needed","15-581: Country Director",8828,"Anonymous 1494",2015-06-02,"https://www.en-net.org/question/1759.aspx",NA
"Announcements & Nutritionists needed","HelpAge is recruiting a Regional Health Manager (based in Amman)",8951,"Pascale Fritsch",2015-05-28,"https://www.en-net.org/question/1754.aspx",NA
"Announcements & Nutritionists needed","WFP Seeking Nutrition Advocacy Consultant",9433,"Sophia Robele",2015-05-28,"https://www.en-net.org/question/1753.aspx",NA
"Announcements & Nutritionists needed","Save the Children - Emergency Response Personel- Nutrition Adviser- French speaker",8439,"Geraldine Le Cuziat",2015-05-28,"https://www.en-net.org/question/1752.aspx",NA
"Announcements & Nutritionists needed","15-560/NUTRITION ADVISOR",8489,"Anonymous 1494",2015-05-27,"https://www.en-net.org/question/1751.aspx",NA
"Announcements & Nutritionists needed","Nutritionist, Tahoua, Niger, with Concern Worldwide",10232,"Gudrun",2015-05-27,"https://www.en-net.org/question/1749.aspx",NA
"Announcements & Nutritionists needed","Health and Nutrition Advisor, Juba, South Sudan, with Concern Worldwide",9813,"Gudrun",2015-05-27,"https://www.en-net.org/question/1748.aspx",NA
"Announcements & Nutritionists needed","Sr Nutritionist in on-going large ag/nut programme, Karamoja, Concern Worldwide",9417,"Gudrun",2015-05-27,"https://www.en-net.org/question/1747.aspx",NA
"Announcements & Nutritionists needed","Looking for key informants for an exploratory review on kwashiorkor",8682,"Nidia Huerta Uribe",2015-05-26,"https://www.en-net.org/question/1746.aspx",NA
"Announcements & Nutritionists needed","ACF is looking for A NUTRITION AND HEALTH COORDINATOR - LIBERIA",9091,"Michael ALVES",2015-05-22,"https://www.en-net.org/question/1741.aspx",NA
"Announcements & Nutritionists needed","ACF recherche UN COORDINATEUR NUTRITION ET SANTE (H/F) au TCHAD",8757,"Marie Lecuyer",2015-05-20,"https://www.en-net.org/question/1738.aspx",NA
"Announcements & Nutritionists needed","ACF recherche UN EXPERT NUTRITION ET SANTE basé à DJIBOUTI",8475,"Marie Lecuyer",2015-05-20,"https://www.en-net.org/question/1737.aspx",NA
"Announcements & Nutritionists needed","15-333: Nutrition Coordinator",9013,"Anonymous 1494",2015-05-14,"https://www.en-net.org/question/1732.aspx",NA
"Announcements & Nutritionists needed","ACF is looking for A SMART ROVING SURVEY PROGRAM MANAGER",9183,"Michael ALVES",2015-05-11,"https://www.en-net.org/question/1725.aspx",NA
"Announcements & Nutritionists needed","ACF is looking for A MOTHER AND CHILD AND NUTRITION TECHNICAL COORDINATOR in Haiti",8723,"Michael ALVES",2015-05-11,"https://www.en-net.org/question/1724.aspx",NA
"Announcements & Nutritionists needed","15-444/Emergency Nutrition Manager",8996,"Anonymous 1494",2015-05-07,"https://www.en-net.org/question/1717.aspx",NA
"Announcements & Nutritionists needed","15-333/Nutrition Coordinator",8644,"Anonymous 1494",2015-05-07,"https://www.en-net.org/question/1716.aspx",NA
"Announcements & Nutritionists needed","SAVE THE DATE - Link NCA presentation webinar, May 13th",10043,"Julien Morel",2015-05-07,"https://www.en-net.org/question/1715.aspx",NA
"Announcements & Nutritionists needed","SMART survey consultancy S Sudan (Juba) with Concern Worldwide",10246,"Gudrun",2015-05-07,"https://www.en-net.org/question/1714.aspx",NA
"Announcements & Nutritionists needed","SMART survey consultancy S Sudan (Unity State) with Concern Worldwide",9969,"Gudrun",2015-05-07,"https://www.en-net.org/question/1713.aspx",NA
"Announcements & Nutritionists needed","Senior regional Nutrition and Food Security Officer based in Kenya",9731,"Anonymous 40",2015-05-07,"https://www.en-net.org/question/1712.aspx",NA
"Announcements & Nutritionists needed","CARE USA seeks Program Nutrition Manager in South Sudan",8906,"Tamsin",2015-05-06,"https://www.en-net.org/question/1711.aspx",NA
"Announcements & Nutritionists needed","Nutrition in Emergencies Consultancy - UNICEF East Asia Pacific Regional Office",9534,"Megan Gayford",2015-05-01,"https://www.en-net.org/question/1706.aspx",NA
"Announcements & Nutritionists needed","CONCERN WORLDWIDE is looking for Area Coordinators in the DRC",8912,"Delia Dumbravescu",2015-04-30,"https://www.en-net.org/question/1705.aspx",NA
"Announcements & Nutritionists needed","Medair seeks a Nutrition Project Manager in Afghanistan",8886,"Alan Mason",2015-04-30,"https://www.en-net.org/question/1704.aspx",NA
"Announcements & Nutritionists needed","UNICEF seeks French speaking consultants for SMART surveys - WCAR region",8372,"Sara Gari",2015-04-29,"https://www.en-net.org/question/1702.aspx",NA
"Announcements & Nutritionists needed","USAID is looking for a nutrionist for the Office of Food for Peace",9244,"Judy Canahuati",2015-04-23,"https://www.en-net.org/question/1698.aspx",NA
"Announcements & Nutritionists needed","UNICEF Myanmar is seeking a Health & Nutrition Specialist (P3) based in Sittwe field office - deadline 28 April",8554,"Martin Eklund",2015-04-23,"https://www.en-net.org/question/1697.aspx",NA
"Announcements & Nutritionists needed","HelpAge is recruiting a Regional Nutrition Programme Manager (based in Nairobi)",9137,"Pascale Fritsch",2015-04-22,"https://www.en-net.org/question/1695.aspx",NA
"Announcements & Nutritionists needed","IRC seeks Nutrition Technical Advisor for New York HQ",8872,"Tamsin",2015-04-21,"https://www.en-net.org/question/1694.aspx",NA
"Announcements & Nutritionists needed","Nutrition Advisor, USAID (USDA/FAS ""Schedule B"" position based in USAID)",9592,"Anonymous 2918",2015-04-17,"https://www.en-net.org/question/1689.aspx",NA
"Announcements & Nutritionists needed","Opportunity for experienced Nutritionist in Niger",8853,"David Kilcline",2015-04-15,"https://www.en-net.org/question/1688.aspx",NA
"Announcements & Nutritionists needed","SNV BCC consultancy in Zambia",9378,"Tamsin",2015-04-15,"https://www.en-net.org/question/1687.aspx",NA
"Announcements & Nutritionists needed","ENN seeks French speaking nutritionist for short-term consultancy",7882,"Tamsin",2015-04-15,"https://www.en-net.org/question/1686.aspx",NA
"Announcements & Nutritionists needed","Vacancy: Programme Manager",8091,"Verena Heinreichsberger",2015-04-14,"https://www.en-net.org/question/1684.aspx",NA
"Announcements & Nutritionists needed","3 vacancies to support the set up of nutrition information platforms in various countries",8337,"Anonymous 2915",2015-04-14,"https://www.en-net.org/question/1683.aspx",NA
"Announcements & Nutritionists needed","Concern is looking for a consultant for Zambia to design baseline survey and monitoring tools",9162,"Regine Kopplow",2015-04-13,"https://www.en-net.org/question/1681.aspx",NA
"Announcements & Nutritionists needed","ACF reccherche UN CHARGE DE PROGRAMME EN SANTE & NUTRITION (H/F) en RCA",8070,"Marie Lecuyer",2015-04-09,"https://www.en-net.org/question/1680.aspx",NA
"Announcements & Nutritionists needed","ACF is looking for A NUTRITION TRAINING EXPERT in  AFGHANISTAN",8295,"Marie Lecuyer",2015-04-09,"https://www.en-net.org/question/1679.aspx",NA
"Announcements & Nutritionists needed","Nutrition Specialist in Emergencies Job Announcement",8575,"Ivennie Matika",2015-04-08,"https://www.en-net.org/question/1677.aspx",NA
