"Theme","Topic","Views","Author","Posted","Link","Replies"
"Announcements & Nutritionists needed","Welthungerhilfe seeks an Advisor on Food and Nutrition Security in Pakistan",4882,"Tamsin Walters",2015-08-27,"https://www.en-net.org/question/1900.aspx",NA
"Announcements & Nutritionists needed","Nutrition Advisor",4949,"Alan Mason",2015-08-26,"https://www.en-net.org/question/1897.aspx",NA
"Announcements & Nutritionists needed","ACF recherche UN RESPONSABLE DE PROGRAMME NUTRITION ET SANTE  en  RCA",4346,"Michael ALVES",2015-08-26,"https://www.en-net.org/question/1896.aspx",NA
"Announcements & Nutritionists needed","International consultant (Oct-Dec 2015) to support the nutrition unit at WHO IST/WA office Based in Ouagadougou",5214,"Elisa Dominguez",2015-08-26,"https://www.en-net.org/question/1895.aspx",NA
"Announcements & Nutritionists needed","ACF is looking for A NUTRITION AND HEALTH PROGRAM MANAGER in MYANMAR",4675,"Michael ALVES",2015-08-26,"https://www.en-net.org/question/1894.aspx",NA
"Announcements & Nutritionists needed","New app to calculate the size of babies using the INTERGROWTH-21st Standards",4839,"Tamsin Walters",2015-08-20,"https://www.en-net.org/question/1886.aspx",NA
"Announcements & Nutritionists needed","Health & Nutrition Director RWANU, Uganda, Concern Worldwide",5599,"Ciara Passmore",2015-08-20,"https://www.en-net.org/question/1884.aspx",NA
"Announcements & Nutritionists needed","Emergency Response Team (ERT) Nutrition Project Manager",4973,"Alan Mason",2015-08-19,"https://www.en-net.org/question/1882.aspx",NA
"Announcements & Nutritionists needed","Senior Emergency Nutrition Advisor (50% position)",5178,"Colleen Emary",2015-08-18,"https://www.en-net.org/question/1878.aspx",NA
"Announcements & Nutritionists needed","15-820: Technical Surge Advisor- CMAM",4859,"Anonymous 1494",2015-08-13,"https://www.en-net.org/question/1875.aspx",NA
"Announcements & Nutritionists needed","15-812: Technical Surge Advisor- SBC",4907,"Anonymous 1494",2015-08-13,"https://www.en-net.org/question/1874.aspx",NA
"Announcements & Nutritionists needed","Health and Nutrition Programme Manager, Chad, Concern Worldwide",5399,"Ciara Passmore",2015-08-13,"https://www.en-net.org/question/1872.aspx",NA
"Announcements & Nutritionists needed","Health & Nutrition Coord (Maternity), Malawi, Concern Worldwide",5306,"Ciara Passmore",2015-08-13,"https://www.en-net.org/question/1871.aspx",NA
"Announcements & Nutritionists needed","Senior Nutritionist in Karamoja, Uganda with Concern Worldwide",5175,"Ciara Passmore",2015-08-13,"https://www.en-net.org/question/1870.aspx",NA
"Announcements & Nutritionists needed","15-812: Technical Surge Advisor- SBC",4559,"Anonymous 1494",2015-08-13,"https://www.en-net.org/question/1869.aspx",NA
"Announcements & Nutritionists needed","15-820: Technical Surge Advisor- CMAM",4727,"Anonymous 1494",2015-08-13,"https://www.en-net.org/question/1868.aspx",NA
"Announcements & Nutritionists needed","Infant and Young Child Feeding in Emergencies - Technical Surge Advisor SCUK",4886,"Megan",2015-08-12,"https://www.en-net.org/question/1865.aspx",NA
"Announcements & Nutritionists needed","15-648: Food Security and Livelihoods Consultant",5267,"Anonymous 1494",2015-08-11,"https://www.en-net.org/question/1864.aspx",NA
"Announcements & Nutritionists needed","Vacancy Job #15-820 Technical Surge Advisor - CMAM",5066,"Anonymous 1494",2015-08-11,"https://www.en-net.org/question/1863.aspx",NA
"Announcements & Nutritionists needed","Vacancy - Job# 15-812 Technical Surge Advisor - SBC",4646,"Anonymous 1494",2015-08-11,"https://www.en-net.org/question/1862.aspx",NA
"Announcements & Nutritionists needed","Nutrition Coordinator, Zambia Female Youths Livelihood and Nutrition Enhancement Project",5465,"Ciara Passmore",2015-08-11,"https://www.en-net.org/question/1861.aspx",NA
"Announcements & Nutritionists needed","Project Coordinator, Zambia Female Youths Livelihood and Nutrition Enhancement Project",5041,"Ciara Passmore",2015-08-11,"https://www.en-net.org/question/1860.aspx",NA
"Announcements & Nutritionists needed","Nutrition Coordinator, Concern Worldwide Zambia, for the Female Youths Livelihood and Nutrition Enhancement Project",5310,"Regine Kopplow",2015-08-10,"https://www.en-net.org/question/1859.aspx",NA
"Announcements & Nutritionists needed","Project Coordinator, Concern Worldwide Zambia, for the Female Youths Livelihood and Nutrition Enhancement Project",5409,"Regine Kopplow",2015-08-10,"https://www.en-net.org/question/1858.aspx",NA
"Announcements & Nutritionists needed","Internship Opportunity inquiry",4525,"nakyanzi teddy",2015-08-06,"https://www.en-net.org/question/1855.aspx",NA
"Announcements & Nutritionists needed","CMAM Forum Coordinator",6550,"Jose Luis Alvarez Moran",2015-08-06,"https://www.en-net.org/question/1854.aspx",NA
"Announcements & Nutritionists needed","Vacancy - 5 weeks home based consultancy for Helen Keller International",5473,"David Doledec",2015-08-05,"https://www.en-net.org/question/1853.aspx",NA
"Announcements & Nutritionists needed","15-575: Nutrition Coordinator",4745,"Anonymous 1494",2015-08-04,"https://www.en-net.org/question/1852.aspx",NA
"Announcements & Nutritionists needed","15-648: Food Security and Livelihoods Consultant",4789,"Anonymous 1494",2015-08-04,"https://www.en-net.org/question/1851.aspx",NA
"Announcements & Nutritionists needed","Infant and Young Child Feeding in Emergencies (IYCF-E) Consultancy  - Save the Children",5906,"Christine Fernandes",2015-08-03,"https://www.en-net.org/question/1850.aspx",NA
"Announcements & Nutritionists needed","Consultancy: 5 weeks consultancy to update a survey database and conduct initial analysis",5228,"Rosalia Lorenzen",2015-08-03,"https://www.en-net.org/question/1849.aspx",NA
"Announcements & Nutritionists needed","Nepal Nutrition and Food Security Portal",4671,"Sophiya Uprety",2015-07-29,"https://www.en-net.org/question/1845.aspx",NA
"Announcements & Nutritionists needed","Global Knowledge Management Coordinator",6069,"Tamsin Walters",2015-07-27,"https://www.en-net.org/question/1842.aspx",NA
"Announcements & Nutritionists needed","Nutrition & Health Advisor , New York, Concern Worldwide",5125,"Regine Kopplow",2015-07-23,"https://www.en-net.org/question/1839.aspx",NA
"Announcements & Nutritionists needed","Communications and Advocacy Adviser vacancy",5172,"Georgina Nicoli",2015-07-22,"https://www.en-net.org/question/1838.aspx",NA
"Announcements & Nutritionists needed","15-750: Nutrition Associate - Mercy Corps",5581,"Tamsin Walters",2015-07-21,"https://www.en-net.org/question/1834.aspx",NA
"Announcements & Nutritionists needed","Job Vacancy: Community Management of Acute Malnutrition (CMAM) Advisor, India",5763,"Joseph Galabuzi",2015-07-20,"https://www.en-net.org/question/1833.aspx",NA
"Announcements & Nutritionists needed","Action Contre la Faim is looking for a consultant position on writing an Operational Manual for promoting the WASH in Nutrition Strategy",5279,"Julien Morel",2015-07-10,"https://www.en-net.org/question/1827.aspx",NA
"Announcements & Nutritionists needed","IAEA Nutrition Specialist (P4)",6081,"Victor Owino",2015-07-07,"https://www.en-net.org/question/1823.aspx",NA
"Announcements & Nutritionists needed","Advertisement",5329,"Anonymous 2725",2015-07-01,"https://www.en-net.org/question/1816.aspx",NA
"Announcements & Nutritionists needed","ACF is looking for UN COORDINATEUR TECHNIQUE SANTE MATERNELLE ET INFANTILE ET NUTRITION (SMIN) (H/F) in Haiti",4896,"Michael ALVES",2015-07-01,"https://www.en-net.org/question/1815.aspx",NA
"Announcements & Nutritionists needed","ACF is looking for A SQUEAC OFFICER in Afghanistan",4558,"Michael ALVES",2015-06-30,"https://www.en-net.org/question/1812.aspx",NA
"Announcements & Nutritionists needed","ACF is lookinf for A NUTRITION AND HEALTH PROGRAM MANAGER in YEMEN",4720,"Michael ALVES",2015-06-29,"https://www.en-net.org/question/1811.aspx",NA
"Announcements & Nutritionists needed","Catholic Relief Services is looking for a Senior Technical Advisor in Nutrition!",4792,"Anonymous 3044",2015-06-25,"https://www.en-net.org/question/1808.aspx",NA
"Announcements & Nutritionists needed","Research Officer - Market Based Approaches to Poverty & Nutrition (678)",4890,"Kat Pittore",2015-06-24,"https://www.en-net.org/question/1803.aspx",NA
"Announcements & Nutritionists needed","Consultancy opportunity with World Vision for Nutrition Assessment in Sierra Leone",5223,"Judith Haase",2015-06-24,"https://www.en-net.org/question/1802.aspx",NA
"Announcements & Nutritionists needed","Consultancy opportunity with UNICEF",5154,"Tamsin Walters",2015-06-22,"https://www.en-net.org/question/1798.aspx",NA
"Announcements & Nutritionists needed","Director, Global Initiatives / Deputy Project Director, SPRING (HKI)",4619,"Tamsin Walters",2015-06-22,"https://www.en-net.org/question/1797.aspx",NA
"Announcements & Nutritionists needed","Health and Nutrition Manager for vulnerable populations in South Sudan",4887,"Alan Mason",2015-06-17,"https://www.en-net.org/question/1793.aspx",NA
"Announcements & Nutritionists needed","UN MEDECIN VOLTIGEUR (H/F)",5276,"Michael ALVES",2015-06-16,"https://www.en-net.org/question/1790.aspx",NA
"Announcements & Nutritionists needed","15-451: Community Health and Hygiene Promotion Manager",5238,"Anonymous 1494",2015-06-15,"https://www.en-net.org/question/1783.aspx",NA
"Announcements & Nutritionists needed","Regional Maternal, Child Health and Nutrition Specialist - East Asia",5430,"Colleen Emary",2015-06-15,"https://www.en-net.org/question/1781.aspx",NA
"Announcements & Nutritionists needed","Online survey on health research priorities  - commissioned by DFID. Opportunity to ensure nutrition priorities are included",4913,"Tamsin Walters",2015-06-08,"https://www.en-net.org/question/1777.aspx",NA
"Announcements & Nutritionists needed","15-536: Monitoring, Evaluation, Accountability and Learning (MEAL) Manager",5387,"Anonymous 1494",2015-06-04,"https://www.en-net.org/question/1775.aspx",NA
"Announcements & Nutritionists needed","Independent Contractor, Haiti Country Program Manager",4715,"Anonymous 3007",2015-06-03,"https://www.en-net.org/question/1773.aspx",NA
"Announcements & Nutritionists needed","Research Associate position with the Tata-Cornell Agriculture and Nutrition Initiative (TCi)",5298,"Tamsin Walters",2015-06-02,"https://www.en-net.org/question/1772.aspx",NA
"Announcements & Nutritionists needed","15-575: Nutrition Coordinator",5552,"Anonymous 1494",2015-06-02,"https://www.en-net.org/question/1769.aspx",NA
"Announcements & Nutritionists needed","15-333: Nutrition Coordinator",5143,"Anonymous 1494",2015-06-02,"https://www.en-net.org/question/1768.aspx",NA
"Announcements & Nutritionists needed","15-522: TECHNICAL WASH & NUTRITION DIRECTOR",5122,"Anonymous 1494",2015-06-02,"https://www.en-net.org/question/1767.aspx",NA
"Announcements & Nutritionists needed","15-402: Country Director - Afghanistan",4760,"Anonymous 1494",2015-06-02,"https://www.en-net.org/question/1766.aspx",NA
"Announcements & Nutritionists needed","15-560: NUTRITION ADVISOR",5254,"Anonymous 1494",2015-06-02,"https://www.en-net.org/question/1765.aspx",NA
"Announcements & Nutritionists needed","15-496: OPERATIONS AND FINANCE DIRECTOR",4968,"Anonymous 1494",2015-06-02,"https://www.en-net.org/question/1764.aspx",NA
"Announcements & Nutritionists needed","15-468: COMMUNITY ENGAGEMENT AND SOCIAL AND BEHAVIOR CHANGE ADVISOR",5011,"Anonymous 1494",2015-06-02,"https://www.en-net.org/question/1763.aspx",NA
"Announcements & Nutritionists needed","15-467: SENIOR CAPACITY DEVELOPMENT ADVISOR",4990,"Anonymous 1494",2015-06-02,"https://www.en-net.org/question/1762.aspx",NA
"Announcements & Nutritionists needed","15-465: MONITORING AND EVALUATION DIRECTOR",5326,"Anonymous 1494",2015-06-02,"https://www.en-net.org/question/1761.aspx",NA
"Announcements & Nutritionists needed","15-374: Chief of Party, USAID Afghanistan Initiative for Hygiene, Sanitation, and Nutrition (IHSAN).",5022,"Anonymous 1494",2015-06-02,"https://www.en-net.org/question/1760.aspx",NA
"Announcements & Nutritionists needed","15-581: Country Director",4811,"Anonymous 1494",2015-06-02,"https://www.en-net.org/question/1759.aspx",NA
"Announcements & Nutritionists needed","HelpAge is recruiting a Regional Health Manager (based in Amman)",5127,"Pascale Fritsch",2015-05-28,"https://www.en-net.org/question/1754.aspx",NA
"Announcements & Nutritionists needed","WFP Seeking Nutrition Advocacy Consultant",5337,"Sophia Robele",2015-05-28,"https://www.en-net.org/question/1753.aspx",NA
"Announcements & Nutritionists needed","Save the Children - Emergency Response Personel- Nutrition Adviser- French speaker",4775,"Geraldine Le Cuziat",2015-05-28,"https://www.en-net.org/question/1752.aspx",NA
"Announcements & Nutritionists needed","15-560/NUTRITION ADVISOR",4671,"Anonymous 1494",2015-05-27,"https://www.en-net.org/question/1751.aspx",NA
"Announcements & Nutritionists needed","Nutritionist, Tahoua, Niger, with Concern Worldwide",6028,"Anonymous 130",2015-05-27,"https://www.en-net.org/question/1749.aspx",NA
"Announcements & Nutritionists needed","Health and Nutrition Advisor, Juba, South Sudan, with Concern Worldwide",5852,"Anonymous 130",2015-05-27,"https://www.en-net.org/question/1748.aspx",NA
"Announcements & Nutritionists needed","Sr Nutritionist in on-going large ag/nut programme, Karamoja, Concern Worldwide",5083,"Anonymous 130",2015-05-27,"https://www.en-net.org/question/1747.aspx",NA
"Announcements & Nutritionists needed","Looking for key informants for an exploratory review on kwashiorkor",4839,"Nidia Huerta Uribe",2015-05-26,"https://www.en-net.org/question/1746.aspx",NA
"Announcements & Nutritionists needed","ACF is looking for A NUTRITION AND HEALTH COORDINATOR - LIBERIA",5077,"Michael ALVES",2015-05-22,"https://www.en-net.org/question/1741.aspx",NA
"Announcements & Nutritionists needed","ACF recherche UN COORDINATEUR NUTRITION ET SANTE (H/F) au TCHAD",5053,"Marie Lecuyer",2015-05-20,"https://www.en-net.org/question/1738.aspx",NA
"Announcements & Nutritionists needed","ACF recherche UN EXPERT NUTRITION ET SANTE basé à DJIBOUTI",4553,"Marie Lecuyer",2015-05-20,"https://www.en-net.org/question/1737.aspx",NA
"Announcements & Nutritionists needed","15-333: Nutrition Coordinator",5054,"Anonymous 1494",2015-05-14,"https://www.en-net.org/question/1732.aspx",NA
"Announcements & Nutritionists needed","ACF is looking for A SMART ROVING SURVEY PROGRAM MANAGER",5383,"Michael ALVES",2015-05-11,"https://www.en-net.org/question/1725.aspx",NA
"Announcements & Nutritionists needed","ACF is looking for A MOTHER AND CHILD AND NUTRITION TECHNICAL COORDINATOR in Haiti",4976,"Michael ALVES",2015-05-11,"https://www.en-net.org/question/1724.aspx",NA
"Announcements & Nutritionists needed","15-444/Emergency Nutrition Manager",5177,"Anonymous 1494",2015-05-07,"https://www.en-net.org/question/1717.aspx",NA
"Announcements & Nutritionists needed","15-333/Nutrition Coordinator",4804,"Anonymous 1494",2015-05-07,"https://www.en-net.org/question/1716.aspx",NA
"Announcements & Nutritionists needed","SAVE THE DATE - Link NCA presentation webinar, May 13th",5947,"Julien Morel",2015-05-07,"https://www.en-net.org/question/1715.aspx",NA
"Announcements & Nutritionists needed","SMART survey consultancy S Sudan (Juba) with Concern Worldwide",5688,"Anonymous 130",2015-05-07,"https://www.en-net.org/question/1714.aspx",NA
"Announcements & Nutritionists needed","SMART survey consultancy S Sudan (Unity State) with Concern Worldwide",5835,"Anonymous 130",2015-05-07,"https://www.en-net.org/question/1713.aspx",NA
"Announcements & Nutritionists needed","Senior regional Nutrition and Food Security Officer based in Kenya",5530,"Anonymous 40",2015-05-07,"https://www.en-net.org/question/1712.aspx",NA
"Announcements & Nutritionists needed","CARE USA seeks Program Nutrition Manager in South Sudan",4969,"Tamsin Walters",2015-05-06,"https://www.en-net.org/question/1711.aspx",NA
"Announcements & Nutritionists needed","Nutrition in Emergencies Consultancy - UNICEF East Asia Pacific Regional Office",5527,"Megan Gayford",2015-05-01,"https://www.en-net.org/question/1706.aspx",NA
"Announcements & Nutritionists needed","CONCERN WORLDWIDE is looking for Area Coordinators in the DRC",5174,"Delia Dumbravescu",2015-04-30,"https://www.en-net.org/question/1705.aspx",NA
"Announcements & Nutritionists needed","Medair seeks a Nutrition Project Manager in Afghanistan",5025,"Alan Mason",2015-04-30,"https://www.en-net.org/question/1704.aspx",NA
"Announcements & Nutritionists needed","UNICEF seeks French speaking consultants for SMART surveys - WCAR region",4502,"Sara Gari",2015-04-29,"https://www.en-net.org/question/1702.aspx",NA
"Announcements & Nutritionists needed","USAID is looking for a nutrionist for the Office of Food for Peace",5259,"Judy Canahuati",2015-04-23,"https://www.en-net.org/question/1698.aspx",NA
"Announcements & Nutritionists needed","UNICEF Myanmar is seeking a Health & Nutrition Specialist (P3) based in Sittwe field office - deadline 28 April",4779,"Martin Eklund",2015-04-23,"https://www.en-net.org/question/1697.aspx",NA
"Announcements & Nutritionists needed","HelpAge is recruiting a Regional Nutrition Programme Manager (based in Nairobi)",5033,"Pascale Fritsch",2015-04-22,"https://www.en-net.org/question/1695.aspx",NA
"Announcements & Nutritionists needed","IRC seeks Nutrition Technical Advisor for New York HQ",5011,"Tamsin Walters",2015-04-21,"https://www.en-net.org/question/1694.aspx",NA
"Announcements & Nutritionists needed","Nutrition Advisor, USAID (USDA/FAS ""Schedule B"" position based in USAID)",5435,"Anonymous 2918",2015-04-17,"https://www.en-net.org/question/1689.aspx",NA
"Announcements & Nutritionists needed","Opportunity for experienced Nutritionist in Niger",4861,"David Kilcline",2015-04-15,"https://www.en-net.org/question/1688.aspx",NA
"Announcements & Nutritionists needed","SNV BCC consultancy in Zambia",5143,"Tamsin Walters",2015-04-15,"https://www.en-net.org/question/1687.aspx",NA
"Announcements & Nutritionists needed","ENN seeks French speaking nutritionist for short-term consultancy",4205,"Tamsin Walters",2015-04-15,"https://www.en-net.org/question/1686.aspx",NA
"Announcements & Nutritionists needed","Vacancy: Programme Manager",4453,"Verena Heinreichsberger",2015-04-14,"https://www.en-net.org/question/1684.aspx",NA
"Announcements & Nutritionists needed","3 vacancies to support the set up of nutrition information platforms in various countries",4749,"Anonymous 2915",2015-04-14,"https://www.en-net.org/question/1683.aspx",NA
"Announcements & Nutritionists needed","Concern is looking for a consultant for Zambia to design baseline survey and monitoring tools",5180,"Regine Kopplow",2015-04-13,"https://www.en-net.org/question/1681.aspx",NA
"Announcements & Nutritionists needed","ACF reccherche UN CHARGE DE PROGRAMME EN SANTE & NUTRITION (H/F) en RCA",4384,"Marie Lecuyer",2015-04-09,"https://www.en-net.org/question/1680.aspx",NA
"Announcements & Nutritionists needed","ACF is looking for A NUTRITION TRAINING EXPERT in  AFGHANISTAN",4450,"Marie Lecuyer",2015-04-09,"https://www.en-net.org/question/1679.aspx",NA
"Announcements & Nutritionists needed","Nutrition Specialist in Emergencies Job Announcement",4792,"Ivennie Matika",2015-04-08,"https://www.en-net.org/question/1677.aspx",NA
"Announcements & Nutritionists needed","London School of Hygiene and Tropical Medicine seeks research fellow in Nutrition and Sustainability",5256,"Tamsin Walters",2015-04-01,"https://www.en-net.org/question/1673.aspx",NA
"Announcements & Nutritionists needed","Consultant to join OPML Nutrition Portfolio",4922,"Tamsin Walters",2015-04-01,"https://www.en-net.org/question/1671.aspx",NA
"Announcements & Nutritionists needed","Consultant needed for Link NCA nutrition response analysis guidance",5207,"Julien Morel",2015-03-30,"https://www.en-net.org/question/1667.aspx",NA
"Announcements & Nutritionists needed","ACF is looking for A NUTRITION AND HEALTH PROGRAM MANAGER - FLYING",4627,"Marie Lecuyer",2015-03-25,"https://www.en-net.org/question/1663.aspx",NA
"Announcements & Nutritionists needed","ACF is looking for A NUTRITION AND HEALTH COORDINATOR - FLYING",4781,"Marie Lecuyer",2015-03-25,"https://www.en-net.org/question/1662.aspx",NA
"Announcements & Nutritionists needed","ACF is looking for A NUTRITION AND HEALTH PROGRAM MANAGER in SIERRA LEONE",4520,"Marie LECUYER",2015-03-20,"https://www.en-net.org/question/1658.aspx",NA
"Announcements & Nutritionists needed","ACF is looking for A NUTRITION SURVEILLANCE EXPERT - SIERRA LEONE",5108,"Marie LECUYER",2015-03-20,"https://www.en-net.org/question/1657.aspx",NA
"Announcements & Nutritionists needed","ACF is looking for A HEALTH PROGRAM DEPUTY COORDINATOR in SIERRA LEONE",4651,"Marie Lecuyer",2015-03-17,"https://www.en-net.org/question/1651.aspx",NA
"Announcements & Nutritionists needed","ACF is looking for A NUTRITION AND HEALTH COORDINATOR in Ethiopia",4813,"Marie Lecuyer",2015-03-17,"https://www.en-net.org/question/1650.aspx",NA
"Announcements & Nutritionists needed","Regional Humanitarian Health Programme Manager based in Amman, Jordan",4584,"Pascale Fritsch",2015-03-16,"https://www.en-net.org/question/1649.aspx",NA
"Announcements & Nutritionists needed","Consultant Needed for Stunting Prevention Project",5435,"Anonymous 2865",2015-03-16,"https://www.en-net.org/question/1648.aspx",NA
"Announcements & Nutritionists needed","JOB OPENING: Nutrition Component Manager",5300,"Anonymous 2705",2015-03-10,"https://www.en-net.org/question/1647.aspx",NA
"Announcements & Nutritionists needed","Concern Worldwide is seeking a HEALTH & NUTRITION MANAGER for programme start-up in CAR",5121,"David Kilcline",2015-03-06,"https://www.en-net.org/question/1646.aspx",NA
"Announcements & Nutritionists needed","Concern Worldwide is hiring a HEALTH & NUTRITION ADVISER in West Darfur",5537,"David Kilcline",2015-03-06,"https://www.en-net.org/question/1645.aspx",NA
"Announcements & Nutritionists needed","Concern Worldwide seeks an Emergency Coordinator in Niger",5060,"Tamsin Walters",2015-03-03,"https://www.en-net.org/question/1641.aspx",NA
"Announcements & Nutritionists needed","Experienced data analyst (DHS data) needed",4695,"Marie McGrath",2015-02-26,"https://www.en-net.org/question/1636.aspx",NA
"Announcements & Nutritionists needed","Nutrition Specialist (Community) - 6 months Maternity Cover",5101,"Erin McCloskey-Rebelo",2015-02-23,"https://www.en-net.org/question/1630.aspx",NA
"Announcements & Nutritionists needed","ACF is looking for a Link NCA PROJECT COORDINATOR",4842,"Julien Morel",2015-02-22,"https://www.en-net.org/question/1629.aspx",NA
"Announcements & Nutritionists needed","Communications and Advocacy Adviser Vacancy, based in Malawi",4941,"Georgina Nicoli",2015-02-20,"https://www.en-net.org/question/1628.aspx",NA
"Announcements & Nutritionists needed","ACF is looking for a MEDICAL DOCTOR in Myanmar",4636,"Marie Lecuyer",2015-02-18,"https://www.en-net.org/question/1624.aspx",NA
"Announcements & Nutritionists needed","ProPAN Consultant",5180,"Erin McCloskey-Rebelo",2015-02-17,"https://www.en-net.org/question/1622.aspx",NA
"Announcements & Nutritionists needed","ACF is looking for A NUTRITION AND HEALTH PROGRAM MANAGER  in  MYANMAR",4417,"Marie Lecuyer",2015-02-16,"https://www.en-net.org/question/1621.aspx",NA
"Announcements & Nutritionists needed","ACF is looking for A NUTRITION AND HEALTH COORDINATOR in YEMEN",4389,"Marie Lecuyer",2015-02-11,"https://www.en-net.org/question/1619.aspx",NA
"Announcements & Nutritionists needed","ACF is looking for A NUTRITION AND HEALTH PROGRAM MANAGER in YEMEN",4721,"Marie Lecuyer",2015-02-11,"https://www.en-net.org/question/1618.aspx",NA
"Announcements & Nutritionists needed","New article: Imperial College London’s Samrat Singh looks at what governments and their development partners can do to enable shattered agricultural markets to bounce back from the Ebola crisis.",9500,"Tamsin Walters",2015-02-09,"https://www.en-net.org/question/1616.aspx",NA
"Announcements & Nutritionists needed","Recruiting Nutrition Scientist for WorldFish Bangladesh",4708,"Tamsin Walters",2015-02-09,"https://www.en-net.org/question/1615.aspx",NA
"Announcements & Nutritionists needed","London School of Hygiene and Tropical Medicine studentship",4964,"Tamsin Walters",2015-02-09,"https://www.en-net.org/question/1614.aspx",NA
"Announcements & Nutritionists needed","UNICEF Mali seeks Nutrition Cluster Coordinator",5509,"Tamsin Walters",2015-02-05,"https://www.en-net.org/question/1609.aspx",NA
"Announcements & Nutritionists needed","Concern: consultant required for Zambia on nutrition sensitive conservation agriculture",4956,"Regine Kopplow",2015-02-04,"https://www.en-net.org/question/1606.aspx",NA
"Announcements & Nutritionists needed","Consultancy to develop a nutritional training in Haiti",5329,"Tamsin Walters",2015-02-02,"https://www.en-net.org/question/1605.aspx",NA
"Announcements & Nutritionists needed","SPRING Monitoring & Evaluation Specialist Vacancy- Agriculture & Nutrition",5597,"Tamsin Walters",2015-02-02,"https://www.en-net.org/question/1604.aspx",NA
"Announcements & Nutritionists needed","Country Manager, Bangladesh - GAIN (Global Alliance for Improved Nutrition)",5071,"Anonymous 2802",2015-01-28,"https://www.en-net.org/question/1599.aspx",NA
"Announcements & Nutritionists needed","ACF is looking for a MEDICAL DOCTOR in Myanmar",4098,"Marie Lecuyer",2015-01-28,"https://www.en-net.org/question/1598.aspx",NA
"Announcements & Nutritionists needed","HelpAge International is looking for a Nutrition Coordinator in Juba",4674,"Pascale Fritsch",2015-01-27,"https://www.en-net.org/question/1597.aspx",NA
"Announcements & Nutritionists needed","BBC seeks a  Health Research Manager",4960,"Tamsin Walters",2015-01-27,"https://www.en-net.org/question/1596.aspx",NA
