"Theme","Topic","Views","Author","Posted","Link","Replies"
"Announcements & Nutritionists needed","Communications and Advocacy Adviser vacancy",7909,"Georgina Nicoli",2015-07-22,"https://www.en-net.org/question/1838.aspx",NA
"Announcements & Nutritionists needed","15-750: Nutrition Associate - Mercy Corps",8387,"Tamsin Walters",2015-07-21,"https://www.en-net.org/question/1834.aspx",NA
"Announcements & Nutritionists needed","Job Vacancy: Community Management of Acute Malnutrition (CMAM) Advisor, India",8716,"Joseph Galabuzi",2015-07-20,"https://www.en-net.org/question/1833.aspx",NA
"Announcements & Nutritionists needed","Action Contre la Faim is looking for a consultant position on writing an Operational Manual for promoting the WASH in Nutrition Strategy",8059,"Julien Morel",2015-07-10,"https://www.en-net.org/question/1827.aspx",NA
"Announcements & Nutritionists needed","IAEA Nutrition Specialist (P4)",8887,"Victor Owino",2015-07-07,"https://www.en-net.org/question/1823.aspx",NA
"Announcements & Nutritionists needed","Advertisement",8181,"Anonymous 2725",2015-07-01,"https://www.en-net.org/question/1816.aspx",NA
"Announcements & Nutritionists needed","ACF is looking for UN COORDINATEUR TECHNIQUE SANTE MATERNELLE ET INFANTILE ET NUTRITION (SMIN) (H/F) in Haiti",7632,"Michael ALVES",2015-07-01,"https://www.en-net.org/question/1815.aspx",NA
"Announcements & Nutritionists needed","ACF is looking for A SQUEAC OFFICER in Afghanistan",7130,"Michael ALVES",2015-06-30,"https://www.en-net.org/question/1812.aspx",NA
"Announcements & Nutritionists needed","ACF is lookinf for A NUTRITION AND HEALTH PROGRAM MANAGER in YEMEN",7368,"Michael ALVES",2015-06-29,"https://www.en-net.org/question/1811.aspx",NA
"Announcements & Nutritionists needed","Catholic Relief Services is looking for a Senior Technical Advisor in Nutrition!",7604,"Anonymous 3044",2015-06-25,"https://www.en-net.org/question/1808.aspx",NA
"Announcements & Nutritionists needed","Research Officer - Market Based Approaches to Poverty & Nutrition (678)",7554,"Kat Pittore",2015-06-24,"https://www.en-net.org/question/1803.aspx",NA
"Announcements & Nutritionists needed","Consultancy opportunity with World Vision for Nutrition Assessment in Sierra Leone",7939,"Judith Haase",2015-06-24,"https://www.en-net.org/question/1802.aspx",NA
"Announcements & Nutritionists needed","Consultancy opportunity with UNICEF",7832,"Tamsin Walters",2015-06-22,"https://www.en-net.org/question/1798.aspx",NA
"Announcements & Nutritionists needed","Director, Global Initiatives / Deputy Project Director, SPRING (HKI)",7292,"Tamsin Walters",2015-06-22,"https://www.en-net.org/question/1797.aspx",NA
"Announcements & Nutritionists needed","Health and Nutrition Manager for vulnerable populations in South Sudan",7714,"Alan Mason",2015-06-17,"https://www.en-net.org/question/1793.aspx",NA
"Announcements & Nutritionists needed","UN MEDECIN VOLTIGEUR (H/F)",7981,"Michael ALVES",2015-06-16,"https://www.en-net.org/question/1790.aspx",NA
"Announcements & Nutritionists needed","15-451: Community Health and Hygiene Promotion Manager",7905,"Anonymous 1494",2015-06-15,"https://www.en-net.org/question/1783.aspx",NA
"Announcements & Nutritionists needed","Regional Maternal, Child Health and Nutrition Specialist - East Asia",8094,"Colleen Emary",2015-06-15,"https://www.en-net.org/question/1781.aspx",NA
"Announcements & Nutritionists needed","Online survey on health research priorities  - commissioned by DFID. Opportunity to ensure nutrition priorities are included",7583,"Tamsin Walters",2015-06-08,"https://www.en-net.org/question/1777.aspx",NA
"Announcements & Nutritionists needed","15-536: Monitoring, Evaluation, Accountability and Learning (MEAL) Manager",8087,"Anonymous 1494",2015-06-04,"https://www.en-net.org/question/1775.aspx",NA
"Announcements & Nutritionists needed","Independent Contractor, Haiti Country Program Manager",7327,"Anonymous 3007",2015-06-03,"https://www.en-net.org/question/1773.aspx",NA
"Announcements & Nutritionists needed","Research Associate position with the Tata-Cornell Agriculture and Nutrition Initiative (TCi)",8109,"Tamsin Walters",2015-06-02,"https://www.en-net.org/question/1772.aspx",NA
"Announcements & Nutritionists needed","15-575: Nutrition Coordinator",8341,"Anonymous 1494",2015-06-02,"https://www.en-net.org/question/1769.aspx",NA
"Announcements & Nutritionists needed","15-333: Nutrition Coordinator",7852,"Anonymous 1494",2015-06-02,"https://www.en-net.org/question/1768.aspx",NA
"Announcements & Nutritionists needed","15-522: TECHNICAL WASH & NUTRITION DIRECTOR",7719,"Anonymous 1494",2015-06-02,"https://www.en-net.org/question/1767.aspx",NA
"Announcements & Nutritionists needed","15-402: Country Director - Afghanistan",7399,"Anonymous 1494",2015-06-02,"https://www.en-net.org/question/1766.aspx",NA
"Announcements & Nutritionists needed","15-560: NUTRITION ADVISOR",7926,"Anonymous 1494",2015-06-02,"https://www.en-net.org/question/1765.aspx",NA
"Announcements & Nutritionists needed","15-496: OPERATIONS AND FINANCE DIRECTOR",7579,"Anonymous 1494",2015-06-02,"https://www.en-net.org/question/1764.aspx",NA
"Announcements & Nutritionists needed","15-468: COMMUNITY ENGAGEMENT AND SOCIAL AND BEHAVIOR CHANGE ADVISOR",7711,"Anonymous 1494",2015-06-02,"https://www.en-net.org/question/1763.aspx",NA
"Announcements & Nutritionists needed","15-467: SENIOR CAPACITY DEVELOPMENT ADVISOR",7572,"Anonymous 1494",2015-06-02,"https://www.en-net.org/question/1762.aspx",NA
"Announcements & Nutritionists needed","15-465: MONITORING AND EVALUATION DIRECTOR",8009,"Anonymous 1494",2015-06-02,"https://www.en-net.org/question/1761.aspx",NA
"Announcements & Nutritionists needed","15-374: Chief of Party, USAID Afghanistan Initiative for Hygiene, Sanitation, and Nutrition (IHSAN).",7599,"Anonymous 1494",2015-06-02,"https://www.en-net.org/question/1760.aspx",NA
"Announcements & Nutritionists needed","15-581: Country Director",7666,"Anonymous 1494",2015-06-02,"https://www.en-net.org/question/1759.aspx",NA
"Announcements & Nutritionists needed","HelpAge is recruiting a Regional Health Manager (based in Amman)",7811,"Pascale Fritsch",2015-05-28,"https://www.en-net.org/question/1754.aspx",NA
"Announcements & Nutritionists needed","WFP Seeking Nutrition Advocacy Consultant",8071,"Sophia Robele",2015-05-28,"https://www.en-net.org/question/1753.aspx",NA
"Announcements & Nutritionists needed","Save the Children - Emergency Response Personel- Nutrition Adviser- French speaker",7347,"Geraldine Le Cuziat",2015-05-28,"https://www.en-net.org/question/1752.aspx",NA
"Announcements & Nutritionists needed","15-560/NUTRITION ADVISOR",7304,"Anonymous 1494",2015-05-27,"https://www.en-net.org/question/1751.aspx",NA
"Announcements & Nutritionists needed","Nutritionist, Tahoua, Niger, with Concern Worldwide",8861,"Anonymous 130",2015-05-27,"https://www.en-net.org/question/1749.aspx",NA
"Announcements & Nutritionists needed","Health and Nutrition Advisor, Juba, South Sudan, with Concern Worldwide",8621,"Anonymous 130",2015-05-27,"https://www.en-net.org/question/1748.aspx",NA
"Announcements & Nutritionists needed","Sr Nutritionist in on-going large ag/nut programme, Karamoja, Concern Worldwide",7902,"Anonymous 130",2015-05-27,"https://www.en-net.org/question/1747.aspx",NA
"Announcements & Nutritionists needed","Looking for key informants for an exploratory review on kwashiorkor",7528,"Nidia Huerta Uribe",2015-05-26,"https://www.en-net.org/question/1746.aspx",NA
"Announcements & Nutritionists needed","ACF is looking for A NUTRITION AND HEALTH COORDINATOR - LIBERIA",7811,"Michael ALVES",2015-05-22,"https://www.en-net.org/question/1741.aspx",NA
"Announcements & Nutritionists needed","ACF recherche UN COORDINATEUR NUTRITION ET SANTE (H/F) au TCHAD",7657,"Marie Lecuyer",2015-05-20,"https://www.en-net.org/question/1738.aspx",NA
"Announcements & Nutritionists needed","ACF recherche UN EXPERT NUTRITION ET SANTE basé à DJIBOUTI",7232,"Marie Lecuyer",2015-05-20,"https://www.en-net.org/question/1737.aspx",NA
"Announcements & Nutritionists needed","15-333: Nutrition Coordinator",7854,"Anonymous 1494",2015-05-14,"https://www.en-net.org/question/1732.aspx",NA
"Announcements & Nutritionists needed","ACF is looking for A SMART ROVING SURVEY PROGRAM MANAGER",8050,"Michael ALVES",2015-05-11,"https://www.en-net.org/question/1725.aspx",NA
"Announcements & Nutritionists needed","ACF is looking for A MOTHER AND CHILD AND NUTRITION TECHNICAL COORDINATOR in Haiti",7594,"Michael ALVES",2015-05-11,"https://www.en-net.org/question/1724.aspx",NA
"Announcements & Nutritionists needed","15-444/Emergency Nutrition Manager",7800,"Anonymous 1494",2015-05-07,"https://www.en-net.org/question/1717.aspx",NA
"Announcements & Nutritionists needed","15-333/Nutrition Coordinator",7469,"Anonymous 1494",2015-05-07,"https://www.en-net.org/question/1716.aspx",NA
"Announcements & Nutritionists needed","SAVE THE DATE - Link NCA presentation webinar, May 13th",8791,"Julien Morel",2015-05-07,"https://www.en-net.org/question/1715.aspx",NA
"Announcements & Nutritionists needed","SMART survey consultancy S Sudan (Juba) with Concern Worldwide",8608,"Anonymous 130",2015-05-07,"https://www.en-net.org/question/1714.aspx",NA
"Announcements & Nutritionists needed","SMART survey consultancy S Sudan (Unity State) with Concern Worldwide",8649,"Anonymous 130",2015-05-07,"https://www.en-net.org/question/1713.aspx",NA
"Announcements & Nutritionists needed","Senior regional Nutrition and Food Security Officer based in Kenya",8420,"Anonymous 40",2015-05-07,"https://www.en-net.org/question/1712.aspx",NA
"Announcements & Nutritionists needed","CARE USA seeks Program Nutrition Manager in South Sudan",7605,"Tamsin Walters",2015-05-06,"https://www.en-net.org/question/1711.aspx",NA
"Announcements & Nutritionists needed","Nutrition in Emergencies Consultancy - UNICEF East Asia Pacific Regional Office",8293,"Megan Gayford",2015-05-01,"https://www.en-net.org/question/1706.aspx",NA
"Announcements & Nutritionists needed","CONCERN WORLDWIDE is looking for Area Coordinators in the DRC",7779,"Delia Dumbravescu",2015-04-30,"https://www.en-net.org/question/1705.aspx",NA
"Announcements & Nutritionists needed","Medair seeks a Nutrition Project Manager in Afghanistan",7727,"Alan Mason",2015-04-30,"https://www.en-net.org/question/1704.aspx",NA
"Announcements & Nutritionists needed","UNICEF seeks French speaking consultants for SMART surveys - WCAR region",7230,"Sara Gari",2015-04-29,"https://www.en-net.org/question/1702.aspx",NA
"Announcements & Nutritionists needed","USAID is looking for a nutrionist for the Office of Food for Peace",7971,"Judy Canahuati",2015-04-23,"https://www.en-net.org/question/1698.aspx",NA
"Announcements & Nutritionists needed","UNICEF Myanmar is seeking a Health & Nutrition Specialist (P3) based in Sittwe field office - deadline 28 April",7456,"Martin Eklund",2015-04-23,"https://www.en-net.org/question/1697.aspx",NA
"Announcements & Nutritionists needed","HelpAge is recruiting a Regional Nutrition Programme Manager (based in Nairobi)",7759,"Pascale Fritsch",2015-04-22,"https://www.en-net.org/question/1695.aspx",NA
"Announcements & Nutritionists needed","IRC seeks Nutrition Technical Advisor for New York HQ",7751,"Tamsin Walters",2015-04-21,"https://www.en-net.org/question/1694.aspx",NA
"Announcements & Nutritionists needed","Nutrition Advisor, USAID (USDA/FAS ""Schedule B"" position based in USAID)",8325,"Anonymous 2918",2015-04-17,"https://www.en-net.org/question/1689.aspx",NA
"Announcements & Nutritionists needed","Opportunity for experienced Nutritionist in Niger",7558,"David Kilcline",2015-04-15,"https://www.en-net.org/question/1688.aspx",NA
"Announcements & Nutritionists needed","SNV BCC consultancy in Zambia",7881,"Tamsin Walters",2015-04-15,"https://www.en-net.org/question/1687.aspx",NA
"Announcements & Nutritionists needed","ENN seeks French speaking nutritionist for short-term consultancy",6793,"Tamsin Walters",2015-04-15,"https://www.en-net.org/question/1686.aspx",NA
"Announcements & Nutritionists needed","Vacancy: Programme Manager",6997,"Verena Heinreichsberger",2015-04-14,"https://www.en-net.org/question/1684.aspx",NA
"Announcements & Nutritionists needed","3 vacancies to support the set up of nutrition information platforms in various countries",7285,"Anonymous 2915",2015-04-14,"https://www.en-net.org/question/1683.aspx",NA
"Announcements & Nutritionists needed","Concern is looking for a consultant for Zambia to design baseline survey and monitoring tools",7976,"Regine Kopplow",2015-04-13,"https://www.en-net.org/question/1681.aspx",NA
"Announcements & Nutritionists needed","ACF reccherche UN CHARGE DE PROGRAMME EN SANTE & NUTRITION (H/F) en RCA",6952,"Marie Lecuyer",2015-04-09,"https://www.en-net.org/question/1680.aspx",NA
"Announcements & Nutritionists needed","ACF is looking for A NUTRITION TRAINING EXPERT in  AFGHANISTAN",7124,"Marie Lecuyer",2015-04-09,"https://www.en-net.org/question/1679.aspx",NA
"Announcements & Nutritionists needed","Nutrition Specialist in Emergencies Job Announcement",7426,"Ivennie Matika",2015-04-08,"https://www.en-net.org/question/1677.aspx",NA
"Announcements & Nutritionists needed","London School of Hygiene and Tropical Medicine seeks research fellow in Nutrition and Sustainability",7980,"Tamsin Walters",2015-04-01,"https://www.en-net.org/question/1673.aspx",NA
"Announcements & Nutritionists needed","Consultant to join OPML Nutrition Portfolio",7565,"Tamsin Walters",2015-04-01,"https://www.en-net.org/question/1671.aspx",NA
"Announcements & Nutritionists needed","Consultant needed for Link NCA nutrition response analysis guidance",7929,"Julien Morel",2015-03-30,"https://www.en-net.org/question/1667.aspx",NA
"Announcements & Nutritionists needed","ACF is looking for A NUTRITION AND HEALTH PROGRAM MANAGER - FLYING",7254,"Marie Lecuyer",2015-03-25,"https://www.en-net.org/question/1663.aspx",NA
"Announcements & Nutritionists needed","ACF is looking for A NUTRITION AND HEALTH COORDINATOR - FLYING",7467,"Marie Lecuyer",2015-03-25,"https://www.en-net.org/question/1662.aspx",NA
"Announcements & Nutritionists needed","ACF is looking for A NUTRITION AND HEALTH PROGRAM MANAGER in SIERRA LEONE",7217,"Marie LECUYER",2015-03-20,"https://www.en-net.org/question/1658.aspx",NA
"Announcements & Nutritionists needed","ACF is looking for A NUTRITION SURVEILLANCE EXPERT - SIERRA LEONE",7818,"Marie LECUYER",2015-03-20,"https://www.en-net.org/question/1657.aspx",NA
"Announcements & Nutritionists needed","ACF is looking for A HEALTH PROGRAM DEPUTY COORDINATOR in SIERRA LEONE",7265,"Marie Lecuyer",2015-03-17,"https://www.en-net.org/question/1651.aspx",NA
"Announcements & Nutritionists needed","ACF is looking for A NUTRITION AND HEALTH COORDINATOR in Ethiopia",7435,"Marie Lecuyer",2015-03-17,"https://www.en-net.org/question/1650.aspx",NA
"Announcements & Nutritionists needed","Regional Humanitarian Health Programme Manager based in Amman, Jordan",7331,"Pascale Fritsch",2015-03-16,"https://www.en-net.org/question/1649.aspx",NA
"Announcements & Nutritionists needed","Consultant Needed for Stunting Prevention Project",8202,"Anonymous 2865",2015-03-16,"https://www.en-net.org/question/1648.aspx",NA
"Announcements & Nutritionists needed","JOB OPENING: Nutrition Component Manager",8040,"Anonymous 2705",2015-03-10,"https://www.en-net.org/question/1647.aspx",NA
"Announcements & Nutritionists needed","Concern Worldwide is seeking a HEALTH & NUTRITION MANAGER for programme start-up in CAR",7784,"David Kilcline",2015-03-06,"https://www.en-net.org/question/1646.aspx",NA
"Announcements & Nutritionists needed","Concern Worldwide is hiring a HEALTH & NUTRITION ADVISER in West Darfur",8437,"David Kilcline",2015-03-06,"https://www.en-net.org/question/1645.aspx",NA
"Announcements & Nutritionists needed","Concern Worldwide seeks an Emergency Coordinator in Niger",7912,"Tamsin Walters",2015-03-03,"https://www.en-net.org/question/1641.aspx",NA
"Announcements & Nutritionists needed","Experienced data analyst (DHS data) needed",7309,"Marie McGrath",2015-02-26,"https://www.en-net.org/question/1636.aspx",NA
"Announcements & Nutritionists needed","Nutrition Specialist (Community) - 6 months Maternity Cover",7837,"Erin McCloskey-Rebelo",2015-02-23,"https://www.en-net.org/question/1630.aspx",NA
"Announcements & Nutritionists needed","ACF is looking for a Link NCA PROJECT COORDINATOR",7561,"Julien Morel",2015-02-22,"https://www.en-net.org/question/1629.aspx",NA
"Announcements & Nutritionists needed","Communications and Advocacy Adviser Vacancy, based in Malawi",7678,"Georgina Nicoli",2015-02-20,"https://www.en-net.org/question/1628.aspx",NA
"Announcements & Nutritionists needed","ACF is looking for a MEDICAL DOCTOR in Myanmar",7260,"Marie Lecuyer",2015-02-18,"https://www.en-net.org/question/1624.aspx",NA
"Announcements & Nutritionists needed","ProPAN Consultant",7930,"Erin McCloskey-Rebelo",2015-02-17,"https://www.en-net.org/question/1622.aspx",NA
"Announcements & Nutritionists needed","ACF is looking for A NUTRITION AND HEALTH PROGRAM MANAGER  in  MYANMAR",6968,"Marie Lecuyer",2015-02-16,"https://www.en-net.org/question/1621.aspx",NA
"Announcements & Nutritionists needed","ACF is looking for A NUTRITION AND HEALTH COORDINATOR in YEMEN",7003,"Marie Lecuyer",2015-02-11,"https://www.en-net.org/question/1619.aspx",NA
"Announcements & Nutritionists needed","ACF is looking for A NUTRITION AND HEALTH PROGRAM MANAGER in YEMEN",7319,"Marie Lecuyer",2015-02-11,"https://www.en-net.org/question/1618.aspx",NA
"Announcements & Nutritionists needed","New article: Imperial College London’s Samrat Singh looks at what governments and their development partners can do to enable shattered agricultural markets to bounce back from the Ebola crisis.",12365,"Tamsin Walters",2015-02-09,"https://www.en-net.org/question/1616.aspx",NA
"Announcements & Nutritionists needed","Recruiting Nutrition Scientist for WorldFish Bangladesh",7350,"Tamsin Walters",2015-02-09,"https://www.en-net.org/question/1615.aspx",NA
"Announcements & Nutritionists needed","London School of Hygiene and Tropical Medicine studentship",7625,"Tamsin Walters",2015-02-09,"https://www.en-net.org/question/1614.aspx",NA
"Announcements & Nutritionists needed","UNICEF Mali seeks Nutrition Cluster Coordinator",8258,"Tamsin Walters",2015-02-05,"https://www.en-net.org/question/1609.aspx",NA
"Announcements & Nutritionists needed","Concern: consultant required for Zambia on nutrition sensitive conservation agriculture",7591,"Regine Kopplow",2015-02-04,"https://www.en-net.org/question/1606.aspx",NA
"Announcements & Nutritionists needed","Consultancy to develop a nutritional training in Haiti",8039,"Tamsin Walters",2015-02-02,"https://www.en-net.org/question/1605.aspx",NA
"Announcements & Nutritionists needed","SPRING Monitoring & Evaluation Specialist Vacancy- Agriculture & Nutrition",8473,"Tamsin Walters",2015-02-02,"https://www.en-net.org/question/1604.aspx",NA
"Announcements & Nutritionists needed","Country Manager, Bangladesh - GAIN (Global Alliance for Improved Nutrition)",7699,"Anonymous 2802",2015-01-28,"https://www.en-net.org/question/1599.aspx",NA
"Announcements & Nutritionists needed","ACF is looking for a MEDICAL DOCTOR in Myanmar",6675,"Marie Lecuyer",2015-01-28,"https://www.en-net.org/question/1598.aspx",NA
"Announcements & Nutritionists needed","HelpAge International is looking for a Nutrition Coordinator in Juba",7334,"Pascale Fritsch",2015-01-27,"https://www.en-net.org/question/1597.aspx",NA
"Announcements & Nutritionists needed","BBC seeks a  Health Research Manager",7713,"Tamsin Walters",2015-01-27,"https://www.en-net.org/question/1596.aspx",NA
"Announcements & Nutritionists needed","Medair Vacancy - Health & Nutrition Advisor (Syrian Crisis)",8157,"Eliza Jockuat",2015-01-26,"https://www.en-net.org/question/1595.aspx",NA
"Announcements & Nutritionists needed","Medair seeks a Food Security Advisor for its programme in Afghanistan",7125,"Eliza Jockuat",2015-01-26,"https://www.en-net.org/question/1594.aspx",NA
"Announcements & Nutritionists needed","ACF is looking for AN INFECTION PREVENTION AND CONTROL PROGRAM MANAGER - SIERRA LEONE",7366,"Marie Lecuyer",2015-01-26,"https://www.en-net.org/question/1593.aspx",NA
"Announcements & Nutritionists needed","ACDI/VOCA is seeking a D.C.-based Associate Director, Social & Behavior Change",7364,"Tamsin Walters",2015-01-15,"https://www.en-net.org/question/1588.aspx",NA
"Announcements & Nutritionists needed","Medair seeks Health Manager (s) - (Supervising Nurse or Doctor) for its programme in Sierra Leone",7869,"Eliza Jockuat",2015-01-05,"https://www.en-net.org/question/1583.aspx",NA
"Announcements & Nutritionists needed","Health Project Manager is needed for Medair's programme in South Sudan",7300,"Eliza Jockuat",2015-01-05,"https://www.en-net.org/question/1582.aspx",NA
"Announcements & Nutritionists needed","ACF recherche un UN RESPONSABLE ENQUETE NUTRITIONNELLE SMART (H/F)",7587,"Marie Lecuyer",2014-12-19,"https://www.en-net.org/question/1578.aspx",NA
"Announcements & Nutritionists needed","ACF is looking for A MEDICAL DOCTOR in Myanmar",6981,"Marie Lecuyer",2014-12-19,"https://www.en-net.org/question/1577.aspx",NA
"Announcements & Nutritionists needed","Team leader for the evaluation of HKI Vitamin A supplementation regional project",8015,"David Doledec",2014-12-19,"https://www.en-net.org/question/1576.aspx",NA
"Announcements & Nutritionists needed","Consultancy for evaluation of HKI Vitamin A supplementation regional project",7962,"David Doledec",2014-12-19,"https://www.en-net.org/question/1575.aspx",NA
"Announcements & Nutritionists needed","SCUK is re-advertising for a Senior Humanitarian Nutrition Adviser - full time post based in London - closes 13 January 2015",7929,"Anonymous 2478",2014-12-18,"https://www.en-net.org/question/1574.aspx",NA
"Announcements & Nutritionists needed","ACF is looking for AN EXPERT EPIDEMIOLOGIST in LIBERIA",7818,"Marie Lecuyer",2014-12-17,"https://www.en-net.org/question/1572.aspx",NA
"Announcements & Nutritionists needed","ACF is looking for A NUTRITION AND HEALTH COORDINATOR in SIERRA LEONE",7658,"Marie Lecuyer",2014-12-17,"https://www.en-net.org/question/1571.aspx",NA
"Announcements & Nutritionists needed","CMAM/ IMAM consultancy opportunity with SUN Fund, Zambia",8687,"Anonymous 130",2014-12-16,"https://www.en-net.org/question/1570.aspx",NA
"Announcements & Nutritionists needed","Save the Children seeks Head of Hunger Reduction & Livelihoods (12 months maternity cover)",7548,"Tamsin Walters",2014-12-10,"https://www.en-net.org/question/1568.aspx",NA
"Announcements & Nutritionists needed","vacancy for 2 HKI regional nutrition positions (Location flexible)",8148,"David Doledec",2014-12-10,"https://www.en-net.org/question/1567.aspx",NA
"Announcements & Nutritionists needed","vacancy for 1 HKI M&E regional nutrition position (Nairobi, Kenya)",8356,"David Doledec",2014-12-10,"https://www.en-net.org/question/1566.aspx",NA
"Announcements & Nutritionists needed","Medair seeks Health Project Managers for programmes in D. R. Congo",6886,"Eliza Jockuat",2014-12-05,"https://www.en-net.org/question/1565.aspx",NA
"Announcements & Nutritionists needed","Health & Nutrition Project Manager is needed for Medair's programmes in South Sudan",7151,"Eliza Jockuat",2014-12-05,"https://www.en-net.org/question/1564.aspx",NA
"Announcements & Nutritionists needed","ACF recherche UN COORDINATEUR SANTE ET NUTRITION (H/F) au BURKINA FASO",7905,"Marie Lecuyer",2014-12-05,"https://www.en-net.org/question/1563.aspx",NA
"Announcements & Nutritionists needed","Nutrition Specialist - IRC HQ, New York",8114,"Casie Tesfai",2014-12-04,"https://www.en-net.org/question/1562.aspx",NA
"Announcements & Nutritionists needed","Free LSHTM online course on Ebola: registration open",8888,"Marie A McGrath",2014-12-04,"https://www.en-net.org/question/1561.aspx",NA
"Announcements & Nutritionists needed","Research Associate Position for Study on Nutrition and Cash Transfer Programming",8587,"Andy Seal",2014-12-03,"https://www.en-net.org/question/1560.aspx",NA
"Announcements & Nutritionists needed","ACF is looking for a A HEALTH SYSTEM STRENGTHENING EXPERT in AFGHANISTAN",7480,"Marie Lecuyer",2014-12-03,"https://www.en-net.org/question/1558.aspx",NA
"Announcements & Nutritionists needed","International Medical Corps - 14-881 Emergency Nutrition Officer",8371,"Anonymous 1494",2014-12-02,"https://www.en-net.org/question/1557.aspx",NA
"Announcements & Nutritionists needed","Director - Secretariat of the Global Panel on Agriculture and Food Systems for Nutrition",7829,"Tamsin Walters",2014-12-01,"https://www.en-net.org/question/1556.aspx",NA
"Announcements & Nutritionists needed","Invitation to contribute to the Merlin History Project",8354,"Tamsin Walters",2014-12-01,"https://www.en-net.org/question/1555.aspx",NA
"Announcements & Nutritionists needed","ACF recherche UN RESPONSABLE DE PROJET RECHERCHE OPÉRATIONNELLE NUTRITION/SANTE (H/F) au TCHAD",7352,"Marie Lecuyer",2014-11-28,"https://www.en-net.org/question/1552.aspx",NA
"Announcements & Nutritionists needed","Call for abstracts: 3rd FANUS Conference 2015 Arusha, Tanzania",9228,"Tamsin Walters",2014-11-27,"https://www.en-net.org/question/1550.aspx",NA
"Announcements & Nutritionists needed","Emergency Nutrition Officer Liberia",8153,"Anonymous 462",2014-11-26,"https://www.en-net.org/question/1549.aspx",NA
"Announcements & Nutritionists needed","Medair is seeking a Senior Health and Nutrition Advisor for our international HQ",7960,"Diana Chevalley",2014-11-26,"https://www.en-net.org/question/1548.aspx",NA
"Announcements & Nutritionists needed","SCUK is looking for a Senior Humanitarian Nutrition Adviser - London based (full or part time) deadline for applications 7 Dec 2015",7766,"Anonymous 2478",2014-11-21,"https://www.en-net.org/question/1546.aspx",NA
