"Theme","Topic","Views","Author","Posted","Link","Replies"
"Announcements & Nutritionists needed","ENN Administrative Assistant needed",9211,"Tamsin",2016-01-26,"https://www.en-net.org/question/2333.aspx",NA
"Announcements & Nutritionists needed","Job Positions - Programme Managers -  VALID International",9258,"Joseph Galabuzi",2016-01-25,"https://www.en-net.org/question/2332.aspx",NA
"Announcements & Nutritionists needed","Global Nutrition Adviser at Concern Worldwide",8780,"Anonymous 3434",2016-01-22,"https://www.en-net.org/question/2330.aspx",NA
"Announcements & Nutritionists needed","CaLP assessment of North America humanitarian cash programming support needs",8649,"Jenny Coneff",2016-01-13,"https://www.en-net.org/question/2320.aspx",NA
"Announcements & Nutritionists needed","Irish Aid Senior Nutrition Advisor (Africa based)",9779,"Marie McGrath",2016-01-13,"https://www.en-net.org/question/2319.aspx",NA
"Announcements & Nutritionists needed","Early Market Engagement Session for DFID Funded Research into Nutrition Data Gaps",9468,"Anna Salvarli",2016-01-11,"https://www.en-net.org/question/2318.aspx",NA
"Announcements & Nutritionists needed","Job Vacancy - Save the Children; Emergency Nutrition Advisor",9877,"Sarah (Butler) O'Flynn",2016-01-05,"https://www.en-net.org/question/2316.aspx",NA
"Announcements & Nutritionists needed","Consultant for development of Infant Young Child Feeding (IYCF)-emergency(e) guidelines_ Pakistan.",9809,"Dr. Saba Shuja",2015-12-28,"https://www.en-net.org/question/2312.aspx",NA
"Announcements & Nutritionists needed","Consultant to conduct Nutrition Causal Analysis in drought affected districts, in Sindh province- Pakistan",9360,"Dr. Saba Shuja",2015-12-21,"https://www.en-net.org/question/2307.aspx",NA
"Announcements & Nutritionists needed","Consultant for IYCFE assessment among refugees in transit in Europe.",9185,"Alexandra Rutishauser-Perera",2015-12-18,"https://www.en-net.org/question/2304.aspx",NA
"Announcements & Nutritionists needed","Concern Worldwide seeks FIELD STUDY COORDINATOR ? MOGADISHU",10149,"Tamsin",2015-12-17,"https://www.en-net.org/question/2303.aspx",NA
"Announcements & Nutritionists needed","World Vision: CONSULTANT needed for CMAM Capacity Building in Mauritania",9925,"Judith Haase",2015-12-17,"https://www.en-net.org/question/2302.aspx",NA
"Announcements & Nutritionists needed","clinical nutrition conferences",9230,"Juliana Mandha",2015-12-14,"https://www.en-net.org/question/2299.aspx",NA
"Announcements & Nutritionists needed","URGENT_Save the Children is recruiting IYCF_E program managers_Greece and Croatia",9360,"Charlotte d'Elloy",2015-12-09,"https://www.en-net.org/question/2293.aspx",NA
"Announcements & Nutritionists needed","UNHCR call for expression of interest: Strengthening UNHCR capacity on GIS, mapping and mobile data collection",9568,"Anonymous 40",2015-12-04,"https://www.en-net.org/question/2290.aspx",NA
"Announcements & Nutritionists needed","Launch Technical Rapid Response Team  - Tech RRT",9133,"Geraldine Le Cuziat",2015-12-04,"https://www.en-net.org/question/2288.aspx",NA
"Announcements & Nutritionists needed","GOAL is recruiting Nutrition Cluster Co-coordinator in Turkey",9424,"Anonymous 3237",2015-12-03,"https://www.en-net.org/question/2286.aspx",NA
"Announcements & Nutritionists needed","ENN seeks Regional Knowledge Management Specialist based in Africa",8904,"Tamsin",2015-12-02,"https://www.en-net.org/question/2285.aspx",NA
"Announcements & Nutritionists needed","URGENT: Nutrition Programme Coordinator, Juba (South Sudan)",9123,"Pascale Fritsch",2015-11-30,"https://www.en-net.org/question/2280.aspx",NA
"Announcements & Nutritionists needed","Launching the Rapid Assessment Method for Older People (RAM-OP)",9661,"Pascale Fritsch",2015-11-25,"https://www.en-net.org/question/2276.aspx",NA
"Announcements & Nutritionists needed","Humanitarian Programme Coordinator ? Health and Nutrition",9041,"Pascale Fritsch",2015-11-24,"https://www.en-net.org/question/2274.aspx",NA
"Announcements & Nutritionists needed","LSHTM Master degree summer projects",9460,"Severine Frison",2015-11-23,"https://www.en-net.org/question/2273.aspx",NA
"Announcements & Nutritionists needed","Nutrition Specialist, World Food Programme, Nepal (closing 18 November)",10031,"Lindsey Horton",2015-11-12,"https://www.en-net.org/question/2259.aspx",NA
"Announcements & Nutritionists needed","Job Posting: 15-1037: Nutrition Program Manager",8751,"Dani Tucker",2015-11-11,"https://www.en-net.org/question/2256.aspx",NA
"Announcements & Nutritionists needed","Job posting: 15-972: Emergency Nutrition Coordinator",9229,"Dani Tucker",2015-11-11,"https://www.en-net.org/question/2255.aspx",NA
"Announcements & Nutritionists needed","Clinical Lead - Improving Care for Undernourished Children with Acute Illness",10146,"Tamsin",2015-11-10,"https://www.en-net.org/question/2251.aspx",NA
"Announcements & Nutritionists needed","SPRING seeks Instructional Design Consultant - Ag and SBC focused",9496,"Abhi Goyal",2015-11-06,"https://www.en-net.org/question/2242.aspx",NA
"Announcements & Nutritionists needed","UNHCR seeks P3 Food & Nutrition Officer based in Dadaab Kenya",10556,"Anonymous 40",2015-11-06,"https://www.en-net.org/question/2241.aspx",NA
"Announcements & Nutritionists needed","UNHCR seeks P3 Nutrition & Food Security Officer based in Juba South Sudan",10650,"Anonymous 40",2015-11-06,"https://www.en-net.org/question/2239.aspx",NA
"Announcements & Nutritionists needed","Food Security Advisor",8794,"Alan Mason",2015-10-28,"https://www.en-net.org/question/2232.aspx",NA
"Announcements & Nutritionists needed","Senior Health and Nutrition Advisor",9054,"Alan Mason",2015-10-28,"https://www.en-net.org/question/2231.aspx",NA
"Announcements & Nutritionists needed","POLICY COORDINATOR, SIERRA LEONE (IPA/JPAL PARTNERSHIP)",9286,"Anonymous 675",2015-10-27,"https://www.en-net.org/question/2229.aspx",NA
"Announcements & Nutritionists needed","GOAL is recruiting Roving Nutrition Advisor",8989,"Anonymous 3237",2015-10-26,"https://www.en-net.org/question/2228.aspx",NA
"Announcements & Nutritionists needed","GOAL is recruiting Nutrition Impact & Positive Practice (NIPP) Global Manager",9892,"Anonymous 3237",2015-10-26,"https://www.en-net.org/question/2227.aspx",NA
"Announcements & Nutritionists needed","Progressio is recruiting for a Communications and Advocacy Adviser placement, based in Malawi, working on nutrition",9322,"Georgina Nicoli",2015-10-23,"https://www.en-net.org/question/2225.aspx",NA
"Announcements & Nutritionists needed","Consultant needed for scoping study to inform capacity building and institutionalisation strategy (LinkNCA)",9319,"Julien Morel",2015-10-23,"https://www.en-net.org/question/2224.aspx",NA
"Announcements & Nutritionists needed","15-963: Nutrition Program Manager",9880,"Anonymous 1494",2015-10-13,"https://www.en-net.org/question/2213.aspx",NA
"Announcements & Nutritionists needed","HelpAge International seeks a Humanitarian Programme Coordinator - Health and Nutrition",8992,"Pascale Fritsch",2015-10-09,"https://www.en-net.org/question/1950.aspx",NA
"Announcements & Nutritionists needed","Consultant(s) needed: Review of GNC Handbook",10606,"Nicki Connell",2015-10-05,"https://www.en-net.org/question/1947.aspx",NA
"Announcements & Nutritionists needed","Deputy Chief of Party - Programs (Tamale, Ghana) - The SPRING Project",9222,"Abhi Goyal",2015-10-05,"https://www.en-net.org/question/1946.aspx",NA
"Announcements & Nutritionists needed","A SENIOR RESEARCH ADVISOR - ACTION CONTRE LA FAIM",9465,"Michael ALVES",2015-09-29,"https://www.en-net.org/question/1941.aspx",NA
"Announcements & Nutritionists needed","Nutrition Expert (immediate need)",8194,"Anonymous 3176",2015-09-25,"https://www.en-net.org/question/1935.aspx",NA
"Announcements & Nutritionists needed","15-812: Technical Surge Advisor- SBC",8770,"Anonymous 1494",2015-09-25,"https://www.en-net.org/question/1934.aspx",NA
"Announcements & Nutritionists needed","Hiring! Nutrition Advisor (6.5 months maternity cover) London and immediate start",8497,"Anonymous 2382",2015-09-25,"https://www.en-net.org/question/1933.aspx",NA
"Announcements & Nutritionists needed","UNICEF and Save the Children seek an IYCF in Emergencies Consultant",10257,"Alison Donnelly",2015-09-25,"https://www.en-net.org/question/1932.aspx",NA
"Announcements & Nutritionists needed","Emergency Nutritionist with Concern Worldwide in South Sudan",9759,"Ciara Passmore",2015-09-08,"https://www.en-net.org/question/1919.aspx",NA
"Announcements & Nutritionists needed","ACF recherche UNE SAGE FEMME (H/F) au TCHAD",10447,"Michael ALVES",2015-09-02,"https://www.en-net.org/question/1914.aspx",NA
"Announcements & Nutritionists needed","ACF is looking for A NUTRITION AND HEALTH PROGRAM MANAGER in  LIBERIA",9014,"Michael ALVES",2015-09-02,"https://www.en-net.org/question/1913.aspx",NA
"Announcements & Nutritionists needed","ACF recherche UN RESPONSABLE DE PROGRAMME DE RECHERCHE (H/F) au BURKINA FASO",8474,"Michael ALVES",2015-09-02,"https://www.en-net.org/question/1912.aspx",NA
"Announcements & Nutritionists needed","ACF is looking A CONSULTANT FOR A STUDY ON RUTF",9765,"Michael ALVES",2015-09-02,"https://www.en-net.org/question/1911.aspx",NA
"Announcements & Nutritionists needed","ACF is looking for A NUTRITIONAL CAUSAL ANALYSIS EXPERT in ETHIOPIA",9197,"Michael ALVES",2015-09-02,"https://www.en-net.org/question/1910.aspx",NA
"Announcements & Nutritionists needed","ACF recherche UN EXPERT EN RENFORCEMENT DU SYSTEME DE SANTE (H/F) à  DJIBOUTI",8594,"Michael ALVES",2015-09-01,"https://www.en-net.org/question/1909.aspx",NA
"Announcements & Nutritionists needed","HelpAge International needs a Nutritonist in Suth Sudan",9352,"Pascale Fritsch",2015-09-01,"https://www.en-net.org/question/1906.aspx",NA
"Announcements & Nutritionists needed","Nutrition in Emergencies consultant, UNICEF East Asia Pacific Regional Office",10344,"Christiane Rudert",2015-09-01,"https://www.en-net.org/question/1905.aspx",NA
"Announcements & Nutritionists needed","ACF is looking for A NUTRITION AND HEALTH COORDINATOR in MYANMAR",8933,"Michael ALVES",2015-08-31,"https://www.en-net.org/question/1904.aspx",NA
"Announcements & Nutritionists needed","ACF is looking for A NUTRITION AND HEALTH PROGRAM MANAGER in Yemen (Aden)",8929,"Michael ALVES",2015-08-28,"https://www.en-net.org/question/1902.aspx",NA
"Announcements & Nutritionists needed","Welthungerhilfe seeks an Advisor on Food and Nutrition Security in Pakistan",9080,"Tamsin",2015-08-27,"https://www.en-net.org/question/1900.aspx",NA
"Announcements & Nutritionists needed","Nutrition Advisor",8965,"Alan Mason",2015-08-26,"https://www.en-net.org/question/1897.aspx",NA
"Announcements & Nutritionists needed","ACF recherche UN RESPONSABLE DE PROGRAMME NUTRITION ET SANTE  en  RCA",8400,"Michael ALVES",2015-08-26,"https://www.en-net.org/question/1896.aspx",NA
"Announcements & Nutritionists needed","International consultant (Oct-Dec 2015) to support the nutrition unit at WHO IST/WA office Based in Ouagadougou",9410,"Elisa Dominguez",2015-08-26,"https://www.en-net.org/question/1895.aspx",NA
"Announcements & Nutritionists needed","ACF is looking for A NUTRITION AND HEALTH PROGRAM MANAGER in MYANMAR",8714,"Michael ALVES",2015-08-26,"https://www.en-net.org/question/1894.aspx",NA
"Announcements & Nutritionists needed","New app to calculate the size of babies using the INTERGROWTH-21st Standards",8953,"Tamsin",2015-08-20,"https://www.en-net.org/question/1886.aspx",NA
"Announcements & Nutritionists needed","Health & Nutrition Director RWANU, Uganda, Concern Worldwide",10194,"Ciara Passmore",2015-08-20,"https://www.en-net.org/question/1884.aspx",NA
"Announcements & Nutritionists needed","Emergency Response Team (ERT) Nutrition Project Manager",9296,"Alan Mason",2015-08-19,"https://www.en-net.org/question/1882.aspx",NA
"Announcements & Nutritionists needed","Senior Emergency Nutrition Advisor (50% position)",9264,"Colleen Emary",2015-08-18,"https://www.en-net.org/question/1878.aspx",NA
"Announcements & Nutritionists needed","15-820: Technical Surge Advisor- CMAM",9197,"Anonymous 1494",2015-08-13,"https://www.en-net.org/question/1875.aspx",NA
"Announcements & Nutritionists needed","15-812: Technical Surge Advisor- SBC",9087,"Anonymous 1494",2015-08-13,"https://www.en-net.org/question/1874.aspx",NA
"Announcements & Nutritionists needed","Health and Nutrition Programme Manager, Chad, Concern Worldwide",9704,"Ciara Passmore",2015-08-13,"https://www.en-net.org/question/1872.aspx",NA
"Announcements & Nutritionists needed","Health & Nutrition Coord (Maternity), Malawi, Concern Worldwide",9472,"Ciara Passmore",2015-08-13,"https://www.en-net.org/question/1871.aspx",NA
"Announcements & Nutritionists needed","Senior Nutritionist in Karamoja, Uganda with Concern Worldwide",9611,"Ciara Passmore",2015-08-13,"https://www.en-net.org/question/1870.aspx",NA
"Announcements & Nutritionists needed","15-812: Technical Surge Advisor- SBC",8622,"Anonymous 1494",2015-08-13,"https://www.en-net.org/question/1869.aspx",NA
"Announcements & Nutritionists needed","15-820: Technical Surge Advisor- CMAM",9094,"Anonymous 1494",2015-08-13,"https://www.en-net.org/question/1868.aspx",NA
"Announcements & Nutritionists needed","Infant and Young Child Feeding in Emergencies - Technical Surge Advisor SCUK",8948,"Megan",2015-08-12,"https://www.en-net.org/question/1865.aspx",NA
"Announcements & Nutritionists needed","15-648: Food Security and Livelihoods Consultant",9696,"Anonymous 1494",2015-08-11,"https://www.en-net.org/question/1864.aspx",NA
"Announcements & Nutritionists needed","Vacancy Job #15-820 Technical Surge Advisor - CMAM",9072,"Anonymous 1494",2015-08-11,"https://www.en-net.org/question/1863.aspx",NA
"Announcements & Nutritionists needed","Vacancy - Job# 15-812 Technical Surge Advisor - SBC",8892,"Anonymous 1494",2015-08-11,"https://www.en-net.org/question/1862.aspx",NA
"Announcements & Nutritionists needed","Nutrition Coordinator, Zambia Female Youths Livelihood and Nutrition Enhancement Project",10073,"Ciara Passmore",2015-08-11,"https://www.en-net.org/question/1861.aspx",NA
"Announcements & Nutritionists needed","Project Coordinator, Zambia Female Youths Livelihood and Nutrition Enhancement Project",9168,"Ciara Passmore",2015-08-11,"https://www.en-net.org/question/1860.aspx",NA
"Announcements & Nutritionists needed","Nutrition Coordinator, Concern Worldwide Zambia, for the Female Youths Livelihood and Nutrition Enhancement Project",9573,"Regine Kopplow",2015-08-10,"https://www.en-net.org/question/1859.aspx",NA
"Announcements & Nutritionists needed","Project Coordinator, Concern Worldwide Zambia, for the Female Youths Livelihood and Nutrition Enhancement Project",9502,"Regine Kopplow",2015-08-10,"https://www.en-net.org/question/1858.aspx",NA
"Announcements & Nutritionists needed","Internship Opportunity inquiry",8800,"nakyanzi teddy",2015-08-06,"https://www.en-net.org/question/1855.aspx",NA
"Announcements & Nutritionists needed","CMAM Forum Coordinator",10650,"Jose Luis Alvarez Moran",2015-08-06,"https://www.en-net.org/question/1854.aspx",NA
"Announcements & Nutritionists needed","Vacancy - 5 weeks home based consultancy for Helen Keller International",9709,"David Doledec",2015-08-05,"https://www.en-net.org/question/1853.aspx",NA
"Announcements & Nutritionists needed","15-575: Nutrition Coordinator",8771,"Anonymous 1494",2015-08-04,"https://www.en-net.org/question/1852.aspx",NA
"Announcements & Nutritionists needed","15-648: Food Security and Livelihoods Consultant",8766,"Anonymous 1494",2015-08-04,"https://www.en-net.org/question/1851.aspx",NA
"Announcements & Nutritionists needed","Infant and Young Child Feeding in Emergencies (IYCF-E) Consultancy  - Save the Children",10348,"Christine Fernandes",2015-08-03,"https://www.en-net.org/question/1850.aspx",NA
"Announcements & Nutritionists needed","Consultancy: 5 weeks consultancy to update a survey database and conduct initial analysis",9400,"Rosalia Lorenzen",2015-08-03,"https://www.en-net.org/question/1849.aspx",NA
"Announcements & Nutritionists needed","Nepal Nutrition and Food Security Portal",8697,"Sophiya Uprety",2015-07-29,"https://www.en-net.org/question/1845.aspx",NA
"Announcements & Nutritionists needed","Global Knowledge Management Coordinator",10745,"Tamsin",2015-07-27,"https://www.en-net.org/question/1842.aspx",NA
"Announcements & Nutritionists needed","Nutrition & Health Advisor , New York, Concern Worldwide",9238,"Regine Kopplow",2015-07-23,"https://www.en-net.org/question/1839.aspx",NA
"Announcements & Nutritionists needed","Communications and Advocacy Adviser vacancy",9283,"Georgina Nicoli",2015-07-22,"https://www.en-net.org/question/1838.aspx",NA
"Announcements & Nutritionists needed","15-750: Nutrition Associate - Mercy Corps",10045,"Tamsin",2015-07-21,"https://www.en-net.org/question/1834.aspx",NA
"Announcements & Nutritionists needed","Job Vacancy: Community Management of Acute Malnutrition (CMAM) Advisor, India",10112,"Joseph Galabuzi",2015-07-20,"https://www.en-net.org/question/1833.aspx",NA
"Announcements & Nutritionists needed","Action Contre la Faim is looking for a consultant position on writing an Operational Manual for promoting the WASH in Nutrition Strategy",9658,"Julien Morel",2015-07-10,"https://www.en-net.org/question/1827.aspx",NA
"Announcements & Nutritionists needed","IAEA Nutrition Specialist (P4)",10551,"Victor Owino",2015-07-07,"https://www.en-net.org/question/1823.aspx",NA
"Announcements & Nutritionists needed","Advertisement",9563,"Anonymous 2725",2015-07-01,"https://www.en-net.org/question/1816.aspx",NA
"Announcements & Nutritionists needed","ACF is looking for UN COORDINATEUR TECHNIQUE SANTE MATERNELLE ET INFANTILE ET NUTRITION (SMIN) (H/F) in Haiti",9212,"Michael ALVES",2015-07-01,"https://www.en-net.org/question/1815.aspx",NA
"Announcements & Nutritionists needed","ACF is looking for A SQUEAC OFFICER in Afghanistan",8393,"Michael ALVES",2015-06-30,"https://www.en-net.org/question/1812.aspx",NA
"Announcements & Nutritionists needed","ACF is lookinf for A NUTRITION AND HEALTH PROGRAM MANAGER in YEMEN",8864,"Michael ALVES",2015-06-29,"https://www.en-net.org/question/1811.aspx",NA
"Announcements & Nutritionists needed","Catholic Relief Services is looking for a Senior Technical Advisor in Nutrition!",9228,"Anonymous 3044",2015-06-25,"https://www.en-net.org/question/1808.aspx",NA
"Announcements & Nutritionists needed","Research Officer - Market Based Approaches to Poverty & Nutrition (678)",8828,"Kat Pittore",2015-06-24,"https://www.en-net.org/question/1803.aspx",NA
"Announcements & Nutritionists needed","Consultancy opportunity with World Vision for Nutrition Assessment in Sierra Leone",9570,"Judith Haase",2015-06-24,"https://www.en-net.org/question/1802.aspx",NA
"Announcements & Nutritionists needed","Consultancy opportunity with UNICEF",9185,"Tamsin",2015-06-22,"https://www.en-net.org/question/1798.aspx",NA
"Announcements & Nutritionists needed","Director, Global Initiatives / Deputy Project Director, SPRING (HKI)",8809,"Tamsin",2015-06-22,"https://www.en-net.org/question/1797.aspx",NA
"Announcements & Nutritionists needed","Health and Nutrition Manager for vulnerable populations in South Sudan",9056,"Alan Mason",2015-06-17,"https://www.en-net.org/question/1793.aspx",NA
"Announcements & Nutritionists needed","UN MEDECIN VOLTIGEUR (H/F)",9325,"Michael ALVES",2015-06-16,"https://www.en-net.org/question/1790.aspx",NA
"Announcements & Nutritionists needed","15-451: Community Health and Hygiene Promotion Manager",9342,"Anonymous 1494",2015-06-15,"https://www.en-net.org/question/1783.aspx",NA
"Announcements & Nutritionists needed","Regional Maternal, Child Health and Nutrition Specialist - East Asia",9465,"Colleen Emary",2015-06-15,"https://www.en-net.org/question/1781.aspx",NA
"Announcements & Nutritionists needed","Online survey on health research priorities  - commissioned by DFID. Opportunity to ensure nutrition priorities are included",8977,"Tamsin",2015-06-08,"https://www.en-net.org/question/1777.aspx",NA
"Announcements & Nutritionists needed","15-536: Monitoring, Evaluation, Accountability and Learning (MEAL) Manager",9805,"Anonymous 1494",2015-06-04,"https://www.en-net.org/question/1775.aspx",NA
"Announcements & Nutritionists needed","Independent Contractor, Haiti Country Program Manager",8637,"Anonymous 3007",2015-06-03,"https://www.en-net.org/question/1773.aspx",NA
"Announcements & Nutritionists needed","Research Associate position with the Tata-Cornell Agriculture and Nutrition Initiative (TCi)",9563,"Tamsin",2015-06-02,"https://www.en-net.org/question/1772.aspx",NA
"Announcements & Nutritionists needed","15-575: Nutrition Coordinator",9685,"Anonymous 1494",2015-06-02,"https://www.en-net.org/question/1769.aspx",NA
"Announcements & Nutritionists needed","15-333: Nutrition Coordinator",9408,"Anonymous 1494",2015-06-02,"https://www.en-net.org/question/1768.aspx",NA
"Announcements & Nutritionists needed","15-522: TECHNICAL WASH & NUTRITION DIRECTOR",9189,"Anonymous 1494",2015-06-02,"https://www.en-net.org/question/1767.aspx",NA
"Announcements & Nutritionists needed","15-402: Country Director - Afghanistan",8707,"Anonymous 1494",2015-06-02,"https://www.en-net.org/question/1766.aspx",NA
"Announcements & Nutritionists needed","15-560: NUTRITION ADVISOR",9312,"Anonymous 1494",2015-06-02,"https://www.en-net.org/question/1765.aspx",NA
"Announcements & Nutritionists needed","15-496: OPERATIONS AND FINANCE DIRECTOR",9040,"Anonymous 1494",2015-06-02,"https://www.en-net.org/question/1764.aspx",NA
"Announcements & Nutritionists needed","15-468: COMMUNITY ENGAGEMENT AND SOCIAL AND BEHAVIOR CHANGE ADVISOR",9033,"Anonymous 1494",2015-06-02,"https://www.en-net.org/question/1763.aspx",NA
"Announcements & Nutritionists needed","15-467: SENIOR CAPACITY DEVELOPMENT ADVISOR",8849,"Anonymous 1494",2015-06-02,"https://www.en-net.org/question/1762.aspx",NA
"Announcements & Nutritionists needed","15-465: MONITORING AND EVALUATION DIRECTOR",9345,"Anonymous 1494",2015-06-02,"https://www.en-net.org/question/1761.aspx",NA
"Announcements & Nutritionists needed","15-374: Chief of Party, USAID Afghanistan Initiative for Hygiene, Sanitation, and Nutrition (IHSAN).",8880,"Anonymous 1494",2015-06-02,"https://www.en-net.org/question/1760.aspx",NA
"Announcements & Nutritionists needed","15-581: Country Director",8999,"Anonymous 1494",2015-06-02,"https://www.en-net.org/question/1759.aspx",NA
"Announcements & Nutritionists needed","HelpAge is recruiting a Regional Health Manager (based in Amman)",9130,"Pascale Fritsch",2015-05-28,"https://www.en-net.org/question/1754.aspx",NA
"Announcements & Nutritionists needed","WFP Seeking Nutrition Advocacy Consultant",9640,"Sophia Robele",2015-05-28,"https://www.en-net.org/question/1753.aspx",NA
"Announcements & Nutritionists needed","Save the Children - Emergency Response Personel- Nutrition Adviser- French speaker",8586,"Geraldine Le Cuziat",2015-05-28,"https://www.en-net.org/question/1752.aspx",NA
"Announcements & Nutritionists needed","15-560/NUTRITION ADVISOR",8672,"Anonymous 1494",2015-05-27,"https://www.en-net.org/question/1751.aspx",NA
"Announcements & Nutritionists needed","Nutritionist, Tahoua, Niger, with Concern Worldwide",10483,"Gudrun Stallkamp",2015-05-27,"https://www.en-net.org/question/1749.aspx",NA
"Announcements & Nutritionists needed","Health and Nutrition Advisor, Juba, South Sudan, with Concern Worldwide",10001,"Gudrun Stallkamp",2015-05-27,"https://www.en-net.org/question/1748.aspx",NA
"Announcements & Nutritionists needed","Sr Nutritionist in on-going large ag/nut programme, Karamoja, Concern Worldwide",9633,"Gudrun Stallkamp",2015-05-27,"https://www.en-net.org/question/1747.aspx",NA
"Announcements & Nutritionists needed","Looking for key informants for an exploratory review on kwashiorkor",8830,"Nidia Huerta Uribe",2015-05-26,"https://www.en-net.org/question/1746.aspx",NA
"Announcements & Nutritionists needed","ACF is looking for A NUTRITION AND HEALTH COORDINATOR - LIBERIA",9272,"Michael ALVES",2015-05-22,"https://www.en-net.org/question/1741.aspx",NA
"Announcements & Nutritionists needed","ACF recherche UN COORDINATEUR NUTRITION ET SANTE (H/F) au TCHAD",8911,"Marie Lecuyer",2015-05-20,"https://www.en-net.org/question/1738.aspx",NA
"Announcements & Nutritionists needed","ACF recherche UN EXPERT NUTRITION ET SANTE basé à DJIBOUTI",8641,"Marie Lecuyer",2015-05-20,"https://www.en-net.org/question/1737.aspx",NA
"Announcements & Nutritionists needed","15-333: Nutrition Coordinator",9201,"Anonymous 1494",2015-05-14,"https://www.en-net.org/question/1732.aspx",NA
"Announcements & Nutritionists needed","ACF is looking for A SMART ROVING SURVEY PROGRAM MANAGER",9359,"Michael ALVES",2015-05-11,"https://www.en-net.org/question/1725.aspx",NA
"Announcements & Nutritionists needed","ACF is looking for A MOTHER AND CHILD AND NUTRITION TECHNICAL COORDINATOR in Haiti",8897,"Michael ALVES",2015-05-11,"https://www.en-net.org/question/1724.aspx",NA
"Announcements & Nutritionists needed","15-444/Emergency Nutrition Manager",9181,"Anonymous 1494",2015-05-07,"https://www.en-net.org/question/1717.aspx",NA
"Announcements & Nutritionists needed","15-333/Nutrition Coordinator",8830,"Anonymous 1494",2015-05-07,"https://www.en-net.org/question/1716.aspx",NA
"Announcements & Nutritionists needed","SAVE THE DATE - Link NCA presentation webinar, May 13th",10253,"Julien Morel",2015-05-07,"https://www.en-net.org/question/1715.aspx",NA
"Announcements & Nutritionists needed","SMART survey consultancy S Sudan (Juba) with Concern Worldwide",10484,"Gudrun Stallkamp",2015-05-07,"https://www.en-net.org/question/1714.aspx",NA
"Announcements & Nutritionists needed","SMART survey consultancy S Sudan (Unity State) with Concern Worldwide",10183,"Gudrun Stallkamp",2015-05-07,"https://www.en-net.org/question/1713.aspx",NA
