"Theme","Topic","Views","Author","Posted","Link","Replies"
"Announcements & Nutritionists needed","RFQ CONSULTANCY FOR TST COORDINATION SUPPORT",71,"Jalaa Abdalrahman",2022-11-03,"https://www.en-net.org/question/4708.aspx",NA
"Announcements & Nutritionists needed","UNICEF Consultancy: Women’s nutrition in humanitarian aid",85,"Philip James",2022-11-03,"https://www.en-net.org/question/4707.aspx",NA
"Announcements & Nutritionists needed","RFP Nutrition Information and Assessment Specialist – SMART Specialist",87,"Jalaa Abdalrahman",2022-11-02,"https://www.en-net.org/question/4706.aspx",NA
"Announcements & Nutritionists needed","Recruitment: Policy & Advocacy Adviser: Food and Nutrition Security. Concern Worldwide",76,"Concern Worldwide",2022-11-02,"https://www.en-net.org/question/4705.aspx",NA
"Announcements & Nutritionists needed","The IRC is seeking a Nutrition MEAL Advisor",178,"Casie Tesfai",2022-10-25,"https://www.en-net.org/question/4700.aspx",NA
"Announcements & Nutritionists needed","Job Offer with MSF: Adolescent Health Advisor",198,"Anonymous 41470",2022-10-21,"https://www.en-net.org/question/4695.aspx",NA
"Announcements & Nutritionists needed","Assistant Professor LSHTM/MEIRU Malawi",216,"Dr Marko Kerac",2022-10-11,"https://www.en-net.org/question/4687.aspx",NA
"Announcements & Nutritionists needed","Maternal nutrition specialist - tool development",265,"Charles Nwokorie",2022-10-11,"https://www.en-net.org/question/4686.aspx",NA
"Announcements & Nutritionists needed","UNICEF Burundi seeks Nutritionist - application deadline TODAY!",354,"Tamsin",2022-10-07,"https://www.en-net.org/question/4685.aspx",NA
"Announcements & Nutritionists needed","CONSULTORIA SOBRE O APOIO DO MAMI E DA IYCF-E A MOÇAMBIQUE""                                     CONSULTANCY ON MAMI AND IYCF-E SUPPORT TO MOZAMBIQUE",268,"Jalaa Abdalrahman",2022-09-30,"https://www.en-net.org/question/4684.aspx",NA
"Announcements & Nutritionists needed","CONSULTANCY ON MIYCN-E FOR THE SOMALIA NUTRITION CLUSTER",249,"Jalaa Abdalrahman",2022-09-30,"https://www.en-net.org/question/4683.aspx",NA
"Announcements & Nutritionists needed","CONSULTANCY ON MIYCN-E FOR THE NORTHWEST SYRIA NUTRITION CLUSTER",202,"Jalaa Abdalrahman",2022-09-30,"https://www.en-net.org/question/4682.aspx",NA
"Announcements & Nutritionists needed","GNC Technical Alliance - External evaluation consultancy - Submission deadline extended Tues 4th Oct",305,"GNC Technical Alliance Leadership Team",2022-09-27,"https://www.en-net.org/question/4681.aspx",NA
"Announcements & Nutritionists needed","Economic Security Career webinar",203,"Els Dehantschutter",2022-09-26,"https://www.en-net.org/question/4679.aspx",NA
"Announcements & Nutritionists needed","Seeking national actors from humanitarian or development contexts interested in contributing to a Nutrition Determinants Working Group",447,"Alexa Humphreys",2022-09-23,"https://www.en-net.org/question/4677.aspx",NA
"Announcements & Nutritionists needed","Nutrition and the Climate Crisis",310,"Alexa Humphreys",2022-09-23,"https://www.en-net.org/question/4676.aspx",NA
"Announcements & Nutritionists needed","W3 Professorship in Global Food Security (Endowed Professorship), Giessen, Germany",294,"Michael Krawinkel",2022-09-21,"https://www.en-net.org/question/4674.aspx",NA
"Announcements & Nutritionists needed","Consultancy - Social and Behavioral Change ACF DRC",215,"Anonymous 41056",2022-09-21,"https://www.en-net.org/question/4673.aspx",NA
"Announcements & Nutritionists needed","Consultancy - External Evaluation of the GNC Technical Alliance",241,"GNC Technical Alliance Leadership Team",2022-09-14,"https://www.en-net.org/question/4670.aspx",NA
"Announcements & Nutritionists needed","WFP HQ - Nutrition Sensitive Cash Based Transfers Consultant",221,"Lindsey Wise",2022-09-14,"https://www.en-net.org/question/4669.aspx",NA
"Announcements & Nutritionists needed","Food and Nutrition Security Advisor",476,"Kat Pittore",2022-09-09,"https://www.en-net.org/question/4667.aspx",NA
"Announcements & Nutritionists needed","MRC grant: Develop and evaluate innovative methods to study adolescent health",339,"Stephanie Ray",2022-09-07,"https://www.en-net.org/question/4665.aspx",NA
"Announcements & Nutritionists needed","REQUEST FOR PROPOSAL – FRAMEWORK AGREEMENT “CONSULTANCY ON ORGANISATIONAL CAPACITY STRENGTHENING FOR NATIONAL NGOS”",518,"Jalaa Abdalrahman",2022-08-26,"https://www.en-net.org/question/4659.aspx",NA
"Announcements & Nutritionists needed","availability of MUAC TAPES FOR CHILDREN AND ADULTS ALREADY AVAILABLE IN NIGER, BURKINA, MALI .....",298,"Anonymous 9774",2022-08-25,"https://www.en-net.org/question/4656.aspx",NA
"Announcements & Nutritionists needed","Consultancy: Reviewer (Copy Editor) for updated Global Surge (CMAM & Health) Operational Guide and Toolkit",616,"Lucy Lafferty",2022-08-11,"https://www.en-net.org/question/4651.aspx",NA
"Announcements & Nutritionists needed","Career Opportunities: Nutritionist (Treatment Coordinator) Consultant",822,"Aachal CHAND",2022-08-10,"https://www.en-net.org/question/4650.aspx",NA
"Announcements & Nutritionists needed","VACANCY ANNOUNCEMENT - Deputy Nutrition Cluster Coordinator (South Sudan) (International Consultancy)",463,"Aachal CHAND",2022-08-10,"https://www.en-net.org/question/4649.aspx",NA
"Announcements & Nutritionists needed","Vacancy - Senior Technical Associate",511,"Office ENN",2022-08-10,"https://www.en-net.org/question/4648.aspx",NA
"Announcements & Nutritionists needed","MSF is looking for a NUTRITION MOBILE SUPPORT TECHNICIAN",491,"Montse Escruela i Cabrera",2022-08-05,"https://www.en-net.org/question/4646.aspx",NA
"Announcements & Nutritionists needed","REQUEST FOR PROPOSALS SMART Virtual Training Consultant - Framework Agreement",407,"Jalaa Abdalrahman",2022-08-04,"https://www.en-net.org/question/4645.aspx",NA
"Announcements & Nutritionists needed","Consultant needed for root cause analysis of micronutrient data",392,"Megan Bourassa",2022-07-26,"https://www.en-net.org/question/4638.aspx",NA
"Announcements & Nutritionists needed","Consultant needed for micronutrient data case studies",374,"Megan Bourassa",2022-07-26,"https://www.en-net.org/question/4637.aspx",NA
"Announcements & Nutritionists needed","CONSULTANCY ON ASSESSMENT SUPPORT TO BOLIVIA",368,"Jalaa Abdalrahman",2022-07-25,"https://www.en-net.org/question/4636.aspx",NA
"Announcements & Nutritionists needed","Consultant to evaluate health-nutrition programme DRC (Concern)",458,"Kate Golden",2022-07-20,"https://www.en-net.org/question/4631.aspx",NA
"Announcements & Nutritionists needed","ICRC Field Nutritionist (French and/or Spanish speaking)",478,"Caroline Wilkinson",2022-07-20,"https://www.en-net.org/question/4629.aspx",NA
"Announcements & Nutritionists needed","Consultancy or FT position: Women's Nutrition Policy Advocacy and Communications Advisor",355,"Kristen Kappos",2022-07-19,"https://www.en-net.org/question/4623.aspx",NA
"Announcements & Nutritionists needed","Undernourished pregnant and lactating women (PLW) in humanitarian contexts – what to do? Help us find out.",538,"Melanie Sudetic",2022-07-19,"https://www.en-net.org/question/4621.aspx",NA
"Announcements & Nutritionists needed","ENN - Senior Technical Associate",384,"Office ENN",2022-07-18,"https://www.en-net.org/question/4620.aspx",NA
"Announcements & Nutritionists needed","UNHCR Job Posting: Senior Nutrition & Food Security Officer, P4, Geneva, Switzerland",536,"Terry Theuri",2022-07-13,"https://www.en-net.org/question/4617.aspx",NA
"Announcements & Nutritionists needed","Vacancy: Leader of the MSF nutrition working group",564,"Anonymous 41094",2022-07-11,"https://www.en-net.org/question/4615.aspx",NA
"Announcements & Nutritionists needed","Vacancy announcement: WFP Nutrition and Food Systems consultant - deadline 15 July",450,"Anonymous 41093",2022-07-08,"https://www.en-net.org/question/4612.aspx",NA
"Announcements & Nutritionists needed","Head of Project for WFP Programming with Welthungerhilfe (WHH) in North Darfur (apply by July 24)",586,"Gudrun",2022-07-06,"https://www.en-net.org/question/4610.aspx",NA
"Announcements & Nutritionists needed","Four New Guidance Notes: Transforming Programming to Improve Nutrition Outcomes",414,"Osob Osman",2022-07-04,"https://www.en-net.org/question/4606.aspx",NA
"Announcements & Nutritionists needed","Save the Children is recruiting a Global Infant and Young Child Feeding in Emergencies (IYCFE) Adviser",850,"Emily Keane",2022-06-24,"https://www.en-net.org/question/4601.aspx",NA
"Announcements & Nutritionists needed","ACF DRC is looking for a Head of Nutritional Surveillance Department",415,"Anonymous 41056",2022-06-23,"https://www.en-net.org/question/4600.aspx",NA
"Announcements & Nutritionists needed","Interested in Shaping IBLCE’s Second Credential Pilot Programme?",622,"Anonymous 31975",2022-06-22,"https://www.en-net.org/question/4598.aspx",NA
"Announcements & Nutritionists needed","Surge Health and Nutrition Advisor, Afghanistan",451,"Anonymous 806",2022-06-19,"https://www.en-net.org/question/4597.aspx",NA
"Announcements & Nutritionists needed","Health and Nutrition Advisor",568,"Anonymous 806",2022-06-19,"https://www.en-net.org/question/4595.aspx",NA
"Announcements & Nutritionists needed","Health and Nutrition Advisor",492,"Anonymous 806",2022-06-19,"https://www.en-net.org/question/4594.aspx",NA
"Announcements & Nutritionists needed","Hiring Program Specialist- Nutrition and Health Services",539,"Anonymous 40750",2022-06-15,"https://www.en-net.org/question/4593.aspx",NA
"Announcements & Nutritionists needed","WFP Nutrition Advocacy Specialist needed",844,"Saskia",2022-06-15,"https://www.en-net.org/question/4592.aspx",NA
"Announcements & Nutritionists needed","Nutrition Manager (Generic) All Medair field programmes.",556,"Anonymous 806",2022-06-13,"https://www.en-net.org/question/4591.aspx",NA
"Announcements & Nutritionists needed","Health and Nutrition Project Manager",653,"Anonymous 806",2022-06-13,"https://www.en-net.org/question/4590.aspx",NA
"Announcements & Nutritionists needed","DRC - Nutrition consultancy - Cost-Effectiveness study of simplified approaches",583,"COOPI - Cooperazione Internazionale",2022-06-13,"https://www.en-net.org/question/4589.aspx",NA
"Announcements & Nutritionists needed","Looking for a Program Manager- Nutrition and Health Services",626,"Anonymous 40750",2022-06-01,"https://www.en-net.org/question/4581.aspx",NA
"Announcements & Nutritionists needed","INVITATION TO TENDER FOR NUTRITION SERVICES",545,"Jalaa Abdalrahman",2022-05-24,"https://www.en-net.org/question/4577.aspx",NA
"Announcements & Nutritionists needed","Consultancy: Nutrition and health system landscape analysis- Maldives",522,"Kristen Kappos",2022-05-23,"https://www.en-net.org/question/4576.aspx",NA
"Announcements & Nutritionists needed","Consultancy: Nutrition and health system landscape analysis- Bhutan",432,"Kristen Kappos",2022-05-23,"https://www.en-net.org/question/4575.aspx",NA
"Announcements & Nutritionists needed","Consultancy: Nutrition and health system landscape analysis- Sri Lanka",378,"Kristen Kappos",2022-05-23,"https://www.en-net.org/question/4574.aspx",NA
"Announcements & Nutritionists needed","Consultancy: Anthropometry expert - Ethiopia and Rwanda",471,"Stacy Griswold",2022-05-20,"https://www.en-net.org/question/4572.aspx",NA
"Announcements & Nutritionists needed","CONSULTANCY ON LOCALISATION OF TECHNICAL SUPPORT- Extension",439,"Jalaa Abdalrahman",2022-05-20,"https://www.en-net.org/question/4571.aspx",NA
"Announcements & Nutritionists needed","FAO Global Symposium on Soils for Nutrition July 2022",657,"Tamsin",2022-05-04,"https://www.en-net.org/question/4559.aspx",NA
"Announcements & Nutritionists needed","Registration for ANH2022 is open now: Join us at our annual agriculture, nutrition and health conference",918,"Sylvia Levy",2022-04-29,"https://www.en-net.org/question/4555.aspx",NA
"Announcements & Nutritionists needed","Global Advisor Nutrition, Aga Khan Foundation",854,"Tamsin",2022-04-27,"https://www.en-net.org/question/4554.aspx",NA
"Announcements & Nutritionists needed","Survey on Cash, Vouchers and In-Kind Assistance - USAID Advancing Nutrition",756,"Adam Bailes",2022-04-25,"https://www.en-net.org/question/4551.aspx",NA
"Announcements & Nutritionists needed","Tackling the Crisis of Acute Malnutrition: Improving Treatment Coverage. WHA Side Event",852,"Colleen Emary",2022-04-19,"https://www.en-net.org/question/4549.aspx",NA
"Announcements & Nutritionists needed","Interested in Summer course (11-22 July 2022) Health Emergencies in Large Populations (HELP) at Johns Hopkins University?",1119,"Mija Ververs",2022-04-18,"https://www.en-net.org/question/4547.aspx",NA
"Announcements & Nutritionists needed","CONSULTANCY ON LOCALISATION OF TECHNICAL SUPPORT",1193,"Jalaa Abdalrahman",2022-04-11,"https://www.en-net.org/question/4537.aspx",NA
"Announcements & Nutritionists needed","ENN: Chief Executive Officer",991,"Office ENN",2022-04-08,"https://www.en-net.org/question/4536.aspx",NA
"Announcements & Nutritionists needed","The IRC is hiring a Nutrition & M&E Technical Advisor",1642,"Casie Tesfai",2022-03-31,"https://www.en-net.org/question/4532.aspx",NA
"Announcements & Nutritionists needed","The IRC is looking for a West Africa Nutrition Technical Advisor",1537,"Casie Tesfai",2022-03-31,"https://www.en-net.org/question/4531.aspx",NA
"Announcements & Nutritionists needed","CONSULTANCY FOR HONDURAS IYCF-E SUPPORT",1396,"Jalaa Abdalrahman",2022-03-28,"https://www.en-net.org/question/4526.aspx",NA
"Announcements & Nutritionists needed","WFP HQ is recruiting one Nutrition in Emergencies specialist for the Rapid Response Team",1805,"Gwenaelle Garnier",2022-03-22,"https://www.en-net.org/question/4523.aspx",NA
"Announcements & Nutritionists needed","CONSULTANCY TO LEAD MODERATE WASTING INITIAITIVE",1763,"Jalaa Abdalrahman",2022-03-17,"https://www.en-net.org/question/4516.aspx",NA
"Announcements & Nutritionists needed","REQUEST FOR QUOTATION FRAMEWORK AGREEMENT “NUTRITION/PUBLIC HEALTH EXPERTS FOR UKRAINE RESPONSE”",2029,"Jalaa Abdalrahman",2022-03-15,"https://www.en-net.org/question/4514.aspx",NA
"Announcements & Nutritionists needed","IMMANA is recruiting: 2 jobs, Comms Officer and Programme Coordinator",1604,"Stephanie Ray",2022-03-15,"https://www.en-net.org/question/4512.aspx",NA
"Announcements & Nutritionists needed","IMC is looking for a nutrition advisor to support with the Ukraine response",2073,"Iris Bollemeijer",2022-03-14,"https://www.en-net.org/question/4511.aspx",NA
"Announcements & Nutritionists needed","CONSULTANCY ON STABLISATION CENTRES IN SYRIA",1983,"Jalaa Abdalrahman",2022-03-09,"https://www.en-net.org/question/4507.aspx",NA
"Announcements & Nutritionists needed","Exciting opportunity with UNICEF Haiti- Chief Nutrition P4 fixed term",1938,"sara brownlow",2022-03-08,"https://www.en-net.org/question/4505.aspx",NA
"Announcements & Nutritionists needed","Call for Expression of Interest: stories from local heroes fighting climate change, protecting biodiversity, and improving nutrition",2077,"Tamsin",2022-03-03,"https://www.en-net.org/question/4504.aspx",NA
"Announcements & Nutritionists needed","REQUEST FOR PROPOSAL – FRAMEWORK AGREEMENT “CONSULTANCY FOR PROVIDING SOCIAL BEHAVIOR CHANGE (SBC) EXPERTISE”",2170,"Jalaa Abdalrahman",2022-03-02,"https://www.en-net.org/question/4503.aspx",NA
"Announcements & Nutritionists needed","ENN: IFE Facilitator vacancy",2542,"Office ENN",2022-02-24,"https://www.en-net.org/question/4498.aspx",NA
"Announcements & Nutritionists needed","SAVE THE DATE: launch of new WHO-UNICEF report on FORMULA MILK MARKETING (23 February 2022)",2278,"Tamsin",2022-02-18,"https://www.en-net.org/question/4496.aspx",NA
"Announcements & Nutritionists needed","Positions with Eleanor Crook Foundation",2739,"Tamsin",2022-02-15,"https://www.en-net.org/question/4495.aspx",NA
"Announcements & Nutritionists needed","Vacancy: WFP HQ is recruiting two SBC consultant positions",2420,"Sara Bernardini",2022-02-14,"https://www.en-net.org/question/4493.aspx",NA
"Announcements & Nutritionists needed","Nutrition Program Manager/Fundación Nous Cims SPANISH & FRENCH NEEDED",2624,"Anonymous 40902",2022-02-11,"https://www.en-net.org/question/4491.aspx",NA
"Announcements & Nutritionists needed","Funding opportunity",2616,"Funding opportunity - nutritional choice",2022-02-08,"https://www.en-net.org/question/4489.aspx",NA
"Announcements & Nutritionists needed","Job Opportunity: Programme Manager",2859,"The Power of Nutrition",2022-02-08,"https://www.en-net.org/question/4488.aspx",NA
"Announcements & Nutritionists needed","FHI360 looking for a senior emergency adviser for a consultancy in Afghanistan",2844,"Alessandro",2022-02-02,"https://www.en-net.org/question/4483.aspx",NA
"Announcements & Nutritionists needed","ANH Academy abstract submission invitation (deadline 13 Feb)",2830,"Stephanie Ray",2022-01-31,"https://www.en-net.org/question/4481.aspx",NA
"Announcements & Nutritionists needed","Webinar on Women's Nutrition: a Summary of Evidence, Policy and Practice",2934,"Office ENN",2022-01-25,"https://www.en-net.org/question/4480.aspx",NA
"Announcements & Nutritionists needed","Call for proposals: Consolidating and Prioritising Nutrition Research in Rakhine State, Myanmar",3085,"Nicki Connell",2022-01-21,"https://www.en-net.org/question/4476.aspx",NA
"Announcements & Nutritionists needed","UNV UNICEF Angola Nutrition Specialist",3181,"Ciara Hogan",2022-01-19,"https://www.en-net.org/question/4472.aspx",NA
"Announcements & Nutritionists needed","Interested in a Nutritionist job at ICRC Geneva?",3823,"Stephen Muriira",2022-01-19,"https://www.en-net.org/question/4470.aspx",NA
"Announcements & Nutritionists needed","ICRC Nutritionist Position HQ Geneva for May 2022",3519,"Caroline Wilkinson",2022-01-13,"https://www.en-net.org/question/4466.aspx",NA
"Announcements & Nutritionists needed","Request for contribution: CVA for Nutrition in Emergencies - Promising practices & common operational challenges - looking for documents !",3610,"Johanna Jelensperger",2022-01-12,"https://www.en-net.org/question/4465.aspx",NA
"Announcements & Nutritionists needed","Helen Keller Kenya is recruiting a nutrition program manager for a CMAM and ICCM study",3729,"David Doledec",2022-01-04,"https://www.en-net.org/question/4463.aspx",NA
"Announcements & Nutritionists needed","Register for ANH webinar on food security in humanitarian crises",3834,"Claire Dooley",2021-12-29,"https://www.en-net.org/question/4462.aspx",NA
"Announcements & Nutritionists needed","Nutrition Manager, Generic",3897,"Anonymous 806",2021-11-30,"https://www.en-net.org/question/4452.aspx",NA
"Announcements & Nutritionists needed","Are any interships avaliable?",3701,"Maham khaliq",2021-11-20,"https://www.en-net.org/question/4447.aspx",NA
"Announcements & Nutritionists needed","Vacancy: WFP HQ is recruiting a Research Officer (Maternal Nutrition) consultant",3987,"Jessica Bourdaire",2021-11-17,"https://www.en-net.org/question/4446.aspx",NA
"Announcements & Nutritionists needed","Vacancy: WFP Learning and Capacity development consultancy - Nutrition Integration",3430,"Kauffmann",2021-11-17,"https://www.en-net.org/question/4444.aspx",NA
"Announcements & Nutritionists needed","Vacancy announcement: Global Nutrition Cluster Helpdesk for Inter-sectoral Collaboration",3608,"Anna Ziolkovska",2021-11-12,"https://www.en-net.org/question/4443.aspx",NA
"Announcements & Nutritionists needed","Vacancy announcement: Global Nutrition Cluster Helpdesk for Nutrition Information Systems",3529,"Anna Ziolkovska",2021-11-12,"https://www.en-net.org/question/4442.aspx",NA
"Announcements & Nutritionists needed","UNICEF seeks Nutrition Specialist",3962,"Tamsin",2021-11-12,"https://www.en-net.org/question/4441.aspx",NA
"Announcements & Nutritionists needed","SUN Movement Secretariat / UNOPS: opportunity for 2 consultants to review the SUN Movement Pooled Fund",3648,"Tamsin",2021-11-11,"https://www.en-net.org/question/4440.aspx",NA
"Announcements & Nutritionists needed","The IRC is hiring a Statistician /Demographer consultant",3606,"Casie Tesfai",2021-11-02,"https://www.en-net.org/question/4435.aspx",NA
"Announcements & Nutritionists needed","The Global Nutrition Cluster is hiring an Advocacy Consultant",3604,"Anna Ziolkovska",2021-11-02,"https://www.en-net.org/question/4434.aspx",NA
"Announcements & Nutritionists needed","International Medical Corps is hiring a nutrition coordinator in South Sudan",3915,"Iris Bollemeijer",2021-10-28,"https://www.en-net.org/question/4430.aspx",NA
"Announcements & Nutritionists needed","Update webinar on the WHO Guideline Development Process",3641,"Office ENN",2021-10-22,"https://www.en-net.org/question/4427.aspx",NA
"Announcements & Nutritionists needed","Consultancy opportunity to develop Nutrition and Resilience country case studies",3440,"Kauffmann",2021-10-22,"https://www.en-net.org/question/4425.aspx",NA
"Announcements & Nutritionists needed","Vacancy: Knowledge management team lead WFP",3643,"Stien Gijsel",2021-10-18,"https://www.en-net.org/question/4422.aspx",NA
"Announcements & Nutritionists needed","Job Posting: Senior Regional Technical Director (Africa)",3635,"Quinn Harvey",2021-10-12,"https://www.en-net.org/question/4419.aspx",NA
"Announcements & Nutritionists needed","Looking for people who have worked in Ebola Treatment Units",3804,"Natalie Sessions",2021-10-11,"https://www.en-net.org/question/4417.aspx",NA
"Announcements & Nutritionists needed","Nutrition Consultant required: Barriers, Bottlenecks and Solutions for Nutrition Programming  in Rakhine State, Myanmar",4010,"Nicki Connell",2021-09-28,"https://www.en-net.org/question/4410.aspx",NA
"Announcements & Nutritionists needed","Event 2: Pre-COP 26 | Nutrition, climate change and biodiversity – Challenges and opportunities for future generations | 2 October 2021",3726,"Tamsin",2021-09-28,"https://www.en-net.org/question/4409.aspx",NA
"Announcements & Nutritionists needed","EVENT 1: Save the Date: Pre-COP 26 | Climate change, biodiversity and nutrition – Promoting healthy diets from efficient, inclusive, resilient and sustainable food systems | 1 October 2021",3820,"Tamsin",2021-09-28,"https://www.en-net.org/question/4408.aspx",NA
"Announcements & Nutritionists needed","November 2021 Annual workshop of the Global Community of Practice on Scaling Development Outcomes",3716,"Tamsin",2021-09-26,"https://www.en-net.org/question/4407.aspx",NA
"Announcements & Nutritionists needed","Seeking a bilingual French-English Intern (paid)",3689,"Britt Titus",2021-09-24,"https://www.en-net.org/question/4406.aspx",NA
"Announcements & Nutritionists needed","The IRC is hiring a CMAM scale MEAL Advisor",3681,"Casie Tesfai",2021-09-14,"https://www.en-net.org/question/4401.aspx",NA
"Announcements & Nutritionists needed","CONSULTANCY ON CASH AND VOUCHER ASSISTANCE (CVA) FOR NUTRITION",3780,"Jalaa Abdalrahman",2021-09-08,"https://www.en-net.org/question/4397.aspx",NA
"Announcements & Nutritionists needed","Nutrition manager in South Sudan for International Medical Corps",4031,"Iris Bollemeijer",2021-08-30,"https://www.en-net.org/question/4391.aspx",NA
"Announcements & Nutritionists needed","Job opportunity: Technical Director, Nutrition in Humanitarian Contexts (USAID Advancing Nutrition)",3629,"Charlotte Block",2021-08-26,"https://www.en-net.org/question/4389.aspx",NA
"Announcements & Nutritionists needed","Consultancy to conduct SGBA of Maternal, Newborn, Child Programs in NIgeria - Nutrition International",4043,"Amina Atta",2021-08-24,"https://www.en-net.org/question/4387.aspx",NA
"Announcements & Nutritionists needed","Job Opportunity: IMMANA Research Uptake Manager",4026,"Abel Endashaw",2021-08-19,"https://www.en-net.org/question/4380.aspx",NA
"Announcements & Nutritionists needed","Action Against Hunger UK is looking for a data Analyst and research Advisor",4069,"ALEXANDRA RUTISHAUSER",2021-08-17,"https://www.en-net.org/question/4378.aspx",NA
"Announcements & Nutritionists needed","MIHR seeking MAMI consultant - deadline to apply 23 Aug 2021",3636,"Kelsey Grey",2021-08-17,"https://www.en-net.org/question/4377.aspx",NA
"Announcements & Nutritionists needed","Nutrition Security Consultant - MSF",3798,"Nathalie AVRIL",2021-08-13,"https://www.en-net.org/question/4376.aspx",NA
"Announcements & Nutritionists needed","COVID-19 and nutrition programmes: What do you want to hear more about?  - COVID-19",3779,"Eilise Brennan",2021-08-04,"https://www.en-net.org/question/4369.aspx",NA
"Announcements & Nutritionists needed","Vacancy nutrition learning and development specialist",3994,"Stien Gijsel",2021-08-04,"https://www.en-net.org/question/4368.aspx",NA
"Announcements & Nutritionists needed","Vacancy Announcement: Nutrition Specialist (Nutrition in Emergencies Sector/Cluster Coordinator), P3 based in Yangon",3886,"Sanjay Kumar Das",2021-08-04,"https://www.en-net.org/question/4367.aspx",NA
"Announcements & Nutritionists needed","Vacancy Announcement: Emergency Nutrition Advisor (Save the Children)",3863,"Sarah (Butler) O'Flynn",2021-08-04,"https://www.en-net.org/question/4366.aspx",NA
"Announcements & Nutritionists needed","Several positions advertised for nutrition relevant research analysts in Institute of Economic Growth India",3888,"Anonymous 40722",2021-07-27,"https://www.en-net.org/question/4363.aspx",NA
"Announcements & Nutritionists needed","Volunteers needed for study of psycho-social care practices for children with severe acute malnutrition",3705,"Mike Kalmus Eliasz",2021-07-20,"https://www.en-net.org/question/4361.aspx",NA
"Announcements & Nutritionists needed","ENN's website usability survey",3731,"Office ENN",2021-07-20,"https://www.en-net.org/question/4359.aspx",NA
"Announcements & Nutritionists needed","Food Systems Summit Parallel Sessions: Tackling Malnutrition through Action and Accountability",3734,"Office ENN",2021-07-19,"https://www.en-net.org/question/4357.aspx",NA
