"Theme","Topic","Views","Author","Posted","Link","Replies"
"Assessment and Surveillance","CMN training/assessment",9177,"Ranjith",2014-03-03,"https://www.en-net.org/question/1288.aspx",1
"Assessment and Surveillance","developing a methodology for a highly security compromised area. need guidence",7272,"Dr Mohammad Najeeb",2014-02-26,"https://www.en-net.org/question/1281.aspx",1
"Assessment and Surveillance","MUAC tapes",17855,"Jan Komrska",2014-02-13,"https://www.en-net.org/question/1274.aspx",12
"Assessment and Surveillance","Survey Sample for Pastoral Communities",7014,"Abbas Kedir Jelde",2014-02-11,"https://www.en-net.org/question/1272.aspx",1
"Assessment and Surveillance","SMART on-site selection of village",7233,"Frederich Christian Tan",2014-02-11,"https://www.en-net.org/question/1271.aspx",1
"Assessment and Surveillance","conversion of sample size to household",12496,"Anonymous 81",2014-02-09,"https://www.en-net.org/question/1270.aspx",22
"Assessment and Surveillance","Check list or guidance note (summarize) for before starting & during conduction of SQUEAC (Preparation of SQUEAC)",9312,"Anonymous 739",2014-02-07,"https://www.en-net.org/question/1269.aspx",0
"Assessment and Surveillance","Minimum Union Councils (UC) for SQUEAC due to any reasons",9233,"Anonymous 739",2014-02-07,"https://www.en-net.org/question/1268.aspx",1
"Assessment and Surveillance","SMART urban sampling",8589,"Maja Kuhar",2014-02-05,"https://www.en-net.org/question/1263.aspx",5
"Assessment and Surveillance","Establishment of Nutrition Surveillance System",7614,"Frederich Christian Tan",2014-01-31,"https://www.en-net.org/question/1260.aspx",4
"Assessment and Surveillance","SQUEAC, when CMAM program ends",10437,"Anonymous 739",2014-01-31,"https://www.en-net.org/question/1258.aspx",8
"Assessment and Surveillance","NCA",9873,"Dr. Kamal Raj",2014-01-09,"https://www.en-net.org/question/1240.aspx",2
"Assessment and Surveillance","SLEAC and SQUEAC",11704,"Anonymous 2352",2013-12-05,"https://www.en-net.org/question/1221.aspx",1
"Assessment and Surveillance","Is mortality survey a must to be conducted along with SMART?",7836,"Anonymous 81",2013-12-03,"https://www.en-net.org/question/1217.aspx",3
"Assessment and Surveillance","Individual data entry in mortality data set of ENA for HH size > 20",8214,"Anonymous 2411",2013-11-29,"https://www.en-net.org/question/1215.aspx",10
"Assessment and Surveillance","SQUEAC - Weighted boosters and barriers",10893,"Anonymous 81",2013-11-25,"https://www.en-net.org/question/1211.aspx",5
"Assessment and Surveillance","Vulnerability Assessmnet: Indepth analysis of nutrition versus socio-economic indicators",6890,"Anonymous 2354",2013-11-19,"https://www.en-net.org/question/1207.aspx",2
"Assessment and Surveillance","Setting up of Nutrition serveillance",10063,"Anonymous 81",2013-11-16,"https://www.en-net.org/question/1201.aspx",9
"Assessment and Surveillance","KAP surveys",10915,"Anonymous 557",2013-11-06,"https://www.en-net.org/question/1194.aspx",2
"Assessment and Surveillance","Why Credibility Interval (CI) is slightly changing while estimating Posterior Coverage by using SQUEAC coverage estimate calculator (Version 3.01)",9946,"Anonymous 1310",2013-10-30,"https://www.en-net.org/question/1187.aspx",4
"Assessment and Surveillance","Low OTP Coverage",10164,"Anonymous 2352",2013-10-28,"https://www.en-net.org/question/1185.aspx",4
"Assessment and Surveillance","sampleXS and things that I should know!",6762,"Anonymous 557",2013-10-11,"https://www.en-net.org/question/1170.aspx",1
"Assessment and Surveillance","SQUEAC Coverage survey",12120,"Anonymous 2264",2013-10-08,"https://www.en-net.org/question/1163.aspx",20
"Assessment and Surveillance","Discrepancy between BayesSQUEAC calculator and Manual calculation",10033,"Anonymous 81",2013-09-30,"https://www.en-net.org/question/1152.aspx",3
"Assessment and Surveillance","SQUEAC Stage",10672,"Anonymous 81",2013-09-27,"https://www.en-net.org/question/1151.aspx",3
"Assessment and Surveillance","malnutrition rate",10950,"Anonymous 2180",2013-09-24,"https://www.en-net.org/question/1144.aspx",24
"Assessment and Surveillance","Appropriate effect size in estimating sample size",7709,"Anonymous 2356",2013-09-19,"https://www.en-net.org/question/1142.aspx",1
"Assessment and Surveillance","Smart Survey Methodology versus 30 by 30 cluster sampling -comparison of results",9348,"Anonymous 2354",2013-09-13,"https://www.en-net.org/question/1141.aspx",1
"Assessment and Surveillance","Assessing Relationships between Food security and population growth",6890,"Mahaman Elhadji Hallarou",2013-09-09,"https://www.en-net.org/question/1137.aspx",0
"Assessment and Surveillance","Sample size estimation for follow up CSAS survey",9813,"Anonymous 680",2013-09-05,"https://www.en-net.org/question/1134.aspx",1
"Assessment and Surveillance","time to complementary feeding initation sample size issue",7154,"Anonymous 1727",2013-07-20,"https://www.en-net.org/question/1104.aspx",2
"Assessment and Surveillance","SFP coverage for pregnant and lactating women",8247,"Anonymous 422",2013-07-12,"https://www.en-net.org/question/1096.aspx",4
"Assessment and Surveillance","How to minimize the problem of getting less SAM children than minimum sample size due to big variation in village population figure?",9529,"Anonymous 1310",2013-07-03,"https://www.en-net.org/question/1092.aspx",1
"Assessment and Surveillance","SMART surveys and interpretation of quality",12496,"Josek",2013-06-25,"https://www.en-net.org/question/1087.aspx",22
"Assessment and Surveillance","Household dietary diversity score also among pastoralist communities?",8232,"Melanie Bruns",2013-06-18,"https://www.en-net.org/question/1080.aspx",3
"Assessment and Surveillance","looking for adult stadiometers - urgently!",7363,"Victoria Sibson",2013-06-15,"https://www.en-net.org/question/1079.aspx",1
"Assessment and Surveillance","Food groups to assess diet diversity",9116,"Nicki Connell",2013-06-11,"https://www.en-net.org/question/1069.aspx",3
"Assessment and Surveillance","analysis",7252,"Anonymous 1727",2013-05-30,"https://www.en-net.org/question/1060.aspx",1
"Assessment and Surveillance","Household adjustment unit",6883,"Bienfait",2013-05-22,"https://www.en-net.org/question/1048.aspx",2
"Assessment and Surveillance","LQAS types",10818,"Anonymous 81",2013-05-22,"https://www.en-net.org/question/1047.aspx",7
"Assessment and Surveillance","Should results for small and wide area surveys be combined?",10011,"Anonymous 422",2013-05-21,"https://www.en-net.org/question/1044.aspx",4
"Assessment and Surveillance","Impact assessment on project addressing specific elements of the community",7581,"Anonymous 81",2013-05-14,"https://www.en-net.org/question/1042.aspx",4
"Assessment and Surveillance","SMART Question",7498,"Gezahegn S.",2013-05-08,"https://www.en-net.org/question/1037.aspx",3
"Assessment and Surveillance","Cluster or SRS",7801,"Tamsin Walters",2013-05-07,"https://www.en-net.org/question/1036.aspx",2
"Assessment and Surveillance","Effect of qualitative data on estimation of CMAM program coverage",10334,"Anonymous 1570",2013-04-18,"https://www.en-net.org/question/1026.aspx",2
"Assessment and Surveillance","Oedema",8392,"Njeri Waigwa",2013-04-17,"https://www.en-net.org/question/1023.aspx",2
"Assessment and Surveillance","Experience using SQUEAC surveys to assess BSFP/TSFP coverage",10317,"Nicki Connell",2013-04-15,"https://www.en-net.org/question/1022.aspx",3
"Assessment and Surveillance","Coverage prevalence survey for blanket SFP for chronic malnutrition",10738,"Anonymous 2232",2013-03-18,"https://www.en-net.org/question/995.aspx",6
"Assessment and Surveillance","MUAC ANALYSE",10192,"FRANCK ALE",2013-03-14,"https://www.en-net.org/question/991.aspx",5
"Assessment and Surveillance","Defining new variables and assign value using EPIinfo version 3.5.4",10272,"Anonymous 81",2013-03-08,"https://www.en-net.org/question/985.aspx",7
"Assessment and Surveillance","Allocation of sample by proportion",9335,"Anonymous 81",2013-02-25,"https://www.en-net.org/question/979.aspx",4
"Assessment and Surveillance","Rate of weight gain in Infants and Under 5",6969,"Charulatha Banerjee",2013-02-23,"https://www.en-net.org/question/978.aspx",2
"Assessment and Surveillance","late admission investigated by plotting MUAC",9848,"FRANCK ALE",2013-02-15,"https://www.en-net.org/question/976.aspx",1
"Assessment and Surveillance","Stunting screening and disability",7310,"Antony",2013-02-14,"https://www.en-net.org/question/972.aspx",1
"Assessment and Surveillance","Determine  carers willingness to  walk to access services",10073,"FRANCK ALE",2013-02-14,"https://www.en-net.org/question/971.aspx",3
"Assessment and Surveillance","Length of recall period during SMART survey",8504,"Rogers Wanyama",2013-02-11,"https://www.en-net.org/question/966.aspx",2
"Assessment and Surveillance","Nutrition assessment in small pieces livelihood zones",9092,"Anonymous 81",2013-02-01,"https://www.en-net.org/question/965.aspx",8
"Assessment and Surveillance","MAM versus SAM ratio, indicator of improvement?",8080,"Elisa Dominguez",2013-01-28,"https://www.en-net.org/question/958.aspx",3
"Assessment and Surveillance","Maximum % of FLAG in SMART surveys",7601,"Anaïs",2013-01-28,"https://www.en-net.org/question/957.aspx",2
"Assessment and Surveillance","MUAC and overnutrition in adults",9093,"Anonymous 182",2013-01-24,"https://www.en-net.org/question/952.aspx",2
"Assessment and Surveillance","IMPACT EVALUATION",10955,"FRANCK ALE",2013-01-18,"https://www.en-net.org/question/947.aspx",13
"Assessment and Surveillance","When to conduct Wide Area survey",10532,"Anonymous 422",2013-01-15,"https://www.en-net.org/question/942.aspx",3
"Assessment and Surveillance","MUAC cut off to identify overweight pregnant women",8384,"Anonymous 1722",2012-11-27,"https://www.en-net.org/question/914.aspx",3
"Assessment and Surveillance","Any CMAM program with a coverage higher than 90% in a camp setting?",11008,"Alexandra Rutishauser-Perera",2012-11-26,"https://www.en-net.org/question/913.aspx",4
"Assessment and Surveillance","Existing excell spreadsheets for cross tabulation of nutrition data?",7507,"Anonymous 1722",2012-11-21,"https://www.en-net.org/question/909.aspx",1
"Assessment and Surveillance","Sample size for rapid nutritional assessment of U5 using MUAC",11204,"Mohammad Monsurul Hoq",2012-11-19,"https://www.en-net.org/question/902.aspx",16
"Assessment and Surveillance","extreme anthro values",7026,"Anonymous 250",2012-11-16,"https://www.en-net.org/question/896.aspx",1
"Assessment and Surveillance","standared questionarie for determinants of IYCF practices",7867,"Anonymous 1727",2012-11-15,"https://www.en-net.org/question/894.aspx",2
"Assessment and Surveillance","How to determine sample size & the type of soft ware appropriate for my study analysis.",8654,"Anonymous 1727",2012-11-15,"https://www.en-net.org/question/893.aspx",2
"Assessment and Surveillance","Adequate maternal weight gain",7856,"Anonymous 1722",2012-11-11,"https://www.en-net.org/question/887.aspx",5
"Assessment and Surveillance","FANTA publishes SQUEAC / SLEAC technical reference",9710,"Mark Myatt",2012-11-01,"https://www.en-net.org/question/876.aspx",0
"Assessment and Surveillance","SQUEAC, SLEAC & S3M",11277,"Zoheb",2012-10-28,"https://www.en-net.org/question/874.aspx",4
"Assessment and Surveillance","SQUEAC and Nomads",10517,"Freddy H.",2012-10-26,"https://www.en-net.org/question/872.aspx",3
"Assessment and Surveillance","slum survey",7164,"caroline",2012-10-25,"https://www.en-net.org/question/871.aspx",4
"Assessment and Surveillance","Planning survey - village level data Turkana Kenya",8449,"Severine Frison",2012-10-23,"https://www.en-net.org/question/870.aspx",9
"Assessment and Surveillance","BMI for age or WfH?",8894,"Mija Ververs",2012-10-17,"https://www.en-net.org/question/868.aspx",1
"Assessment and Surveillance","S3M",12929,"Merry Fitzpatrick",2012-10-12,"https://www.en-net.org/question/865.aspx",6
"Assessment and Surveillance","When to consider population movement within recall period for mortality survey using SAMRT methodology",8038,"Anonymous 1570",2012-10-02,"https://www.en-net.org/question/861.aspx",4
"Assessment and Surveillance","Completing number of children needed for anthropometric and number of HH needed for mortality survey when implementing SMART survey",8452,"Anonymous 1570",2012-10-02,"https://www.en-net.org/question/859.aspx",3
"Assessment and Surveillance","Using stage 2 data into the likelihood",10571,"Jose Luis Alvarez Moran",2012-09-25,"https://www.en-net.org/question/855.aspx",6
"Assessment and Surveillance","What should be the ideal methedology for assessing   impact of BCC at practice level for caregivers and non caregivers?",6706,"Iqbal Hossain",2012-09-20,"https://www.en-net.org/question/851.aspx",0
"Assessment and Surveillance","sample size estimation",9020,"Pushpa Acharya",2012-09-20,"https://www.en-net.org/question/847.aspx",6
"Assessment and Surveillance","Recovering case",10841,"Freddy H.",2012-09-18,"https://www.en-net.org/question/846.aspx",11
"Assessment and Surveillance","Malnutrition & Disability, indicator and age",8283,"Severine Frison",2012-09-17,"https://www.en-net.org/question/845.aspx",8
"Assessment and Surveillance","WHO Wasting prevalance",7802,"Mohamed M Hassan Gani",2012-09-17,"https://www.en-net.org/question/842.aspx",1
"Assessment and Surveillance","hwo to define malnutrition at risk children using WHO WFH z score",10662,"Nick",2012-09-12,"https://www.en-net.org/question/836.aspx",8
"Assessment and Surveillance","Using a SQUEAC for BSFP coverage assessment?",10993,"Leah Richardson",2012-08-31,"https://www.en-net.org/question/825.aspx",3
"Assessment and Surveillance","Anthropometric monitoring software during pregnancy",8121,"Anonymous 1445",2012-08-23,"https://www.en-net.org/question/819.aspx",3
"Assessment and Surveillance","How different are the nutritional requirements of disabled children?",7225,"Milly",2012-08-17,"https://www.en-net.org/question/816.aspx",1
"Assessment and Surveillance","LQAS -",7793,"Anonymous 81",2012-08-15,"https://www.en-net.org/question/812.aspx",1
"Assessment and Surveillance","Can stratified random sampling be an option in IYCF study in arid area?",7968,"Dorcas",2012-08-14,"https://www.en-net.org/question/810.aspx",4
"Assessment and Surveillance","Calculating IYCF indicators using EPI INFO",7567,"Ranjith",2012-08-10,"https://www.en-net.org/question/808.aspx",0
"Assessment and Surveillance","Stratified cluster survey with 5 stratum Vs. 5 independant surveys",8688,"Ranjith",2012-08-08,"https://www.en-net.org/question/807.aspx",4
"Assessment and Surveillance","Official Launch - Coverage Monitoring Network (CMN) Project",9864,"Saul Guerrero",2012-08-03,"https://www.en-net.org/question/802.aspx",1
"Assessment and Surveillance","Comparing 2 surveys",10232,"Ranjith",2012-08-01,"https://www.en-net.org/question/800.aspx",7
"Assessment and Surveillance","New SMART website launched",7584,"Tamsin Walters",2012-08-01,"https://www.en-net.org/question/799.aspx",1
"Assessment and Surveillance","Cost of a SQEAC?",9847,"Leah Richardson",2012-07-25,"https://www.en-net.org/question/794.aspx",1
"Assessment and Surveillance","Analysis of Nutritional Status",7649,"Paul",2012-07-25,"https://www.en-net.org/question/793.aspx",2
"Assessment and Surveillance","How to estimate MAM and SAM Beneficiary  for 7 month nutrition project",7343,"Anonymous 1310",2012-07-25,"https://www.en-net.org/question/792.aspx",1
"Assessment and Surveillance","Estimating Coverage",10456,"Anonymous 1527",2012-07-23,"https://www.en-net.org/question/789.aspx",4
"Assessment and Surveillance","SAM threshold.",7249,"Anonymous 490",2012-07-22,"https://www.en-net.org/question/788.aspx",1
"Assessment and Surveillance","squeac coverage survey results",10816,"cyprian",2012-07-03,"https://www.en-net.org/question/777.aspx",4
"Assessment and Surveillance","Gold standard for assessment of wasting among children 6-59 months",10154,"Florence",2012-06-25,"https://www.en-net.org/question/770.aspx",9
"Assessment and Surveillance","What is the difference between sampling error and standard error?",34998,"Ranjith",2012-06-22,"https://www.en-net.org/question/768.aspx",1
"Assessment and Surveillance","Can design effect be less than 1 in cluster surveys?",13105,"Ranjith",2012-06-20,"https://www.en-net.org/question/764.aspx",3
"Assessment and Surveillance","Comparison of MUAC and W/H Prevalence?",9802,"Anonymous 310",2012-06-18,"https://www.en-net.org/question/759.aspx",12
"Assessment and Surveillance","interpreting SAM, GAM & MUAC",8486,"Anonymous 1460",2012-06-06,"https://www.en-net.org/question/747.aspx",2
"Assessment and Surveillance","Relationship between Mortality and Acute Malnutrition",9350,"Sophia Yimer",2012-06-05,"https://www.en-net.org/question/744.aspx",9
"Assessment and Surveillance","Confidence Intervals for Complex Sampling",11271,"Ranjith",2012-05-17,"https://www.en-net.org/question/734.aspx",8
"Assessment and Surveillance","Causality Analysis",10236,"Anonymous 249",2012-05-16,"https://www.en-net.org/question/729.aspx",17
"Assessment and Surveillance","Estimating population size of under 2s",19007,"Alex Mokori",2012-05-16,"https://www.en-net.org/question/728.aspx",31
"Assessment and Surveillance","What is the reason the index of dispersion and its test vary in the ENA 'Results Antropometry' page and in the plausibility test",7884,"Melaku Begashaw",2012-05-15,"https://www.en-net.org/question/727.aspx",3
"Assessment and Surveillance","Using MUAC or WFH in survey: who do you catch?",9141,"Mija Ververs",2012-05-02,"https://www.en-net.org/question/708.aspx",4
"Assessment and Surveillance","Misdiagnosis acute malnutrition Peulh/Fulani children",9258,"Mija Ververs",2012-05-01,"https://www.en-net.org/question/707.aspx",20
"Assessment and Surveillance","MUAC and oedema",10745,"Susana Moreno Romero",2012-04-24,"https://www.en-net.org/question/698.aspx",18
"Assessment and Surveillance","Minimum SAM levels for coverage assessment?",9789,"Gwyneth Cotes",2012-04-23,"https://www.en-net.org/question/696.aspx",1
"Assessment and Surveillance","prevalence of malnutrition in pregnant and lactating mothers",7149,"Kiran Deshpande Shukla",2012-04-22,"https://www.en-net.org/question/695.aspx",1
"Assessment and Surveillance","Inclusion of hotels in the household selection",7228,"Anonymous 1354",2012-04-19,"https://www.en-net.org/question/692.aspx",2
"Assessment and Surveillance","Modified EPI vs Segmentation in Urban Settings",9601,"Anonymous 1354",2012-04-12,"https://www.en-net.org/question/689.aspx",15
"Assessment and Surveillance","Timing of SMART survey",7409,"Martin Kumbe",2012-04-03,"https://www.en-net.org/question/683.aspx",1
"Assessment and Surveillance","GAM in Nutrition Screening and Survey?",9266,"Tariq Khan",2012-03-28,"https://www.en-net.org/question/679.aspx",7
"Assessment and Surveillance","SMART flags vs WHO flags in SMART surveys",10560,"Jose Luis Alvarez Moran",2012-03-28,"https://www.en-net.org/question/678.aspx",8
"Assessment and Surveillance","Some questions on SQUEAC Stage-I. (CMAM in a pastoralist community.)",10233,"Anonymous 81",2012-02-25,"https://www.en-net.org/question/660.aspx",1
"Assessment and Surveillance","Calibration SAM prevalence",10162,"ACF Health and Nutrition Head of Department",2012-02-20,"https://www.en-net.org/question/653.aspx",1
"Assessment and Surveillance","IMAM coverage surveys",10016,"Anonymous 644",2012-02-19,"https://www.en-net.org/question/652.aspx",2
"Assessment and Surveillance","Supportive supervision",7882,"Njeri Waigwa",2012-02-16,"https://www.en-net.org/question/648.aspx",6
"Assessment and Surveillance","Geographical area for coverage survey",11637,"Jose Luis Alvarez Moran",2012-02-14,"https://www.en-net.org/question/645.aspx",13
"Assessment and Surveillance","Intervale of confidence",10797,"chantal a",2012-02-13,"https://www.en-net.org/question/642.aspx",3
"Assessment and Surveillance","measuring sitting height",8549,"Pascale Delchevalerie",2012-02-07,"https://www.en-net.org/question/636.aspx",4
"Assessment and Surveillance","W/h in rickets",8299,"Kiran Deshpande Shukla",2012-02-07,"https://www.en-net.org/question/635.aspx",5
"Assessment and Surveillance","Upcoming SMART Training",7365,"Issack Hussein",2012-02-03,"https://www.en-net.org/question/632.aspx",2
"Assessment and Surveillance","MUAC/h",7271,"Kiran Deshpande Shukla",2012-01-24,"https://www.en-net.org/question/622.aspx",1
"Assessment and Surveillance","Growth patterns among different livelihood/ethnic groups among the under 5 years.",7279,"Anonymous 1149",2012-01-17,"https://www.en-net.org/question/614.aspx",1
"Assessment and Surveillance","Sitting - Standing Height Ratio",9722,"Chris Gruenewald",2012-01-16,"https://www.en-net.org/question/613.aspx",1
"Assessment and Surveillance","relationship between percentile and z-score",8290,"Kiran Deshpande Shukla",2012-01-10,"https://www.en-net.org/question/609.aspx",1
"Assessment and Surveillance","MUAC for older children",7409,"Kiran Deshpande Shukla",2012-01-10,"https://www.en-net.org/question/608.aspx",1
"Assessment and Surveillance","Nutritional status and vulnerability of older adults/older people (aged 50 +)",10674,"Mary Manandhar",2012-01-01,"https://www.en-net.org/question/597.aspx",10
"Assessment and Surveillance","Workshop on Coverage Assessment Methods, Oxford, 27-30 March 2012",10566,"Ernest Guevarra",2011-12-22,"https://www.en-net.org/question/595.aspx",5
"Assessment and Surveillance","Workshop on Coverage Assessment Methods, Oxford, 27-30 March 2012",7189,"Ernest Guevarra",2011-12-22,"https://www.en-net.org/question/594.aspx",0
"Assessment and Surveillance","Bayes Calculator",9738,"Freddy H.",2011-12-14,"https://www.en-net.org/question/586.aspx",1
"Assessment and Surveillance","Coverage estimate calculation - Final stage - Help again",11044,"Géraldine LE CUZIAT",2011-12-14,"https://www.en-net.org/question/585.aspx",14
"Assessment and Surveillance","Stage 3 - Sample size issue - Help",12626,"Géraldine LE CUZIAT",2011-12-12,"https://www.en-net.org/question/581.aspx",15
"Assessment and Surveillance","Draft handbook for SQUEAC and SLEAC",9569,"Mark Myatt",2011-12-06,"https://www.en-net.org/question/573.aspx",0
"Assessment and Surveillance","Accessing coverage of OTPs",9972,"Florence",2011-12-05,"https://www.en-net.org/question/572.aspx",4
"Assessment and Surveillance","Impact of CMAM",12033,"Zoheb",2011-12-05,"https://www.en-net.org/question/571.aspx",23
"Assessment and Surveillance","SQUEAC/SMART",8691,"Dr. Ankur Singh",2011-11-14,"https://www.en-net.org/question/568.aspx",5
"Assessment and Surveillance","Mortality in an Emergency Context",8057,"Anonymous 147",2011-10-10,"https://www.en-net.org/question/544.aspx",3
"Assessment and Surveillance","Is it valid to use similar cut-off points for prevalence of wasting using z scores for different countries and contexts?",10402,"Melaku Begashaw",2011-10-10,"https://www.en-net.org/question/543.aspx",16
"Assessment and Surveillance","resources on CSAS",8524,"Merry Fitzpatrick",2011-09-12,"https://www.en-net.org/question/530.aspx",6
"Assessment and Surveillance","standardized questionnaire.",8519,"Anonymous 490",2011-09-07,"https://www.en-net.org/question/526.aspx",4
"Assessment and Surveillance","SAM Threshold for Emergency Response",10327,"Rogers Wanyama",2011-08-03,"https://www.en-net.org/question/503.aspx",2
"Assessment and Surveillance","Monitoring Nutritional Status Trends in response to changes in Food Insecurity.",8070,"Rogers Wanyama",2011-06-26,"https://www.en-net.org/question/475.aspx",7
"Assessment and Surveillance","Any robust experiences using LQAS for assessing and monitoring nutrition programs using Valadez's common health survey method?",9073,"Wendy Dyment",2011-06-23,"https://www.en-net.org/question/472.aspx",5
"Assessment and Surveillance","CSAS survey for TSFP only",8936,"Anonymous 680",2011-06-22,"https://www.en-net.org/question/469.aspx",7
"Assessment and Surveillance","Sample size for random survey in Ethiopia",7163,"Toby Gould",2011-06-16,"https://www.en-net.org/question/465.aspx",1
"Assessment and Surveillance","What is the correct population percentage proportion to use when consider 0-5 years in developing countries?",22515,"Anonymous 651",2011-06-07,"https://www.en-net.org/question/456.aspx",10
"Assessment and Surveillance","WHO Growth Standards",12173,"Ranjith",2011-06-03,"https://www.en-net.org/question/452.aspx",4
"Assessment and Surveillance","classification and interpretation of MUAC among old children and adolescent",8972,"Anaïs",2011-05-24,"https://www.en-net.org/question/436.aspx",1
"Assessment and Surveillance","Random sampling without a proper map",9753,"Jenny Dörnemann",2011-05-19,"https://www.en-net.org/question/435.aspx",5
"Assessment and Surveillance","Standardization excercise / Test",9058,"Asmelash",2011-05-17,"https://www.en-net.org/question/431.aspx",6
"Assessment and Surveillance","Advice on how much SQUEAC and LQAS coverage surveys cost and how long they take",12965,"Anonymous 118",2011-05-11,"https://www.en-net.org/question/423.aspx",10
"Assessment and Surveillance","Using length/height to estimate Age of 6-59 month old children in high Stunting level countries",12900,"Anonymous 411",2011-05-05,"https://www.en-net.org/question/418.aspx",7
"Assessment and Surveillance","Who did the research on weight and hydration?",7690,"Martha",2011-05-04,"https://www.en-net.org/question/416.aspx",1
"Assessment and Surveillance","What is the lowest WAZ score that would be ""compatible with human life",9033,"Anonymous 118",2011-04-29,"https://www.en-net.org/question/413.aspx",4
"Assessment and Surveillance","body shape in children under 24 months old",8673,"Merry Fitzpatrick",2011-04-24,"https://www.en-net.org/question/410.aspx",3
"Assessment and Surveillance","Nutrition survey analysis- Associations",9755,"Dr. Farah Ibrahim",2011-04-07,"https://www.en-net.org/question/402.aspx",13
