"Theme","Topic","Views","Author","Posted","Link","Replies"
"Announcements & Nutritionists needed","Several positions advertised for nutrition relevant research analysts in Institute of Economic Growth India",57,"Anonymous 40722",2021-07-27,"https://www.en-net.org/question/4363.aspx",NA
"Announcements & Nutritionists needed","Volunteers needed for study of psycho-social care practices for children with severe acute malnutrition",95,"Mike Kalmus Eliasz",2021-07-20,"https://www.en-net.org/question/4361.aspx",NA
"Announcements & Nutritionists needed","ENN's website usability survey",99,"Office ENN",2021-07-20,"https://www.en-net.org/question/4359.aspx",NA
"Announcements & Nutritionists needed","Food Systems Summit Parallel Sessions: Tackling Malnutrition through Action and Accountability",116,"Office ENN",2021-07-19,"https://www.en-net.org/question/4357.aspx",NA
"Announcements & Nutritionists needed","UNHCR is looking for a SMART SENS Survey Consultant in Zambia, Lusaka. Deadline is 26 July 2021.",233,"Sandor Varga",2021-07-14,"https://www.en-net.org/question/4356.aspx",NA
"Announcements & Nutritionists needed","Medair is Recruiting for an ERT - Nutrition Project Manager in South Sudan, Juba",142,"Mark Hawkes",2021-07-13,"https://www.en-net.org/question/4355.aspx",NA
"Announcements & Nutritionists needed","HARP-F webinar on 'Prioritising nutrition in Myanmar as part of the humanitarian response: Urgent action is needed', on 14th July, 2021",166,"Tamsin Walters",2021-07-05,"https://www.en-net.org/question/4352.aspx",NA
"Announcements & Nutritionists needed","How can we advance nutrition among marginalized populations in Africa? THIRD INTERNATIONAL CONFERENCE",396,"Tamsin Walters",2021-06-29,"https://www.en-net.org/question/4345.aspx",NA
"Announcements & Nutritionists needed","Recruiting a Complementary Feeding in Emergencies Consultant - USAID Advancing Nutrition",256,"Helen Aufderheide",2021-06-28,"https://www.en-net.org/question/4343.aspx",NA
"Announcements & Nutritionists needed","FHI 360 is recruiting  an Emergency  Nutrition Technical Manager for a consultancy",315,"Alex",2021-06-23,"https://www.en-net.org/question/4341.aspx",NA
"Announcements & Nutritionists needed","Medair is Recruiting for an ERT - Nutrition Manager in South Sudan, Juba",213,"Mark Hawkes",2021-06-22,"https://www.en-net.org/question/4340.aspx",NA
"Announcements & Nutritionists needed","Medair is Recruiting for a Health & Nutrition Advisor in Afghanistan, Kabul",193,"Mark Hawkes",2021-06-22,"https://www.en-net.org/question/4339.aspx",NA
"Announcements & Nutritionists needed","MSF is recruiting Leader of the MSF nutrition working group (readvertised) 50%",260,"Lena Schneider (MSF)",2021-06-22,"https://www.en-net.org/question/4336.aspx",NA
"Announcements & Nutritionists needed","WHO Looking for consultant(s) to develop BFHI Internal Monitoring Manual",231,"Linda Shaker Berbari",2021-06-22,"https://www.en-net.org/question/4335.aspx",NA
"Announcements & Nutritionists needed","Food Systems Summit: Stakeholder Consultation on Wasting 'Reset’",328,"Office ENN",2021-06-17,"https://www.en-net.org/question/4330.aspx",NA
"Announcements & Nutritionists needed","Two Lecturer / Senior Lecturer in Nutrition positions at City, University of London",319,"Natasha Lelijveld",2021-06-17,"https://www.en-net.org/question/4328.aspx",NA
"Announcements & Nutritionists needed","Concern Worldwide is seeking a Health Consultant to review the CMAM and Health Surge models (home based).",324,"Lucy Lafferty",2021-06-16,"https://www.en-net.org/question/4326.aspx",NA
"Announcements & Nutritionists needed","WHO CALL FOR AUTHORS: Iron content in ready-to-use therapeutic foods for treating children with severe wasting",303,"Tamsin Walters",2021-06-10,"https://www.en-net.org/question/4321.aspx",NA
"Announcements & Nutritionists needed","WHO CALL FOR AUTHORS: Essential fatty acid content in ready-to-use therapeutic foods for treating children with severe wasting",547,"Tamsin Walters",2021-06-10,"https://www.en-net.org/question/4320.aspx",NA
"Announcements & Nutritionists needed","Medair is Recruiting for a Nutrition Coordinator in DR Congo, Bunia",376,"Mark Hawkes",2021-06-01,"https://www.en-net.org/question/4314.aspx",NA
"Announcements & Nutritionists needed","WEBINAR ""Food Systems: Harnessing nutrition co-benefits of climate resilient agriculture"" - Friday, 4 June 2021 @13:30-15.00 CEST",431,"ECG - Nutrition",2021-06-01,"https://www.en-net.org/question/4313.aspx",NA
"Announcements & Nutritionists needed","Interactive evidence and gap map linking food security and nutrition to mental health",296,"Philip James",2021-05-28,"https://www.en-net.org/question/4311.aspx",NA
"Announcements & Nutritionists needed","Fill the Nutrient Gap Consultant in Niger: USAID Advancing Nutrition",314,"Helen Aufderheide",2021-05-27,"https://www.en-net.org/question/4310.aspx",NA
"Announcements & Nutritionists needed","Youth Pledge & Actions for Change Initiative",318,"Tamsin Walters",2021-05-20,"https://www.en-net.org/question/4305.aspx",NA
"Announcements & Nutritionists needed","Online event: Learning on capacity building for CSOs working on Nutrition in Uganda",318,"Marlene",2021-05-20,"https://www.en-net.org/question/4303.aspx",NA
"Announcements & Nutritionists needed","Seeking a bilingual French-English Intern (paid)",485,"Britt Titus",2021-05-19,"https://www.en-net.org/question/4302.aspx",NA
"Announcements & Nutritionists needed","Registration for ANH2021 is open: Join us at our annual agriculture, nutrition and health conference",599,"Sylvia Levy",2021-05-19,"https://www.en-net.org/question/4301.aspx",NA
"Announcements & Nutritionists needed","Global WASH Cluster Inter-sectoral/cluster Coordinator",331,"Monica Ramos",2021-05-14,"https://www.en-net.org/question/4299.aspx",NA
"Announcements & Nutritionists needed","The IRC is hiring a Nutrition Specialist based in New York, Washington DC or Dakar",385,"Casie Tesfai",2021-05-11,"https://www.en-net.org/question/4294.aspx",NA
"Announcements & Nutritionists needed","Save the children UK is recruiting a Humanitarian Nutrition Adviser",450,"Andrew Beckingham",2021-05-06,"https://www.en-net.org/question/4290.aspx",NA
"Announcements & Nutritionists needed","Action Against Hunger UK is looking for local consultants in Papua New Guinea to conduct a review of community platforms  that can be leveraged to increase access to wasting and other nutrition services",592,"Uwimana Sebinwa",2021-05-04,"https://www.en-net.org/question/4288.aspx",NA
"Announcements & Nutritionists needed","New WHO position on child health research",481,"Tamsin Walters",2021-04-28,"https://www.en-net.org/question/4286.aspx",NA
"Announcements & Nutritionists needed","Medair is Recruiting for a Nutrition Advisor in South Sudan, Juba",634,"Mark Hawkes",2021-04-26,"https://www.en-net.org/question/4284.aspx",NA
"Announcements & Nutritionists needed","Market Study-Yalwa Project",390,"Anonymous 40639",2021-04-22,"https://www.en-net.org/question/4282.aspx",NA
"Announcements & Nutritionists needed","Medair is Recruiting for a Health & Nutrition Project Manager in Aden, Yemen",467,"Mark Hawkes",2021-04-19,"https://www.en-net.org/question/4274.aspx",NA
"Announcements & Nutritionists needed","Global Nutrition Cluster - Full-time home-based consultancy-GNC helpdesk on Nutrition information System (NIS)",520,"Global Nutrition Cluster",2021-04-16,"https://www.en-net.org/question/4273.aspx",NA
"Announcements & Nutritionists needed","The IRC is hiring for a Nutrition Policy and Research Uptake Advisor in Kenya",508,"Heather Teixeira",2021-04-12,"https://www.en-net.org/question/4270.aspx",NA
"Announcements & Nutritionists needed","Calendar of nutrition specific and sensitive conference, workshop",708,"Marlene",2021-04-06,"https://www.en-net.org/question/4268.aspx",NA
"Announcements & Nutritionists needed","MSF-Swiss is recruiting a flying Nutrition&Pediatrics officer",652,"Nathalie AVRIL",2021-04-01,"https://www.en-net.org/question/4266.aspx",NA
"Announcements & Nutritionists needed","IRC is looking for Emergency Nutrition Coordinators for the external roster",786,"Casie Tesfai",2021-03-30,"https://www.en-net.org/question/4265.aspx",NA
"Announcements & Nutritionists needed","Medair is Recruiting for Nutrition Managers",687,"Mark Hawkes",2021-03-22,"https://www.en-net.org/question/4262.aspx",NA
"Announcements & Nutritionists needed","Medair is Recruiting for a Nutrition Project Manager in South Sudan, Renk",547,"Mark Hawkes",2021-03-22,"https://www.en-net.org/question/4261.aspx",NA
"Announcements & Nutritionists needed","Medair is Recruiting for a Nutrition Project Manager in South Sudan, Leer",535,"Mark Hawkes",2021-03-22,"https://www.en-net.org/question/4260.aspx",NA
"Announcements & Nutritionists needed","Medair is Recruiting for a Health & Nutrition Advisor in Yemen",561,"Mark Hawkes",2021-03-19,"https://www.en-net.org/question/4259.aspx",NA
"Announcements & Nutritionists needed","Medair is Recruiting for a Health & Nutrition Advisor in Syria",495,"Mark Hawkes",2021-03-19,"https://www.en-net.org/question/4258.aspx",NA
"Announcements & Nutritionists needed","Vacancy: Field Exchange Sub-Editor and Content Coordinator",577,"Office ENN",2021-03-19,"https://www.en-net.org/question/4257.aspx",NA
"Announcements & Nutritionists needed","Vacancy: Regional nutritionist - Nairobi",592,"Els Dehantschutter",2021-03-18,"https://www.en-net.org/question/4256.aspx",NA
"Announcements & Nutritionists needed","Alive & Thrive seeks a MIYCN Technical Advisor for Africa!",579,"Nathalie Likhite",2021-03-11,"https://www.en-net.org/question/4246.aspx",NA
"Announcements & Nutritionists needed","Consultancy - A Nutrition specialist for SMART / SENS nutrition survey for Chad",798,"Terry Theuri",2021-03-11,"https://www.en-net.org/question/4245.aspx",NA
"Announcements & Nutritionists needed","Humanitarian Nutrition Adviser",650,"A Beckingham",2021-03-08,"https://www.en-net.org/question/4236.aspx",NA
"Announcements & Nutritionists needed","Opportunity: Exhibition Booths and 'NED Talks' - CMAM Conference",521,"Jessica Worsdale",2021-03-02,"https://www.en-net.org/question/4224.aspx",NA
"Announcements & Nutritionists needed","Priorities for guidelines on management of child obesity",499,"Tamsin Walters",2021-02-25,"https://www.en-net.org/question/4217.aspx",NA
"Announcements & Nutritionists needed","Nutrition Science Program Manager Needed",605,"Megan Bourassa",2021-02-22,"https://www.en-net.org/question/4211.aspx",NA
"Announcements & Nutritionists needed","Nutrition Consultant REF: ANT-M&E-24208",753,"Adem Ozgun",2021-02-22,"https://www.en-net.org/question/4210.aspx",NA
"Announcements & Nutritionists needed","Virtual CMAM conference 22-25 March",747,"Tamsin Walters",2021-02-18,"https://www.en-net.org/question/4209.aspx",NA
"Announcements & Nutritionists needed","MAMI Global Network Coordinator (Maternity cover)",573,"Office ENN",2021-02-17,"https://www.en-net.org/question/4208.aspx",NA
"Announcements & Nutritionists needed","Two funded PhD opportunities within “Edinburgh Neuroscience”, to be based in Malawi",1086,"Tamsin Walters",2021-02-15,"https://www.en-net.org/question/4204.aspx",NA
"Announcements & Nutritionists needed","Present your agriculture/food systems/nutrition research at our upcoming ANH2021 conference",1104,"Sylvia Levy",2021-02-09,"https://www.en-net.org/question/4201.aspx",NA
"Announcements & Nutritionists needed","Deputy Head of Nutrition needed at Action Against Hunger UK",671,"Alexandra Rutishauser-Perera",2021-02-06,"https://www.en-net.org/question/4200.aspx",NA
"Announcements & Nutritionists needed","National Project Coordinator for a Nutrition related project in Laos",749,"Tatiana Gheorghiu",2021-02-05,"https://www.en-net.org/question/4199.aspx",NA
"Announcements & Nutritionists needed","Institutional Capacity Building Expert/ Food & Nutrition Security in Laos",996,"Tatiana Gheorghiu",2021-02-05,"https://www.en-net.org/question/4198.aspx",NA
"Announcements & Nutritionists needed","New Funding Opportunity for Local Organizations in Burkina Faso | Request for Applications",852,"Katie Beck",2021-01-22,"https://www.en-net.org/question/4185.aspx",NA
"Announcements & Nutritionists needed","Vacancy - remote consultancy for a nutritionist with experience in developing SBCC materials",2841,"Anonymous 40530",2021-01-13,"https://www.en-net.org/question/4181.aspx",NA
"Announcements & Nutritionists needed","REACH Initiative is looking for a Nutrition Assessment Officer in Nigeria",768,"Saeed Rahman",2021-01-09,"https://www.en-net.org/question/4177.aspx",NA
"Announcements & Nutritionists needed","New Funding Opportunity for Local Organizations in Kenya | Request for Applications",703,"Katie Beck",2021-01-06,"https://www.en-net.org/question/4174.aspx",NA
"Announcements & Nutritionists needed","Event: How and why do people make food choices? Join us 14 Jan for the 1st webinar in our new series",703,"Sylvia Levy",2021-01-05,"https://www.en-net.org/question/4172.aspx",NA
"Announcements & Nutritionists needed","TASC is looking for consultants to ""Reaching the most marginalized""",685,"Rita Abi Akar",2021-01-05,"https://www.en-net.org/question/4171.aspx",NA
"Announcements & Nutritionists needed","ENN is recruiting a Finance Manager",781,"Office ENN",2020-12-23,"https://www.en-net.org/question/4167.aspx",NA
"Announcements & Nutritionists needed","Call for abstracts - MSF Paediatric Days",745,"Tamsin Walters",2020-12-18,"https://www.en-net.org/question/4164.aspx",NA
"Announcements & Nutritionists needed","ENN is searching for three new Trustees",804,"Office ENN",2020-12-18,"https://www.en-net.org/question/4163.aspx",NA
"Announcements & Nutritionists needed","Vacancy - Nutrition Coordinator - Syria, based in Amman",1113,"Valentina Coniglio",2020-12-11,"https://www.en-net.org/question/4156.aspx",NA
"Announcements & Nutritionists needed","Ag-nutrition Funding Opportunity: IMMANA Grants Round 4",864,"Sylvia Levy",2020-12-11,"https://www.en-net.org/question/4155.aspx",NA
"Announcements & Nutritionists needed","ENN is recruiting a Project Manager - CLOSED",852,"Office ENN",2020-12-11,"https://www.en-net.org/question/4154.aspx",NA
"Announcements & Nutritionists needed","Invite to online update meeting on MAMI Ethiopia research programme",1239,"Office ENN",2020-12-09,"https://www.en-net.org/question/4152.aspx",NA
"Announcements & Nutritionists needed","IYCF project UNHCR - Call for expression of Interest",908,"Valerie Belchior-Bellino",2020-12-08,"https://www.en-net.org/question/4151.aspx",NA
"Announcements & Nutritionists needed","REACH Initiative is looking for a Nutrition Assessment Officer for South Sudan",941,"Saeed Rahman",2020-12-06,"https://www.en-net.org/question/4148.aspx",NA
"Announcements & Nutritionists needed","IRC is hiring a Senior Health and Nutrition Coordinator in Yemen",1033,"Casie Tesfai",2020-12-02,"https://www.en-net.org/question/4144.aspx",NA
"Announcements & Nutritionists needed","You are warmly invited to the GNC Technical Alliance official launch webinar!",839,"Ben Allen",2020-11-27,"https://www.en-net.org/question/4139.aspx",NA
"Announcements & Nutritionists needed","Link NCA Newsletter + Methodological review",1355,"Lenka Blanarova",2020-11-16,"https://www.en-net.org/question/4132.aspx",NA
"Announcements & Nutritionists needed","Contact of experts in nutrition mentorship/coaching programme development",1713,"Marlene",2020-11-12,"https://www.en-net.org/question/4130.aspx",NA
"Announcements & Nutritionists needed","Somalia Maternal Nutrition Action Plan- International Consultant Needed",891,"Ciara",2020-11-01,"https://www.en-net.org/question/4118.aspx",NA
"Announcements & Nutritionists needed","Recruiting Consultant to conduct a Maternal New-born and Child Health and Nutrition (MNCHN) Systems Assessment",977,"Marlene",2020-10-26,"https://www.en-net.org/question/4115.aspx",NA
"Announcements & Nutritionists needed","Global Nutrition Cluster is looking for a homebased  Inter-Sectoral Collaboration Helpdesk Consultant",919,"Global Nutrition Cluster",2020-10-22,"https://www.en-net.org/question/4114.aspx",NA
"Announcements & Nutritionists needed","ENN is recruiting a Project Officer",1017,"Office ENN",2020-10-22,"https://www.en-net.org/question/4112.aspx",NA
"Announcements & Nutritionists needed","The Technical Rapid Response Team is looking for a senior nutrition consultant to support the development of a new National Nutrition Strategy in Vietnam.",1040,"Office ENN",2020-10-19,"https://www.en-net.org/question/4107.aspx",NA
"Announcements & Nutritionists needed","Technical series on the conceptual framework for addressing acute malnutrition in Africa’s drylands",960,"Anne Radday",2020-10-14,"https://www.en-net.org/question/4106.aspx",NA
"Announcements & Nutritionists needed","CONCERN WORLDWIDE - Global CMAM Surge Advisor - Flexible Location",1449,"Concern Worldwide",2020-10-08,"https://www.en-net.org/question/4102.aspx",NA
"Announcements & Nutritionists needed","Sr. Technical Advisor, Nutrition - Team Lead Open Postion at CRS",1231,"Anonymous 40438",2020-10-05,"https://www.en-net.org/question/4100.aspx",NA
"Announcements & Nutritionists needed","Job Opportunity: Research Fellow or Assistant Professor",1061,"Abel Endashaw",2020-09-29,"https://www.en-net.org/question/4095.aspx",NA
"Announcements & Nutritionists needed","Webinar Series on Kwashiorkor",1216,"Alexandra Rutishauser-Perera",2020-09-21,"https://www.en-net.org/question/4089.aspx",NA
"Announcements & Nutritionists needed","Save the Children looking for a Nutritionist to lead module development and delivery of a joint IYCF and CASH training programme alongside technical experts within the organisation",1734,"Paul Rees-Thomas",2020-09-18,"https://www.en-net.org/question/4087.aspx",NA
"Announcements & Nutritionists needed","Consulting opportunity to provide technical assistance to the Government of Pakistan to formulate that National Food Fortification Act and Rules of Business",990,"Nutrition International - NTEAM",2020-09-16,"https://www.en-net.org/question/4083.aspx",NA
"Announcements & Nutritionists needed","Nutrition Advisor",1255,"Concern Worldwide",2020-09-15,"https://www.en-net.org/question/4082.aspx",NA
"Announcements & Nutritionists needed","WHO seeks a consultant to support the wasting guideline development process",923,"Tamsin Walters",2020-09-15,"https://www.en-net.org/question/4081.aspx",NA
"Announcements & Nutritionists needed","Call for authors - Scoping review for WHO guideline on the prevention and treatment of wasting in infants and children",1092,"Tamsin Walters",2020-09-15,"https://www.en-net.org/question/4080.aspx",NA
"Announcements & Nutritionists needed","Recruiting consultant to support the assessment of nutritional biomarkers in Senegal",1022,"Nutrition International - NTEAM",2020-09-01,"https://www.en-net.org/question/4074.aspx",NA
"Announcements & Nutritionists needed","Recruiting five consultants to undertake assessments of technical assistance delivered under NTEAM’s TAN project  in Kenya, Ethiopia, Mozambique, Pakistan and Bangladesh",1629,"Nutrition International - NTEAM",2020-09-01,"https://www.en-net.org/question/4073.aspx",NA
"Announcements & Nutritionists needed","ENN seeking two Senior Technical Associates",953,"Office ENN",2020-08-28,"https://www.en-net.org/question/4070.aspx",NA
"Announcements & Nutritionists needed","GNR seeking Programme Manager",942,"Nathalie Willmott",2020-08-24,"https://www.en-net.org/question/4067.aspx",NA
"Announcements & Nutritionists needed","Official launch of the GNC/GTAM guidance on the cash and voucher assistance for NiE",1169,"Office ENN",2020-08-17,"https://www.en-net.org/question/4064.aspx",NA
"Announcements & Nutritionists needed","ENN seeking an External Evaluator",1130,"Office ENN",2020-08-05,"https://www.en-net.org/question/4057.aspx",NA
"Announcements & Nutritionists needed","Senior Nutrition Scientist - GNR",1258,"Nathalie Willmott",2020-07-24,"https://www.en-net.org/question/4042.aspx",NA
"Announcements & Nutritionists needed","Knowledge Management & Evidence Generation Consultant, UNICEF, West and Central Africa Regional Office",970,"John Ntambi",2020-07-19,"https://www.en-net.org/question/4036.aspx",NA
"Announcements & Nutritionists needed","experienced H&N programme managers and specialists for 12-month contract or short-term remote support (staff or consultant)",1439,"Yvonne McNulty",2020-07-14,"https://www.en-net.org/question/4034.aspx",NA
"Announcements & Nutritionists needed","Nutrition Adviser Concern Worldwide (Bangladesh)",1275,"Sajia Mehjabeen",2020-07-09,"https://www.en-net.org/question/4029.aspx",NA
"Announcements & Nutritionists needed","Consultancy opportunity to provide technical assistance to support Implementation of a Regional Nutrition Knowledge Sharing Platform for the East, Central and Southern Africa Health Community (ECSA-HC)",1581,"Nutrition International - NTEAM",2020-07-09,"https://www.en-net.org/question/4028.aspx",NA
"Announcements & Nutritionists needed","Consulting opportunity to provide technical assistance to the Government of Pakistan to formulate that National Food Fortification Act and Rules of Business",961,"Nutrition International - NTEAM",2020-07-09,"https://www.en-net.org/question/4027.aspx",NA
"Announcements & Nutritionists needed","30th June ENN Webinar: FEX 60/ GAP on child wasting",1237,"Tamsin Walters",2020-06-26,"https://www.en-net.org/question/4022.aspx",NA
"Announcements & Nutritionists needed","ENN Senior Nutritionist – Fixed Term Contract",1580,"Office ENN",2020-06-18,"https://www.en-net.org/question/4010.aspx",NA
"Announcements & Nutritionists needed","Survey Team Leader - Provision of services for RAM/SMART survey comparison study",1253,"Philip McKinney",2020-06-12,"https://www.en-net.org/question/4007.aspx",NA
"Announcements & Nutritionists needed","GTAM website",1191,"Natalie Sessions",2020-06-09,"https://www.en-net.org/question/4004.aspx",NA
"Announcements & Nutritionists needed","ENN: MAMI Global Network Coordinator – Fixed Term Contract, Competitive package",1769,"Office ENN",2020-06-03,"https://www.en-net.org/question/3999.aspx",NA
"Announcements & Nutritionists needed","Webinar: Power and priorities: equitable partnerships in Agriculture, Nutrition and Health research",1887,"Abel Endashaw",2020-05-29,"https://www.en-net.org/question/3997.aspx",NA
"Announcements & Nutritionists needed","ANH2020",1140,"Abel Endashaw",2020-05-28,"https://www.en-net.org/question/3996.aspx",NA
"Announcements & Nutritionists needed","Consulting opportunity to support implementation of a regional nutrition knowledge sharing platform",1426,"Nutrition International - NTEAM",2020-05-27,"https://www.en-net.org/question/3993.aspx",NA
"Announcements & Nutritionists needed","Adolescent nutrition mapping exercise - online survey",1459,"Tamsin Walters",2020-05-15,"https://www.en-net.org/question/3983.aspx",NA
"Announcements & Nutritionists needed","Coordinateur/trice Nutrition - Niger",1291,"COOPI - Cooperazione Internazionale",2020-05-08,"https://www.en-net.org/question/3980.aspx",NA
"Announcements & Nutritionists needed","UNHCR: Senior Nutrition Officer, P4, Geneva",1665,"Anonymous 40",2020-05-06,"https://www.en-net.org/question/3978.aspx",NA
"Announcements & Nutritionists needed","Nutrition Coordinator - DRC",1477,"COOPI - Cooperazione Internazionale",2020-05-06,"https://www.en-net.org/question/3974.aspx",NA
"Announcements & Nutritionists needed","ENN is looking for a Treasurer",1210,"Office ENN",2020-04-21,"https://www.en-net.org/question/3955.aspx",NA
"Announcements & Nutritionists needed","CORTASAM launches Landscape Review on completed, ongoing, and planned research in their priority research areas for acute malnutrition",1246,"Abhilasha (Vini) Vaid",2020-04-21,"https://www.en-net.org/question/3954.aspx",NA
"Announcements & Nutritionists needed","Freelance translators (nutrition experience) needed",1795,"Office ENN",2020-04-21,"https://www.en-net.org/question/3953.aspx",NA
"Announcements & Nutritionists needed","Job: Agricultural Livelihoods & Markets Advisor for humanitarian contexts",1105,"Charlotte Block",2020-04-16,"https://www.en-net.org/question/3947.aspx",NA
"Announcements & Nutritionists needed","ENN is recruiting a Project Manager and Project Officer",2041,"Office ENN",2020-04-14,"https://www.en-net.org/question/3945.aspx",NA
"Announcements & Nutritionists needed","Technical Advisor Vacancy - Humanitarian and Nutrition Programs (Save the Children US / USAID Advancing Nutrition)",1569,"Sarah (Butler) O'Flynn",2020-04-02,"https://www.en-net.org/question/3924.aspx",NA
"Announcements & Nutritionists needed","Webinar Thursday 26th March - Strengthening the Humanitarian-Development Nexus for Nutrition in Protracted Crises",1729,"Tamsin Walters",2020-03-23,"https://www.en-net.org/question/3902.aspx",NA
"Announcements & Nutritionists needed","Nutriton Adviser Concern Worldwide (HQ)",1497,"Regine Kopplow",2020-03-23,"https://www.en-net.org/question/3898.aspx",NA
"Announcements & Nutritionists needed","Nutrition Cluster Co-Coordinator for International Medical Corps in South Sudan",1466,"Iris Bollemeijer",2020-03-23,"https://www.en-net.org/question/3897.aspx",NA
"Announcements & Nutritionists needed","2 consultancy opportunities - home based with travels",1640,"Barbara",2020-03-21,"https://www.en-net.org/question/3894.aspx",NA
"Announcements & Nutritionists needed","Emergency Nutrition Advisor Vacancy (Save the Children US)",1291,"Sarah (Butler) O'Flynn",2020-03-20,"https://www.en-net.org/question/3893.aspx",NA
"Announcements & Nutritionists needed","Consulting opportunity in Punjab, Pakistan",1213,"Nutrition International - NTEAM",2020-03-20,"https://www.en-net.org/question/3891.aspx",NA
