"Theme","Topic","Views","Author","Posted","Link","Replies"
"Assessment and Surveillance","HiNi quality assessment",8521,"ISAAC WACHIRA",2015-12-09,"https://www.en-net.org/question/2292.aspx",2
"Assessment and Surveillance","PLW and children under measurements in survey",12037,"Anonymous 3267",2015-12-01,"https://www.en-net.org/question/2282.aspx",3
"Assessment and Surveillance","How to assess stunting rate per year??",8429,"Tammam Ali Mohammed Ahmed",2015-11-22,"https://www.en-net.org/question/2272.aspx",0
"Assessment and Surveillance","un weighting of Barriers and Boosters",10892,"Bumba Erinest",2015-11-22,"https://www.en-net.org/question/2271.aspx",1
"Assessment and Surveillance","IYCF Assessment",8852,"Shishay",2015-11-13,"https://www.en-net.org/question/2261.aspx",4
"Assessment and Surveillance","What nutrition indicators should be use for evaluating the SDG2 nutrition goal? What are the data gaps that need to be filled?",8590,"Suneetha Kadiyala",2015-11-11,"https://www.en-net.org/question/2254.aspx",1
"Assessment and Surveillance","A final note",10311,"Mark Myatt",2015-11-02,"https://www.en-net.org/question/2235.aspx",27
"Assessment and Surveillance","Bayes Calculator",11275,"Felicity Munene",2015-10-28,"https://www.en-net.org/question/2230.aspx",2
"Assessment and Surveillance","SMART HHs Sampling",11965,"Sameh Al-Awlaqi",2015-10-23,"https://www.en-net.org/question/2226.aspx",10
"Assessment and Surveillance","interpreting weight for height standard deviation from ENA plausibility check",9506,"Anonymous 1740",2015-10-19,"https://www.en-net.org/question/2221.aspx",2
"Assessment and Surveillance","SMART Flagging Criteria (Technical)",11725,"Mark Myatt",2015-10-14,"https://www.en-net.org/question/2214.aspx",20
"Assessment and Surveillance","IYCF Index",8563,"Anonymous 3210",2015-10-08,"https://www.en-net.org/question/1949.aspx",2
"Assessment and Surveillance","Before and an after holiday effect-on nutritional indices",9077,"Asmelash",2015-10-07,"https://www.en-net.org/question/1948.aspx",7
"Assessment and Surveillance","Key questions regarding MUAC only programming - towards a research agenda",10945,"Mark Myatt",2015-10-05,"https://www.en-net.org/question/1945.aspx",8
"Assessment and Surveillance","Looking to contact Simon Kiarie Karanja",11592,"Mark Myatt",2015-09-22,"https://www.en-net.org/question/1930.aspx",2
"Assessment and Surveillance","Surveillance System to be established during El Niño",9453,"Frederich Christian Tan",2015-09-18,"https://www.en-net.org/question/1924.aspx",9
"Assessment and Surveillance","WFH  versus MUAC",16218,"Anonymous 81",2015-09-04,"https://www.en-net.org/question/1915.aspx",21
"Assessment and Surveillance","Discrepancise between ENA version April 2015 and July 2015",8958,"Anonymous 81",2015-08-29,"https://www.en-net.org/question/1903.aspx",1
"Assessment and Surveillance","scale model for adults",9539,"Sara Belleni",2015-08-24,"https://www.en-net.org/question/1890.aspx",5
"Assessment and Surveillance","IMCI service percentage",8960,"Tammam Ali Mohammed Ahmed",2015-08-22,"https://www.en-net.org/question/1887.aspx",6
"Assessment and Surveillance","does EN software work for more  than 5 years",9039,"Anonymous 3126",2015-08-19,"https://www.en-net.org/question/1881.aspx",2
"Assessment and Surveillance","Is there a way to present coverage when we do not have required number of SAM as sampled??",11149,"Main M. Chowdhury",2015-08-18,"https://www.en-net.org/question/1879.aspx",1
"Assessment and Surveillance","Essential Nutrition Actions Practices questions in KAP survey",11606,"Nicholus Tint Zaw",2015-08-16,"https://www.en-net.org/question/1877.aspx",6
"Assessment and Surveillance","Systematic random sampling from a list for rapid MUAC Assessment of U5s",9144,"Anonymous 3066",2015-08-13,"https://www.en-net.org/question/1876.aspx",3
"Assessment and Surveillance","SENSTIVITY OF MUAC TO MALNUTRITION",10967,"MUBANGIZI HUMPHREY",2015-07-31,"https://www.en-net.org/question/1848.aspx",3
"Assessment and Surveillance","SQUEAC after (health) disaster",11099,"Suzanne",2015-07-31,"https://www.en-net.org/question/1847.aspx",2
"Assessment and Surveillance","Is it possible to use LQAS methodology to assess the prevalence of stunting in non-emergency settings?",12397,"Amanda Agar",2015-07-22,"https://www.en-net.org/question/1837.aspx",10
"Assessment and Surveillance","Adolescent anthropometry analysis questions",11560,"Amelia Reese Masterson",2015-07-15,"https://www.en-net.org/question/1832.aspx",6
"Assessment and Surveillance","Urgent: Weight for Height Z-scores: Unisex Z-score table used in West African countries vs. calculated Z score values",15693,"Miriam Chang",2015-07-10,"https://www.en-net.org/question/1826.aspx",11
"Assessment and Surveillance","Emergency standards for SAM/MAM when using MUAC",10261,"Leah Richardson",2015-07-06,"https://www.en-net.org/question/1821.aspx",7
"Assessment and Surveillance","Calculating a sample size to detect associations between maternal nutrition, HH food security status and dietary diversity.",11125,"Briony",2015-07-06,"https://www.en-net.org/question/1820.aspx",4
"Assessment and Surveillance","Calculation of Mortality Rates",25067,"Leah Richardson",2015-07-01,"https://www.en-net.org/question/1813.aspx",4
"Assessment and Surveillance","Nutritional indicator baseline/evaluation",8894,"Kris",2015-06-25,"https://www.en-net.org/question/1805.aspx",1
"Assessment and Surveillance","GETTING AN ALPHA AND BETA VALUE",10821,"Stanley Macharia",2015-06-22,"https://www.en-net.org/question/1796.aspx",1
"Assessment and Surveillance","GUIDE TO PRECISION VALUE IN BAYESQUEAC CALCULATOR",10512,"Stanley Macharia",2015-06-22,"https://www.en-net.org/question/1795.aspx",2
"Assessment and Surveillance","REASON FOR GREAT REDUCTION OF STUNTING WITHIN A YEAR",9226,"Stanley Macharia",2015-06-15,"https://www.en-net.org/question/1780.aspx",10
"Assessment and Surveillance","Dietary macro-nutrient and micro-nutrient intake estimation in children",9796,"Tibebu Moges",2015-06-10,"https://www.en-net.org/question/1779.aspx",6
"Assessment and Surveillance","Nutrition Assessments in 8-19 years",9317,"james majaha",2015-06-01,"https://www.en-net.org/question/1758.aspx",2
"Assessment and Surveillance","Using Weight For Height (WFH) for CMAM coverage survey.",10224,"Lovely Amin",2015-05-30,"https://www.en-net.org/question/1757.aspx",3
"Assessment and Surveillance","DESIGN EFFECT FOR MULTIPLE SMART SURVEY",12379,"Stanley Macharia",2015-05-29,"https://www.en-net.org/question/1756.aspx",18
"Assessment and Surveillance","SE Asian Growth Standards",11940,"Aisling",2015-05-29,"https://www.en-net.org/question/1755.aspx",15
"Assessment and Surveillance","Assessment of Adult Malnutrition in ""Long-legged"" populations",10417,"Anonymous 502",2015-05-27,"https://www.en-net.org/question/1750.aspx",9
"Assessment and Surveillance","MUAC cut off points for school aged children",10901,"fe",2015-05-25,"https://www.en-net.org/question/1744.aspx",4
"Assessment and Surveillance","growth monitoring",9773,"Massimo Serventi",2015-05-24,"https://www.en-net.org/question/1743.aspx",5
"Assessment and Surveillance","Probable reasons for a significantly higher rates of acute malnutrition in boys than girls",12136,"Main M. Chowdhury",2015-05-13,"https://www.en-net.org/question/1730.aspx",13
"Assessment and Surveillance","GAM vs Mortality rate",8619,"Anonymous 490",2015-05-11,"https://www.en-net.org/question/1723.aspx",1
"Assessment and Surveillance","Estimation of New Pregnant Mother for cash transfer programme",8712,"Nicholus Tint Zaw",2015-05-11,"https://www.en-net.org/question/1722.aspx",1
"Assessment and Surveillance","Epi Info equivalent for Mac",16087,"Briony",2015-05-11,"https://www.en-net.org/question/1721.aspx",2
"Assessment and Surveillance","Weighted Analysis",8643,"Mutegi K",2015-05-08,"https://www.en-net.org/question/1718.aspx",2
"Assessment and Surveillance","% of Stunting prevelence or Mean WHZ score",9240,"Nicholus Tint Zaw",2015-05-05,"https://www.en-net.org/question/1709.aspx",3
"Assessment and Surveillance","Is stunted children less prone to be wasted than normal children during emergency context?",9737,"Frederich Christian Tan",2015-05-05,"https://www.en-net.org/question/1708.aspx",7
"Assessment and Surveillance","SQUEAC Second Stage Hypothesis",10980,"Anonymous 2227",2015-04-28,"https://www.en-net.org/question/1701.aspx",3
"Assessment and Surveillance","Can you import by tablet collected data to be analysed in ENA?",11578,"Petr Schmied",2015-04-22,"https://www.en-net.org/question/1696.aspx",8
"Assessment and Surveillance","Nutrition Causal Analysis: usefulness and application",9515,"Blessing Mureverwi",2015-04-09,"https://www.en-net.org/question/1678.aspx",5
"Assessment and Surveillance","Anthropometric assessments in pregnant adolescents",8286,"Merlyn Tapuwa Chapfunga",2015-04-07,"https://www.en-net.org/question/1676.aspx",1
"Assessment and Surveillance","Representative sample",9333,"Anonymous 490",2015-04-01,"https://www.en-net.org/question/1675.aspx",2
"Assessment and Surveillance","ENQUETE SLEAC",11413,"Anonymous 2885",2015-03-30,"https://www.en-net.org/question/1669.aspx",1
"Assessment and Surveillance","weight - quality of surveys",8891,"Severine Frison",2015-03-19,"https://www.en-net.org/question/1654.aspx",2
"Assessment and Surveillance","NCA Methodology",10108,"Anonymous 2352",2015-03-03,"https://www.en-net.org/question/1640.aspx",7
"Assessment and Surveillance","Ratio of severe:moderate wasting and ratio of severe:moderate stunting",9026,"Ranjith",2015-02-28,"https://www.en-net.org/question/1637.aspx",2
"Assessment and Surveillance","how many of the target facilities to assess for judging quality of CMAM service",11763,"Anonymous 680",2015-02-18,"https://www.en-net.org/question/1623.aspx",1
"Assessment and Surveillance","Do you use scales in your work ? Please take part in our survey",8877,"Alison Fleet",2015-02-05,"https://www.en-net.org/question/1608.aspx",0
"Assessment and Surveillance","Calculation of under 2 years MAM children.",8357,"Anonymous 12345",2015-02-02,"https://www.en-net.org/question/1603.aspx",1
"Assessment and Surveillance","Field investigation of acute malnutrition cases in a village",9249,"Lilia TUrcan",2015-02-01,"https://www.en-net.org/question/1602.aspx",2
"Assessment and Surveillance","sample size diagnostic questionnaite-urgent help",9237,"Anonymous 2525",2015-01-29,"https://www.en-net.org/question/1600.aspx",1
"Assessment and Surveillance","Combining of multiple an independent surveys through weighting",9544,"Anonymous 81",2014-12-21,"https://www.en-net.org/question/1579.aspx",2
"Assessment and Surveillance","Geeting the alpha and beta values",11994,"Stanley Macharia",2014-11-19,"https://www.en-net.org/question/1543.aspx",5
"Assessment and Surveillance","Seasonality - IDDS",8486,"Sabine Triemer",2014-11-19,"https://www.en-net.org/question/1542.aspx",1
"Assessment and Surveillance","Nutrition Sentinel Survey",8973,"benylali@yahoo.com",2014-11-12,"https://www.en-net.org/question/1538.aspx",1
"Assessment and Surveillance","Trends in malnutrition",8821,"Sabine Triemer",2014-11-05,"https://www.en-net.org/question/1531.aspx",1
"Assessment and Surveillance","HYPOTHESIS DEVELOPMENT IN URBAN SETTLEMENT",13217,"Anonymous 2707",2014-10-28,"https://www.en-net.org/question/1519.aspx",1
"Assessment and Surveillance","How to assess the nutritional status of pregnant woman?",11176,"Frederich Christian Tan",2014-10-24,"https://www.en-net.org/question/1515.aspx",3
"Assessment and Surveillance","Mass screening in a district",9484,"Anonymous 684",2014-10-15,"https://www.en-net.org/question/1502.aspx",5
"Assessment and Surveillance","Nutrition Assessment for Refugiees & Host mixed population",8904,"Anonymous 2688",2014-10-08,"https://www.en-net.org/question/1500.aspx",7
"Assessment and Surveillance","Integrated SMART and KPC Survey",9609,"Mahaman Elhadji Hallarou",2014-10-07,"https://www.en-net.org/question/1499.aspx",3
"Assessment and Surveillance","What is the meaning of Z-test and P value in SQUEAC estimate calculator?",12360,"Anonymous 1310",2014-10-06,"https://www.en-net.org/question/1498.aspx",1
"Assessment and Surveillance","Guidelines on deciding WHEN to conduct different types of Nutrition Assessment in Emergencies",9699,"Frederich Christian Tan",2014-10-02,"https://www.en-net.org/question/1495.aspx",8
"Assessment and Surveillance","indicator for measuring wasting and stunting in Adults",11612,"Atif",2014-09-22,"https://www.en-net.org/question/1485.aspx",3
"Assessment and Surveillance","Estimating prevalence using health records",9125,"Anonymous 2655",2014-09-15,"https://www.en-net.org/question/1480.aspx",2
"Assessment and Surveillance","SQUEAC Slide Show",11202,"Mark Myatt",2014-09-09,"https://www.en-net.org/question/1469.aspx",2
"Assessment and Surveillance","Error message in ENA SMART software",8750,"Beulah Jayakumar",2014-08-25,"https://www.en-net.org/question/1457.aspx",2
"Assessment and Surveillance","Using nutrition surveys data for secondary analysis?",9553,"Tariq Khan",2014-08-19,"https://www.en-net.org/question/1450.aspx",10
"Assessment and Surveillance","clear definition of Small Scale SMART Survey",11845,"Anonymous 81",2014-08-19,"https://www.en-net.org/question/1449.aspx",18
"Assessment and Surveillance","SMART advocacy.SMART vs other methods",9802,"Blessing Mureverwi",2014-08-07,"https://www.en-net.org/question/1440.aspx",9
"Assessment and Surveillance","How to assess coverage and challenges to coverage in home fortification program",12800,"Roman",2014-08-04,"https://www.en-net.org/question/1434.aspx",2
"Assessment and Surveillance","Request advice: equipment to assess nutritional status 0-5 yrs in field study PNG",9496,"Janny Goris",2014-07-28,"https://www.en-net.org/question/1430.aspx",2
"Assessment and Surveillance","ENA for SMART on MacBook Pro operating System",12271,"Barbara Nalubanga",2014-07-17,"https://www.en-net.org/question/1422.aspx",17
"Assessment and Surveillance","Total population estimation",9194,"Anonymous 2571",2014-07-02,"https://www.en-net.org/question/1406.aspx",2
"Assessment and Surveillance","result of Goronyo squeac coverage",11331,"Muhammad Hassan Goronyo",2014-07-01,"https://www.en-net.org/question/1405.aspx",1
"Assessment and Surveillance","Participatory Review of Coverage Methodologies",11455,"Jose Luis Alvarez Moran",2014-06-25,"https://www.en-net.org/question/1402.aspx",0
"Assessment and Surveillance","Optifoods software",9471,"Martin Njoroge",2014-06-23,"https://www.en-net.org/question/1400.aspx",2
"Assessment and Surveillance","24-hours dietary recall",8740,"Martha.N",2014-06-21,"https://www.en-net.org/question/1399.aspx",2
"Assessment and Surveillance","IYCF and Nutritional Assessment Survey during Ramadan",11462,"Frederich Christian Tan",2014-06-20,"https://www.en-net.org/question/1396.aspx",12
"Assessment and Surveillance","what to do with adolescent men taller  than 1.75 m in WfH?",8817,"Mija Ververs",2014-06-10,"https://www.en-net.org/question/1391.aspx",1
"Assessment and Surveillance","Echantillonnage LQAS",12396,"Mohamed MAIGA",2014-06-07,"https://www.en-net.org/question/1390.aspx",6
"Assessment and Surveillance","Minimum Number of Clusters in a SMART Survey",12546,"Anonymous 2352",2014-05-31,"https://www.en-net.org/question/1385.aspx",7
"Assessment and Surveillance","Causal Analysis in SQUEAC",12279,"Adamu Abubakar Yerima",2014-05-23,"https://www.en-net.org/question/1383.aspx",4
"Assessment and Surveillance","Correlation Analysis for Cross Sectional Survey",8795,"Samuel Kirichu",2014-05-23,"https://www.en-net.org/question/1381.aspx",5
"Assessment and Surveillance","Urgent Help!! Please!! Sampling and study design!!!",10219,"Anonymous 2525",2014-05-22,"https://www.en-net.org/question/1380.aspx",6
"Assessment and Surveillance","How to Interpret Index of Dispersion (ID) in ENA  SMART Output?",11089,"Abbas Kedir Jelde",2014-05-20,"https://www.en-net.org/question/1375.aspx",3
"Assessment and Surveillance","Epi Info command syntax error",13523,"Suzanne Fuhrman",2014-05-13,"https://www.en-net.org/question/1362.aspx",5
"Assessment and Surveillance","Discrepancies of malnutrition prevalence among boys and girls",9299,"Anonymous 2515",2014-05-06,"https://www.en-net.org/question/1355.aspx",2
"Assessment and Surveillance","Coverage survey using Blocked Weighted Bootstrap",13928,"Roman",2014-04-24,"https://www.en-net.org/question/1349.aspx",15
"Assessment and Surveillance","When the survey SD value is out of aceptable range, especially < 0.8, how the prevalence  estimation should proceed?",9712,"nicky",2014-04-08,"https://www.en-net.org/question/1332.aspx",1
"Assessment and Surveillance","When sampled cluster doen't have enough HH demanded by sample size because of urgent and sudden population movement",10279,"nicky",2014-03-31,"https://www.en-net.org/question/1324.aspx",8
"Assessment and Surveillance","Calculating variance and DEFF for stratified sampling",10498,"Blessing Mureverwi",2014-03-28,"https://www.en-net.org/question/1322.aspx",4
"Assessment and Surveillance","Qualitative stage 1(SQUEAC) for both OTP and SFP",12026,"Mutegi K",2014-03-26,"https://www.en-net.org/question/1317.aspx",5
"Assessment and Surveillance","CMN training/assessment",11004,"Ranjith",2014-03-03,"https://www.en-net.org/question/1288.aspx",1
"Assessment and Surveillance","developing a methodology for a highly security compromised area. need guidence",9119,"Dr Mohammad Najeeb",2014-02-26,"https://www.en-net.org/question/1281.aspx",1
"Assessment and Surveillance","MUAC tapes",20525,"Jan Komrska",2014-02-13,"https://www.en-net.org/question/1274.aspx",12
"Assessment and Surveillance","Survey Sample for Pastoral Communities",8790,"Abbas Kedir Jelde",2014-02-11,"https://www.en-net.org/question/1272.aspx",1
"Assessment and Surveillance","SMART on-site selection of village",9071,"Frederich Christian Tan",2014-02-11,"https://www.en-net.org/question/1271.aspx",1
"Assessment and Surveillance","conversion of sample size to household",15214,"Anonymous 81",2014-02-09,"https://www.en-net.org/question/1270.aspx",22
"Assessment and Surveillance","Check list or guidance note (summarize) for before starting & during conduction of SQUEAC (Preparation of SQUEAC)",11058,"Anonymous 739",2014-02-07,"https://www.en-net.org/question/1269.aspx",0
"Assessment and Surveillance","Minimum Union Councils (UC) for SQUEAC due to any reasons",10985,"Anonymous 739",2014-02-07,"https://www.en-net.org/question/1268.aspx",1
"Assessment and Surveillance","SMART urban sampling",10462,"Maja Kuhar",2014-02-05,"https://www.en-net.org/question/1263.aspx",5
"Assessment and Surveillance","Establishment of Nutrition Surveillance System",9448,"Frederich Christian Tan",2014-01-31,"https://www.en-net.org/question/1260.aspx",4
"Assessment and Surveillance","SQUEAC, when CMAM program ends",12406,"Anonymous 739",2014-01-31,"https://www.en-net.org/question/1258.aspx",8
"Assessment and Surveillance","NCA",11673,"Dr. Kamal Raj",2014-01-09,"https://www.en-net.org/question/1240.aspx",2
"Assessment and Surveillance","SLEAC and SQUEAC",13551,"Anonymous 2352",2013-12-05,"https://www.en-net.org/question/1221.aspx",1
"Assessment and Surveillance","Is mortality survey a must to be conducted along with SMART?",9728,"Anonymous 81",2013-12-03,"https://www.en-net.org/question/1217.aspx",3
"Assessment and Surveillance","Individual data entry in mortality data set of ENA for HH size > 20",10207,"Anonymous 2411",2013-11-29,"https://www.en-net.org/question/1215.aspx",10
"Assessment and Surveillance","SQUEAC - Weighted boosters and barriers",12723,"Anonymous 81",2013-11-25,"https://www.en-net.org/question/1211.aspx",5
"Assessment and Surveillance","Vulnerability Assessmnet: Indepth analysis of nutrition versus socio-economic indicators",8722,"Anonymous 2354",2013-11-19,"https://www.en-net.org/question/1207.aspx",2
"Assessment and Surveillance","Setting up of Nutrition serveillance",12306,"Anonymous 81",2013-11-16,"https://www.en-net.org/question/1201.aspx",9
"Assessment and Surveillance","KAP surveys",13020,"Anonymous 557",2013-11-06,"https://www.en-net.org/question/1194.aspx",2
"Assessment and Surveillance","Why Credibility Interval (CI) is slightly changing while estimating Posterior Coverage by using SQUEAC coverage estimate calculator (Version 3.01)",11740,"Anonymous 1310",2013-10-30,"https://www.en-net.org/question/1187.aspx",4
"Assessment and Surveillance","Low OTP Coverage",11962,"Anonymous 2352",2013-10-28,"https://www.en-net.org/question/1185.aspx",4
"Assessment and Surveillance","sampleXS and things that I should know!",8508,"Anonymous 557",2013-10-11,"https://www.en-net.org/question/1170.aspx",1
"Assessment and Surveillance","SQUEAC Coverage survey",14490,"Anonymous 2264",2013-10-08,"https://www.en-net.org/question/1163.aspx",20
"Assessment and Surveillance","Discrepancy between BayesSQUEAC calculator and Manual calculation",11864,"Anonymous 81",2013-09-30,"https://www.en-net.org/question/1152.aspx",3
"Assessment and Surveillance","SQUEAC Stage",12505,"Anonymous 81",2013-09-27,"https://www.en-net.org/question/1151.aspx",3
"Assessment and Surveillance","malnutrition rate",12927,"Anonymous 2180",2013-09-24,"https://www.en-net.org/question/1144.aspx",24
"Assessment and Surveillance","Appropriate effect size in estimating sample size",9554,"Anonymous 2356",2013-09-19,"https://www.en-net.org/question/1142.aspx",1
"Assessment and Surveillance","Smart Survey Methodology versus 30 by 30 cluster sampling -comparison of results",11286,"Anonymous 2354",2013-09-13,"https://www.en-net.org/question/1141.aspx",1
"Assessment and Surveillance","Assessing Relationships between Food security and population growth",8782,"Mahaman Elhadji Hallarou",2013-09-09,"https://www.en-net.org/question/1137.aspx",0
"Assessment and Surveillance","Sample size estimation for follow up CSAS survey",11841,"Anonymous 680",2013-09-05,"https://www.en-net.org/question/1134.aspx",1
"Assessment and Surveillance","time to complementary feeding initation sample size issue",9107,"Anonymous 1727",2013-07-20,"https://www.en-net.org/question/1104.aspx",2
"Assessment and Surveillance","SFP coverage for pregnant and lactating women",10058,"Anonymous 422",2013-07-12,"https://www.en-net.org/question/1096.aspx",4
"Assessment and Surveillance","How to minimize the problem of getting less SAM children than minimum sample size due to big variation in village population figure?",11266,"Anonymous 1310",2013-07-03,"https://www.en-net.org/question/1092.aspx",1
"Assessment and Surveillance","SMART surveys and interpretation of quality",14810,"Josek",2013-06-25,"https://www.en-net.org/question/1087.aspx",22
"Assessment and Surveillance","Household dietary diversity score also among pastoralist communities?",10084,"Melanie Bruns",2013-06-18,"https://www.en-net.org/question/1080.aspx",3
"Assessment and Surveillance","looking for adult stadiometers - urgently!",9157,"Victoria Sibson",2013-06-15,"https://www.en-net.org/question/1079.aspx",1
"Assessment and Surveillance","Food groups to assess diet diversity",11162,"Nicki Connell",2013-06-11,"https://www.en-net.org/question/1069.aspx",3
"Assessment and Surveillance","analysis",9138,"Anonymous 1727",2013-05-30,"https://www.en-net.org/question/1060.aspx",1
"Assessment and Surveillance","Household adjustment unit",8608,"Bienfait",2013-05-22,"https://www.en-net.org/question/1048.aspx",2
"Assessment and Surveillance","LQAS types",13122,"Anonymous 81",2013-05-22,"https://www.en-net.org/question/1047.aspx",7
"Assessment and Surveillance","Should results for small and wide area surveys be combined?",11800,"Anonymous 422",2013-05-21,"https://www.en-net.org/question/1044.aspx",4
"Assessment and Surveillance","Impact assessment on project addressing specific elements of the community",9341,"Anonymous 81",2013-05-14,"https://www.en-net.org/question/1042.aspx",4
"Assessment and Surveillance","SMART Question",9545,"Gezahegn S.",2013-05-08,"https://www.en-net.org/question/1037.aspx",3
"Assessment and Surveillance","Cluster or SRS",9648,"Tamsin",2013-05-07,"https://www.en-net.org/question/1036.aspx",2
"Assessment and Surveillance","Effect of qualitative data on estimation of CMAM program coverage",12340,"Anonymous 1570",2013-04-18,"https://www.en-net.org/question/1026.aspx",2
"Assessment and Surveillance","Oedema",10372,"Njeri Waigwa",2013-04-17,"https://www.en-net.org/question/1023.aspx",2
"Assessment and Surveillance","Experience using SQUEAC surveys to assess BSFP/TSFP coverage",12101,"Nicki Connell",2013-04-15,"https://www.en-net.org/question/1022.aspx",3
"Assessment and Surveillance","Coverage prevalence survey for blanket SFP for chronic malnutrition",12625,"Anonymous 2232",2013-03-18,"https://www.en-net.org/question/995.aspx",6
"Assessment and Surveillance","MUAC ANALYSE",12019,"FRANCK ALE",2013-03-14,"https://www.en-net.org/question/991.aspx",5
"Assessment and Surveillance","Defining new variables and assign value using EPIinfo version 3.5.4",12520,"Anonymous 81",2013-03-08,"https://www.en-net.org/question/985.aspx",7
"Assessment and Surveillance","Allocation of sample by proportion",11351,"Anonymous 81",2013-02-25,"https://www.en-net.org/question/979.aspx",4
"Assessment and Surveillance","Rate of weight gain in Infants and Under 5",8846,"Charulatha Banerjee",2013-02-23,"https://www.en-net.org/question/978.aspx",2
"Assessment and Surveillance","late admission investigated by plotting MUAC",11736,"FRANCK ALE",2013-02-15,"https://www.en-net.org/question/976.aspx",1
"Assessment and Surveillance","Stunting screening and disability",9073,"Antony",2013-02-14,"https://www.en-net.org/question/972.aspx",1
"Assessment and Surveillance","Determine  carers willingness to  walk to access services",11931,"FRANCK ALE",2013-02-14,"https://www.en-net.org/question/971.aspx",3
"Assessment and Surveillance","Length of recall period during SMART survey",10334,"Rogers Wanyama",2013-02-11,"https://www.en-net.org/question/966.aspx",2
