"Theme","Topic","Views","Author","Posted","Link","Replies"
"Announcements & Nutritionists needed","SNV BCC consultancy in Zambia",5484,"Tamsin Walters",2015-04-15,"https://www.en-net.org/question/1687.aspx",NA
"Announcements & Nutritionists needed","ENN seeks French speaking nutritionist for short-term consultancy",4516,"Tamsin Walters",2015-04-15,"https://www.en-net.org/question/1686.aspx",NA
"Announcements & Nutritionists needed","Vacancy: Programme Manager",4752,"Verena Heinreichsberger",2015-04-14,"https://www.en-net.org/question/1684.aspx",NA
"Announcements & Nutritionists needed","3 vacancies to support the set up of nutrition information platforms in various countries",5046,"Anonymous 2915",2015-04-14,"https://www.en-net.org/question/1683.aspx",NA
"Announcements & Nutritionists needed","Concern is looking for a consultant for Zambia to design baseline survey and monitoring tools",5578,"Regine Kopplow",2015-04-13,"https://www.en-net.org/question/1681.aspx",NA
"Announcements & Nutritionists needed","ACF reccherche UN CHARGE DE PROGRAMME EN SANTE & NUTRITION (H/F) en RCA",4700,"Marie Lecuyer",2015-04-09,"https://www.en-net.org/question/1680.aspx",NA
"Announcements & Nutritionists needed","ACF is looking for A NUTRITION TRAINING EXPERT in  AFGHANISTAN",4788,"Marie Lecuyer",2015-04-09,"https://www.en-net.org/question/1679.aspx",NA
"Announcements & Nutritionists needed","Nutrition Specialist in Emergencies Job Announcement",5134,"Ivennie Matika",2015-04-08,"https://www.en-net.org/question/1677.aspx",NA
"Announcements & Nutritionists needed","London School of Hygiene and Tropical Medicine seeks research fellow in Nutrition and Sustainability",5589,"Tamsin Walters",2015-04-01,"https://www.en-net.org/question/1673.aspx",NA
"Announcements & Nutritionists needed","Consultant to join OPML Nutrition Portfolio",5247,"Tamsin Walters",2015-04-01,"https://www.en-net.org/question/1671.aspx",NA
"Announcements & Nutritionists needed","Consultant needed for Link NCA nutrition response analysis guidance",5580,"Julien Morel",2015-03-30,"https://www.en-net.org/question/1667.aspx",NA
"Announcements & Nutritionists needed","ACF is looking for A NUTRITION AND HEALTH PROGRAM MANAGER - FLYING",4955,"Marie Lecuyer",2015-03-25,"https://www.en-net.org/question/1663.aspx",NA
"Announcements & Nutritionists needed","ACF is looking for A NUTRITION AND HEALTH COORDINATOR - FLYING",5116,"Marie Lecuyer",2015-03-25,"https://www.en-net.org/question/1662.aspx",NA
"Announcements & Nutritionists needed","ACF is looking for A NUTRITION AND HEALTH PROGRAM MANAGER in SIERRA LEONE",4861,"Marie LECUYER",2015-03-20,"https://www.en-net.org/question/1658.aspx",NA
"Announcements & Nutritionists needed","ACF is looking for A NUTRITION SURVEILLANCE EXPERT - SIERRA LEONE",5461,"Marie LECUYER",2015-03-20,"https://www.en-net.org/question/1657.aspx",NA
"Announcements & Nutritionists needed","ACF is looking for A HEALTH PROGRAM DEPUTY COORDINATOR in SIERRA LEONE",4979,"Marie Lecuyer",2015-03-17,"https://www.en-net.org/question/1651.aspx",NA
"Announcements & Nutritionists needed","ACF is looking for A NUTRITION AND HEALTH COORDINATOR in Ethiopia",5144,"Marie Lecuyer",2015-03-17,"https://www.en-net.org/question/1650.aspx",NA
"Announcements & Nutritionists needed","Regional Humanitarian Health Programme Manager based in Amman, Jordan",4926,"Pascale Fritsch",2015-03-16,"https://www.en-net.org/question/1649.aspx",NA
"Announcements & Nutritionists needed","Consultant Needed for Stunting Prevention Project",5803,"Anonymous 2865",2015-03-16,"https://www.en-net.org/question/1648.aspx",NA
"Announcements & Nutritionists needed","JOB OPENING: Nutrition Component Manager",5640,"Anonymous 2705",2015-03-10,"https://www.en-net.org/question/1647.aspx",NA
"Announcements & Nutritionists needed","Concern Worldwide is seeking a HEALTH & NUTRITION MANAGER for programme start-up in CAR",5439,"David Kilcline",2015-03-06,"https://www.en-net.org/question/1646.aspx",NA
"Announcements & Nutritionists needed","Concern Worldwide is hiring a HEALTH & NUTRITION ADVISER in West Darfur",5991,"David Kilcline",2015-03-06,"https://www.en-net.org/question/1645.aspx",NA
"Announcements & Nutritionists needed","Concern Worldwide seeks an Emergency Coordinator in Niger",5425,"Tamsin Walters",2015-03-03,"https://www.en-net.org/question/1641.aspx",NA
"Announcements & Nutritionists needed","Experienced data analyst (DHS data) needed",5018,"Marie McGrath",2015-02-26,"https://www.en-net.org/question/1636.aspx",NA
"Announcements & Nutritionists needed","Nutrition Specialist (Community) - 6 months Maternity Cover",5465,"Erin McCloskey-Rebelo",2015-02-23,"https://www.en-net.org/question/1630.aspx",NA
"Announcements & Nutritionists needed","ACF is looking for a Link NCA PROJECT COORDINATOR",5198,"Julien Morel",2015-02-22,"https://www.en-net.org/question/1629.aspx",NA
"Announcements & Nutritionists needed","Communications and Advocacy Adviser Vacancy, based in Malawi",5317,"Georgina Nicoli",2015-02-20,"https://www.en-net.org/question/1628.aspx",NA
"Announcements & Nutritionists needed","ACF is looking for a MEDICAL DOCTOR in Myanmar",4964,"Marie Lecuyer",2015-02-18,"https://www.en-net.org/question/1624.aspx",NA
"Announcements & Nutritionists needed","ProPAN Consultant",5554,"Erin McCloskey-Rebelo",2015-02-17,"https://www.en-net.org/question/1622.aspx",NA
"Announcements & Nutritionists needed","ACF is looking for A NUTRITION AND HEALTH PROGRAM MANAGER  in  MYANMAR",4729,"Marie Lecuyer",2015-02-16,"https://www.en-net.org/question/1621.aspx",NA
"Announcements & Nutritionists needed","ACF is looking for A NUTRITION AND HEALTH COORDINATOR in YEMEN",4699,"Marie Lecuyer",2015-02-11,"https://www.en-net.org/question/1619.aspx",NA
"Announcements & Nutritionists needed","ACF is looking for A NUTRITION AND HEALTH PROGRAM MANAGER in YEMEN",5031,"Marie Lecuyer",2015-02-11,"https://www.en-net.org/question/1618.aspx",NA
"Announcements & Nutritionists needed","New article: Imperial College London’s Samrat Singh looks at what governments and their development partners can do to enable shattered agricultural markets to bounce back from the Ebola crisis.",9939,"Tamsin Walters",2015-02-09,"https://www.en-net.org/question/1616.aspx",NA
"Announcements & Nutritionists needed","Recruiting Nutrition Scientist for WorldFish Bangladesh",5029,"Tamsin Walters",2015-02-09,"https://www.en-net.org/question/1615.aspx",NA
"Announcements & Nutritionists needed","London School of Hygiene and Tropical Medicine studentship",5308,"Tamsin Walters",2015-02-09,"https://www.en-net.org/question/1614.aspx",NA
"Announcements & Nutritionists needed","UNICEF Mali seeks Nutrition Cluster Coordinator",5870,"Tamsin Walters",2015-02-05,"https://www.en-net.org/question/1609.aspx",NA
"Announcements & Nutritionists needed","Concern: consultant required for Zambia on nutrition sensitive conservation agriculture",5291,"Regine Kopplow",2015-02-04,"https://www.en-net.org/question/1606.aspx",NA
"Announcements & Nutritionists needed","Consultancy to develop a nutritional training in Haiti",5690,"Tamsin Walters",2015-02-02,"https://www.en-net.org/question/1605.aspx",NA
"Announcements & Nutritionists needed","SPRING Monitoring & Evaluation Specialist Vacancy- Agriculture & Nutrition",5947,"Tamsin Walters",2015-02-02,"https://www.en-net.org/question/1604.aspx",NA
"Announcements & Nutritionists needed","Country Manager, Bangladesh - GAIN (Global Alliance for Improved Nutrition)",5391,"Anonymous 2802",2015-01-28,"https://www.en-net.org/question/1599.aspx",NA
"Announcements & Nutritionists needed","ACF is looking for a MEDICAL DOCTOR in Myanmar",4399,"Marie Lecuyer",2015-01-28,"https://www.en-net.org/question/1598.aspx",NA
"Announcements & Nutritionists needed","HelpAge International is looking for a Nutrition Coordinator in Juba",5024,"Pascale Fritsch",2015-01-27,"https://www.en-net.org/question/1597.aspx",NA
"Announcements & Nutritionists needed","BBC seeks a  Health Research Manager",5350,"Tamsin Walters",2015-01-27,"https://www.en-net.org/question/1596.aspx",NA
"Announcements & Nutritionists needed","Medair Vacancy - Health & Nutrition Advisor (Syrian Crisis)",5745,"Eliza Jockuat",2015-01-26,"https://www.en-net.org/question/1595.aspx",NA
"Announcements & Nutritionists needed","Medair seeks a Food Security Advisor for its programme in Afghanistan",4820,"Eliza Jockuat",2015-01-26,"https://www.en-net.org/question/1594.aspx",NA
"Announcements & Nutritionists needed","ACF is looking for AN INFECTION PREVENTION AND CONTROL PROGRAM MANAGER - SIERRA LEONE",4996,"Marie Lecuyer",2015-01-26,"https://www.en-net.org/question/1593.aspx",NA
"Announcements & Nutritionists needed","ACDI/VOCA is seeking a D.C.-based Associate Director, Social & Behavior Change",4981,"Tamsin Walters",2015-01-15,"https://www.en-net.org/question/1588.aspx",NA
"Announcements & Nutritionists needed","Medair seeks Health Manager (s) - (Supervising Nurse or Doctor) for its programme in Sierra Leone",5371,"Eliza Jockuat",2015-01-05,"https://www.en-net.org/question/1583.aspx",NA
"Announcements & Nutritionists needed","Health Project Manager is needed for Medair's programme in South Sudan",4936,"Eliza Jockuat",2015-01-05,"https://www.en-net.org/question/1582.aspx",NA
"Announcements & Nutritionists needed","ACF recherche un UN RESPONSABLE ENQUETE NUTRITIONNELLE SMART (H/F)",5291,"Marie Lecuyer",2014-12-19,"https://www.en-net.org/question/1578.aspx",NA
"Announcements & Nutritionists needed","ACF is looking for A MEDICAL DOCTOR in Myanmar",4671,"Marie Lecuyer",2014-12-19,"https://www.en-net.org/question/1577.aspx",NA
"Announcements & Nutritionists needed","Team leader for the evaluation of HKI Vitamin A supplementation regional project",5628,"David Doledec",2014-12-19,"https://www.en-net.org/question/1576.aspx",NA
"Announcements & Nutritionists needed","Consultancy for evaluation of HKI Vitamin A supplementation regional project",5526,"David Doledec",2014-12-19,"https://www.en-net.org/question/1575.aspx",NA
"Announcements & Nutritionists needed","SCUK is re-advertising for a Senior Humanitarian Nutrition Adviser - full time post based in London - closes 13 January 2015",5599,"Anonymous 2478",2014-12-18,"https://www.en-net.org/question/1574.aspx",NA
"Announcements & Nutritionists needed","ACF is looking for AN EXPERT EPIDEMIOLOGIST in LIBERIA",5510,"Marie Lecuyer",2014-12-17,"https://www.en-net.org/question/1572.aspx",NA
"Announcements & Nutritionists needed","ACF is looking for A NUTRITION AND HEALTH COORDINATOR in SIERRA LEONE",5352,"Marie Lecuyer",2014-12-17,"https://www.en-net.org/question/1571.aspx",NA
"Announcements & Nutritionists needed","CMAM/ IMAM consultancy opportunity with SUN Fund, Zambia",6210,"Anonymous 130",2014-12-16,"https://www.en-net.org/question/1570.aspx",NA
"Announcements & Nutritionists needed","Save the Children seeks Head of Hunger Reduction & Livelihoods (12 months maternity cover)",5232,"Tamsin Walters",2014-12-10,"https://www.en-net.org/question/1568.aspx",NA
"Announcements & Nutritionists needed","vacancy for 2 HKI regional nutrition positions (Location flexible)",5742,"David Doledec",2014-12-10,"https://www.en-net.org/question/1567.aspx",NA
"Announcements & Nutritionists needed","vacancy for 1 HKI M&E regional nutrition position (Nairobi, Kenya)",5905,"David Doledec",2014-12-10,"https://www.en-net.org/question/1566.aspx",NA
"Announcements & Nutritionists needed","Medair seeks Health Project Managers for programmes in D. R. Congo",4626,"Eliza Jockuat",2014-12-05,"https://www.en-net.org/question/1565.aspx",NA
"Announcements & Nutritionists needed","Health & Nutrition Project Manager is needed for Medair's programmes in South Sudan",4886,"Eliza Jockuat",2014-12-05,"https://www.en-net.org/question/1564.aspx",NA
"Announcements & Nutritionists needed","ACF recherche UN COORDINATEUR SANTE ET NUTRITION (H/F) au BURKINA FASO",5477,"Marie Lecuyer",2014-12-05,"https://www.en-net.org/question/1563.aspx",NA
"Announcements & Nutritionists needed","Nutrition Specialist - IRC HQ, New York",5760,"Casie Tesfai",2014-12-04,"https://www.en-net.org/question/1562.aspx",NA
"Announcements & Nutritionists needed","Free LSHTM online course on Ebola: registration open",6564,"Marie McGrath",2014-12-04,"https://www.en-net.org/question/1561.aspx",NA
"Announcements & Nutritionists needed","Research Associate Position for Study on Nutrition and Cash Transfer Programming",6201,"Andrew Seal",2014-12-03,"https://www.en-net.org/question/1560.aspx",NA
"Announcements & Nutritionists needed","ACF is looking for a A HEALTH SYSTEM STRENGTHENING EXPERT in AFGHANISTAN",5169,"Marie Lecuyer",2014-12-03,"https://www.en-net.org/question/1558.aspx",NA
"Announcements & Nutritionists needed","International Medical Corps - 14-881 Emergency Nutrition Officer",6025,"Anonymous 1494",2014-12-02,"https://www.en-net.org/question/1557.aspx",NA
"Announcements & Nutritionists needed","Director - Secretariat of the Global Panel on Agriculture and Food Systems for Nutrition",5471,"Tamsin Walters",2014-12-01,"https://www.en-net.org/question/1556.aspx",NA
"Announcements & Nutritionists needed","Invitation to contribute to the Merlin History Project",5927,"Tamsin Walters",2014-12-01,"https://www.en-net.org/question/1555.aspx",NA
"Announcements & Nutritionists needed","ACF recherche UN RESPONSABLE DE PROJET RECHERCHE OPÉRATIONNELLE NUTRITION/SANTE (H/F) au TCHAD",5061,"Marie Lecuyer",2014-11-28,"https://www.en-net.org/question/1552.aspx",NA
"Announcements & Nutritionists needed","Call for abstracts: 3rd FANUS Conference 2015 Arusha, Tanzania",6834,"Tamsin Walters",2014-11-27,"https://www.en-net.org/question/1550.aspx",NA
"Announcements & Nutritionists needed","Emergency Nutrition Officer Liberia",5767,"Anonymous 462",2014-11-26,"https://www.en-net.org/question/1549.aspx",NA
"Announcements & Nutritionists needed","Medair is seeking a Senior Health and Nutrition Advisor for our international HQ",5563,"Mark Hawkes",2014-11-26,"https://www.en-net.org/question/1548.aspx",NA
"Announcements & Nutritionists needed","SCUK is looking for a Senior Humanitarian Nutrition Adviser - London based (full or part time) deadline for applications 7 Dec 2015",5409,"Anonymous 2478",2014-11-21,"https://www.en-net.org/question/1546.aspx",NA
"Announcements & Nutritionists needed","ACF recherche un UN RÉFÉRENT TECHNIQUE URGENCE EBOLA (H/F) basé à Paris",5459,"Marie Lecuyer",2014-11-19,"https://www.en-net.org/question/1545.aspx",NA
"Announcements & Nutritionists needed","ACF is looking for a A NUTRITION AND HEALTH PROGRAM MANAGER in LIBERIA",5797,"Marie Lecuyer",2014-11-19,"https://www.en-net.org/question/1544.aspx",NA
"Announcements & Nutritionists needed","SPRING seeks consultant with expertise in agricultural data collection and analysis",5248,"Tamsin Walters",2014-11-12,"https://www.en-net.org/question/1539.aspx",NA
"Announcements & Nutritionists needed","Job Announcement: IMC seeks IYCF Consultant - Turkey",5785,"Anonymous 2727",2014-11-08,"https://www.en-net.org/question/1535.aspx",NA
"Announcements & Nutritionists needed","Advertising",4767,"Anonymous 2725",2014-11-08,"https://www.en-net.org/question/1534.aspx",NA
"Announcements & Nutritionists needed","ACF recherche un UN CHARGE DE PROJET PLAIDOYER NUTRITION FRANCE (H/F) basé en FRANCE",5318,"Marie Lecuyer",2014-11-07,"https://www.en-net.org/question/1533.aspx",NA
"Announcements & Nutritionists needed","Announcement:  Launch of updated SMART website at www.smartmethodology.org",5671,"Scott Logue",2014-11-02,"https://www.en-net.org/question/1523.aspx",NA
"Announcements & Nutritionists needed","JSI Job Opening: SPRING/Uganda Country Manager (based in Kampala)",6379,"Anonymous 2705",2014-10-27,"https://www.en-net.org/question/1517.aspx",NA
"Announcements & Nutritionists needed","IRC seeks Senior Coordinator for Nutrition Research",5403,"Jeanette Bailey",2014-10-21,"https://www.en-net.org/question/1510.aspx",NA
"Announcements & Nutritionists needed","IRC seeks HQ Nutrition Specialist",5632,"Jeanette Bailey",2014-10-21,"https://www.en-net.org/question/1509.aspx",NA
"Announcements & Nutritionists needed","ACF is looking for a A HEALTH SYSTEM STRENGTHENING EXPERT in Afghanistan",5009,"Marie Lecuyer",2014-10-21,"https://www.en-net.org/question/1508.aspx",NA
"Announcements & Nutritionists needed","Consultancy - ACF Nutrition Security training kit revision and test",5945,"Julien Morel",2014-10-20,"https://www.en-net.org/question/1507.aspx",NA
"Announcements & Nutritionists needed","MEDAIR is seeking a Project Manager - Food Security for its programme in Haiti",5352,"Eliza Jockuat",2014-10-17,"https://www.en-net.org/question/1504.aspx",NA
"Announcements & Nutritionists needed","ACF recherche UN EXPERT EN RENFORCEMENT DES SYSTEMES DE SANTE (H/F) en Cote d'Ivoire",5029,"Marie Lecuyer",2014-10-15,"https://www.en-net.org/question/1503.aspx",NA
"Announcements & Nutritionists needed","Consultancy: External Evaluation of CMAM Forum Phase Two: Consolidation and Expansion",11918,"Kristine Albrektsen",2014-10-14,"https://www.en-net.org/question/1501.aspx",NA
"Announcements & Nutritionists needed","ACF is looking for A NUTRITION AND HEALTH EXPERT in INDONESIA",5057,"Marie Lecuyer",2014-10-06,"https://www.en-net.org/question/1496.aspx",NA
"Announcements & Nutritionists needed","Job Vacancy: Survey Development Technical Manager",5487,"Verena Heinreichsberger",2014-10-01,"https://www.en-net.org/question/1494.aspx",NA
"Announcements & Nutritionists needed","Meeting: iCCM & Nut technical meeting in NYC 11-12 Dec, 2014",5653,"Casie Tesfai",2014-09-29,"https://www.en-net.org/question/1492.aspx",NA
"Announcements & Nutritionists needed","ACF is looking for:A NUTRITION AND HEALTH COORDINATOR in ETHIOPIA",5265,"Marie Lecuyer",2014-09-26,"https://www.en-net.org/question/1490.aspx",NA
"Announcements & Nutritionists needed","Job Vacancy - Save the Children; Emergency Nutrition Senior Specialist / Humanitarian Response Personnel / Senior Specialist",5466,"Sarah (Butler) O'Flynn",2014-09-23,"https://www.en-net.org/question/1487.aspx",NA
"Announcements & Nutritionists needed","ACF is looking for A NUTRITION AND HEALTH PROGRAM MANAGER in MYANMAR",5025,"Michael ALVES",2014-09-18,"https://www.en-net.org/question/1482.aspx",NA
"Announcements & Nutritionists needed","Team leader for Nutrition project of EU in Yemen",5647,"Caroline Fischler",2014-09-15,"https://www.en-net.org/question/1479.aspx",NA
"Announcements & Nutritionists needed","ACF is looking for A PSYCHOLOGIST - MENTAL HEALTH & CARE PRACTICES PROGRAMME MANAGER in Myanmar",5506,"Michael ALVES",2014-09-11,"https://www.en-net.org/question/1478.aspx",NA
"Announcements & Nutritionists needed","ACF is lookng for A NUTRITION FLYING TECHNICAL SUPPORT in Afghanistan",5236,"Michael ALVES",2014-09-11,"https://www.en-net.org/question/1477.aspx",NA
"Announcements & Nutritionists needed","ACF is looking for A NUTRITION AND HEALTH MONITORING AND EVALUATION PROGRAM MANAGER in Afghanistan",4917,"Michael ALVES",2014-09-11,"https://www.en-net.org/question/1476.aspx",NA
"Announcements & Nutritionists needed","ACF is looking for A HEALTH SYSTEM STRENGTHENING PROGRAM MANAGER in Afghanistan",5152,"Michael ALVES",2014-09-11,"https://www.en-net.org/question/1475.aspx",NA
"Announcements & Nutritionists needed","ACF is looking for a MEDICAL DOCTOR in Myanmar",5178,"Michael ALVES",2014-09-11,"https://www.en-net.org/question/1474.aspx",NA
"Announcements & Nutritionists needed","Research Advisor 14-637 - International Medical Corps",5571,"Anonymous 1494",2014-09-09,"https://www.en-net.org/question/1472.aspx",NA
"Announcements & Nutritionists needed","Senior Child Nutrition and Food Security Programmes Adviser",5421,"Sue Sowerby",2014-09-09,"https://www.en-net.org/question/1471.aspx",NA
"Announcements & Nutritionists needed","Vacancy for a Senior Child Health Programmes Adviser",5329,"Sue Sowerby",2014-09-09,"https://www.en-net.org/question/1470.aspx",NA
"Announcements & Nutritionists needed","NCA Consultant Madhya Pradesh India",5809,"Rakesh",2014-09-05,"https://www.en-net.org/question/1466.aspx",NA
"Announcements & Nutritionists needed","Conseil Santé seeks a health education expert for a 3 year nutrition project in Yemen (EU funded)",5064,"Marin de Silans",2014-08-19,"https://www.en-net.org/question/1455.aspx",NA
"Announcements & Nutritionists needed","Conseil Santé seeks a nutritionist for a 3 year nutrition project in Yemen (EU funded)",4519,"Marin de Silans",2014-08-19,"https://www.en-net.org/question/1454.aspx",NA
"Announcements & Nutritionists needed","Conseil Santé seeks a Team leader for 3 years nutrition project in Yemen (EU funded)",4532,"Marin de Silans",2014-08-19,"https://www.en-net.org/question/1453.aspx",NA
"Announcements & Nutritionists needed","UNICEF Supply Division is seeking a Quality Technical Assistant",5276,"Alison Fleet",2014-08-19,"https://www.en-net.org/question/1452.aspx",NA
"Announcements & Nutritionists needed","Save the Children seeks a Nutrition Programme Coodirdinator -Jongeli, South Sudan",6018,"Alison Donnelly",2014-08-11,"https://www.en-net.org/question/1443.aspx",NA
"Announcements & Nutritionists needed","Save the Children seeks a Nutrition Survey Manager for South Sudan",5818,"Alison Donnelly",2014-08-07,"https://www.en-net.org/question/1441.aspx",NA
"Announcements & Nutritionists needed","Nutrition Coordinator 14-586 at International Medical Corps",5655,"Anonymous 1494",2014-08-05,"https://www.en-net.org/question/1439.aspx",NA
"Announcements & Nutritionists needed","Nutrition Cluster Coordinator 14-581 needed at International Medical Corps",5546,"Anonymous 1494",2014-08-04,"https://www.en-net.org/question/1438.aspx",NA
"Announcements & Nutritionists needed","Updated posting for Nutrition Information Management Officer - Rapid Response Team",5568,"Kathy McConnell",2014-08-04,"https://www.en-net.org/question/1437.aspx",NA
"Announcements & Nutritionists needed","ACF is looking for A NUTRITION AND HEALTH PROGRAM MANAGER in Sierra Leone",4700,"Marie Lecuyer",2014-08-04,"https://www.en-net.org/question/1436.aspx",NA
"Announcements & Nutritionists needed","Nutrition Information Management Officer - Rapid Response Team",5974,"Kathy McConnell",2014-07-31,"https://www.en-net.org/question/1433.aspx",NA
"Announcements & Nutritionists needed","ACF recherche UN EXPERT EN RENFORCEMENT DU SYSTEME DE SANTE (H/F)",5201,"Marie Lecuyer",2014-07-30,"https://www.en-net.org/question/1432.aspx",NA
"Announcements & Nutritionists needed","ACF is looking for a A HEALTH SYSTEM STRENGTHENING EXPERT in Afghanistan",4884,"Marie Lecuyer",2014-07-30,"https://www.en-net.org/question/1431.aspx",NA
"Announcements & Nutritionists needed","Social and Behavior Change Communication Expert - WFP Sudan",5375,"Katia Santos Dias",2014-07-20,"https://www.en-net.org/question/1425.aspx",NA
"Announcements & Nutritionists needed","ACF recherche un MEDECIN (H/F) en RCA",4634,"Marie Lecuyer",2014-07-18,"https://www.en-net.org/question/1424.aspx",NA
"Announcements & Nutritionists needed","FAO Consultance - Organisation d'un atelier ""Elevage - Moyen d'existence et Nutrition"" au Sahel",6037,"Domitille Kauffmann",2014-07-17,"https://www.en-net.org/question/1421.aspx",NA
"Announcements & Nutritionists needed","UNICEF Chad seeking Nutrition Specialist (P4) - closing date 28 July",5290,"Anonymous 2579",2014-07-16,"https://www.en-net.org/question/1419.aspx",NA
"Announcements & Nutritionists needed","External Outreach to Nutrition Specialists for UNICEF Rapid Response Mechanism in Western, Eastern, Southern, Central Africa",5400,"Anonymous 2579",2014-07-11,"https://www.en-net.org/question/1417.aspx",NA
"Announcements & Nutritionists needed","Vacancy - PDI Consultant - Save the Children Yemen",5717,"Nicki Connell",2014-07-09,"https://www.en-net.org/question/1416.aspx",NA
"Announcements & Nutritionists needed","A PSYCHOLOGIST - MENTAL HEALTH CARE PRACTICES TRAINER - KRG",4724,"Marie Lecuyer",2014-07-07,"https://www.en-net.org/question/1414.aspx",NA
"Announcements & Nutritionists needed","ACF is looking for a A DEPUTY NUTRITION CLUSTER COORDINATOR in Afghanistan",4817,"Marie Lecuyer",2014-07-04,"https://www.en-net.org/question/1413.aspx",NA
"Announcements & Nutritionists needed","ACF is looking for a A PSYCHOLOGIST - MENTAL HEALTH AND CARE PRACTICES EXPERT in Afghanistan",5401,"Marie Lecuyer",2014-07-04,"https://www.en-net.org/question/1412.aspx",NA
"Announcements & Nutritionists needed","**URGENT: YEMEN NUTRITION ADVISOR - SAVE THE CHILDREN**",5401,"Nicki Connell",2014-07-04,"https://www.en-net.org/question/1410.aspx",NA
"Announcements & Nutritionists needed","WFP looking for consultant for development of guidance document ‘Integration of Nutrition in VAA’",6448,"Katja",2014-07-04,"https://www.en-net.org/question/1409.aspx",NA
"Announcements & Nutritionists needed","ACF is looking for A FLYING MENTAL HEALTH AND CARE PRACTICES COORDINATOR",5097,"Marie Lecuyer",2014-07-02,"https://www.en-net.org/question/1408.aspx",NA
"Announcements & Nutritionists needed","ACF is looking for A NUTRITION AND HEALTH MONITORING AND EVALUATION PROGRAM MANAGER in Afghanistan",5133,"Marie Lecuyer",2014-07-02,"https://www.en-net.org/question/1407.aspx",NA
"Announcements & Nutritionists needed","IRC seeks a Nutrition Coordinator for Yemen (Sana'a)",5504,"Jeanette Bailey",2014-06-23,"https://www.en-net.org/question/1401.aspx",NA
"Announcements & Nutritionists needed","Save the Children International seeking 'Positive Deviance Inquiry' Consultant for Yemen",5398,"Nicki Connell",2014-06-16,"https://www.en-net.org/question/1394.aspx",NA
"Announcements & Nutritionists needed","ACF is looking for A PSYCHOLOGIST MENTAL HEALTH AND CARE PRACTICES COORDINATOR in JORDAN",4828,"Marie Lecuyer",2014-06-16,"https://www.en-net.org/question/1393.aspx",NA
"Announcements & Nutritionists needed","ACF is looking for a A NUTRITIONAL CAUSAL ANALYSIS EXPERT - AFGHANISTAN",5266,"Marie Lecuyer",2014-06-06,"https://www.en-net.org/question/1389.aspx",NA
