"Theme","Topic","Views","Author","Posted","Link","Replies"
"Management of small and nutritionally at risk infants under six months and their mothers (MAMI)","Recording low birth weight and considering it in SAM diagnosis of infants under 6 months",6557,"Tamsin Walters",2014-04-09,"https://www.en-net.org/question/1339.aspx",6
"Management of small and nutritionally at risk infants under six months and their mothers (MAMI)","Resources for management of acute malnutrition in infants less than 6 months",6212,"Tamsin Walters",2014-04-03,"https://www.en-net.org/question/1327.aspx",1
"Micronutrients","Protocal for MNP to Children",526,"Anonymous 3285",2021-02-24,"https://www.en-net.org/question/4214.aspx",1
"Micronutrients","Micronutrient Supplementation and Clinical Outcomes in Patients with Dengue Fever",835,"Mija Ververs",2020-12-01,"https://www.en-net.org/question/4142.aspx",0
"Micronutrients","I have a concern; do people continue to feed on bio fortified food after overcoming the dietary deficiency?",843,"Umbreen",2020-10-29,"https://www.en-net.org/question/4117.aspx",1
"Micronutrients","Videos on micronutrient interventions in the Middle East",1171,"Farah Asfahani",2020-04-24,"https://www.en-net.org/question/3964.aspx",1
"Micronutrients","WHO Micronutrients Database user survey",1887,"Lisa Rogers",2019-03-07,"https://www.en-net.org/question/3585.aspx",0
"Micronutrients","MNPs in emergency/humanitarian response",2491,"Anonymous 31905",2019-03-01,"https://www.en-net.org/question/3575.aspx",4
"Micronutrients","Scaling Up Rice Fortification in West Africa: Sight and Life and World Food Programme Supplement:",2113,"Jo Lofthouse",2018-12-19,"https://www.en-net.org/question/3517.aspx",0
"Micronutrients","thiamine dosing for infantile beriberi",2812,"Anonymous 28348",2018-10-25,"https://www.en-net.org/question/3479.aspx",1
"Micronutrients","How many kilos of fruit and veg does one person need per month to make a significant impact on their nutritional status?",3850,"Jude",2018-01-12,"https://www.en-net.org/question/3188.aspx",4
"Micronutrients","Demande pour du Matériel d'éducation nutritionnelle Carence en iode et iodation universelle du sel faible taux d'alphabétisation",4616,"Janny Goris",2017-11-30,"https://www.en-net.org/question/3152.aspx",4
"Micronutrients","Conception de projet pour améliorer IDDS et / ou MDD-W",5474,"Sabine Triemer",2017-09-19,"https://www.en-net.org/question/3055.aspx",7
"Micronutrients","Minimum Dietary diversity score and Minimum acceptable diet in areas with mass Micronutrient Supplementation",4691,"Ifeanyi Maduanusi",2017-08-16,"https://www.en-net.org/question/3029.aspx",1
"Micronutrients","Guidance around post emergency micronutrient supplementation",4866,"Hatty Barthorp",2017-06-21,"https://www.en-net.org/question/2970.aspx",4
"Micronutrients","Nutrients requirements for HIV infected adults",4362,"Edem",2017-05-27,"https://www.en-net.org/question/2942.aspx",0
"Micronutrients","Iron and folic acid (IFA) in pregnancy",4463,"Khyati",2017-04-19,"https://www.en-net.org/question/2896.aspx",3
"Micronutrients","Benefits of MNP over chewable MMN tablets",4655,"Anonymous 94",2017-04-06,"https://www.en-net.org/question/2884.aspx",1
"Micronutrients","MNPs for SAM Children in the absence of RUTF",4417,"Dr. Sajid Shafique",2016-12-02,"https://www.en-net.org/question/2756.aspx",2
"Micronutrients","Test kits for  micronutrients",4306,"Edem",2016-11-28,"https://www.en-net.org/question/2747.aspx",0
"Micronutrients","Contribute to Sphere handbook update",4340,"Marie McGrath",2016-09-30,"https://www.en-net.org/question/2668.aspx",0
"Micronutrients","vitamin A deficiency",4446,"Anonymous 3925",2016-09-20,"https://www.en-net.org/question/2645.aspx",1
"Micronutrients","Plumpy mum",6056,"COOPI",2016-08-22,"https://www.en-net.org/question/2602.aspx",7
"Micronutrients","26 April 2016 - Webinar on Weekly Iron and Folic Acid Supplementation of Adolescents in India",5119,"Thahira Shireen Mustafa",2016-04-19,"https://www.en-net.org/question/2459.aspx",0
"Micronutrients","Clustering of vitamin A deficiency in children",5015,"Mary Oyunga",2016-04-14,"https://www.en-net.org/question/2452.aspx",3
"Micronutrients","Information on available Micronutrient Powder for home fortification of meals available for the Syria response",5335,"Óscar Serrano Oria",2016-01-15,"https://www.en-net.org/question/2325.aspx",4
"Micronutrients","MNPs for children and sickle cell anaemia",7592,"Emily Mates",2015-10-29,"https://www.en-net.org/question/2233.aspx",7
"Micronutrients","Which age group to prioritize when limited MMN available",5218,"Anonymous 94",2015-09-01,"https://www.en-net.org/question/1908.aspx",2
"Micronutrients","Sprinkle Guidelines",5312,"Nick",2015-04-24,"https://www.en-net.org/question/1699.aspx",3
"Micronutrients","What are the effective micro-nutrient interventions for the prevention and control of micronutrient deficiency disorder (MDD) in emergency?",5236,"Anonymous 1310",2015-04-15,"https://www.en-net.org/question/1685.aspx",3
"Micronutrients","Micronutrient programmes for TB patients/PLWHA",4607,"Anonymous 2564",2015-03-02,"https://www.en-net.org/question/1638.aspx",0
"Micronutrients","Experiences providing multivitamins to children 6-59 months",5169,"Anonymous 2812",2015-02-06,"https://www.en-net.org/question/1611.aspx",1
"Micronutrients","Concurrent bSFP and MNPs for PLW?",5209,"Megan Gayford",2014-11-10,"https://www.en-net.org/question/1536.aspx",1
"Micronutrients","Vitamin A for preganant and lactating mothers(PLW)",4910,"Issack Yakub",2014-10-31,"https://www.en-net.org/question/1522.aspx",1
"Micronutrients","Iron/folic acid supplementation and sickle cell anemia",7806,"Anonymous 94",2014-10-27,"https://www.en-net.org/question/1518.aspx",3
"Micronutrients","Iron deficiency anaemia - what are the reasons behind differences in prevalence in different countries?",5423,"Tamsin Walters",2014-04-10,"https://www.en-net.org/question/1340.aspx",1
"Micronutrients","Vitamin D supplementation in infants",5969,"Marie McGrath",2014-03-25,"https://www.en-net.org/question/1315.aspx",2
"Micronutrients","Zinc supplementation for diarrhea treatment",6164,"Judith Haase",2014-03-05,"https://www.en-net.org/question/1291.aspx",7
"Micronutrients","Multi Micro Nutrient Supp & FeFolic Acid- PLW",5109,"Dr. W M Khan",2013-11-06,"https://www.en-net.org/question/1193.aspx",0
"Micronutrients","zinc status",5161,"caroline",2013-11-04,"https://www.en-net.org/question/1189.aspx",2
"Micronutrients","Is Folic Acid safe for malnourished children?",6491,"Mathias Grossiord",2013-02-12,"https://www.en-net.org/question/967.aspx",1
"Micronutrients","Micronutrients and Low Birth Weight - India",7207,"Dr. Ameya Bondre",2013-01-29,"https://www.en-net.org/question/961.aspx",7
"Micronutrients","HemoCue and Rapid Iodine Testing Kit procurement",5648,"Anonymous 1445",2012-09-20,"https://www.en-net.org/question/850.aspx",1
"Micronutrients","Hydrated Global Food Pack For All",5063,"Rosa Manson",2012-08-18,"https://www.en-net.org/question/818.aspx",0
"Micronutrients","Assessing Micronutrient Status",5498,"Leah Richardson",2012-07-24,"https://www.en-net.org/question/790.aspx",1
"Micronutrients","Upto what extend iron flour fortification can increase the Hb level of anemic adolescent women if iron fortified wheat flour is feed to these anemic adolescent women for 3 months?",8795,"Anonymous 635",2012-05-26,"https://www.en-net.org/question/742.aspx",15
"Micronutrients","methods for testing vitamin A status",6794,"Anonymous 879",2012-03-01,"https://www.en-net.org/question/662.aspx",3
"Micronutrients","RR of mortality by degree of anemia",5619,"Abel",2012-01-19,"https://www.en-net.org/question/619.aspx",2
"Micronutrients","multi-micronutrient sprinkles",6718,"REBECCA KATHAMBI",2012-01-18,"https://www.en-net.org/question/616.aspx",6
"Micronutrients","iron/folic acid supplements for women & children",5767,"Tamsin Walters",2011-08-24,"https://www.en-net.org/question/520.aspx",0
"Micronutrients","Vitamin A capsule program and acute malnutrition treatment",5722,"Benjamin Guesdon",2011-08-08,"https://www.en-net.org/question/507.aspx",0
"Micronutrients","legislation for anemia control",4989,"Anonymous 288",2011-06-01,"https://www.en-net.org/question/447.aspx",0
"Micronutrients","Why there is more push to commercial nutrient based supplements?",5226,"Anonymous 81",2011-05-02,"https://www.en-net.org/question/415.aspx",0
"Micronutrients","Deworming coverage/ impact survey",5025,"Anonymous 576",2011-04-04,"https://www.en-net.org/question/396.aspx",0
"Micronutrients","Benefit cost analysis and cost effectiveness studies of micronutrient interventions",5697,"Anonymous 467",2010-10-07,"https://www.en-net.org/question/278.aspx",1
"Micronutrients","Screening and Treatment protocols in Anaemia amongst adolescent girls",6370,"Suranjeen Prasad Pallipamula",2010-08-31,"https://www.en-net.org/question/251.aspx",1
"Micronutrients","What is the proper micronutrient composition for supplementation to promote catch up growth in stunted children?",6836,"Yunhee Kang",2010-04-17,"https://www.en-net.org/question/209.aspx",1
"Micronutrients","Sphere Project 2010: Consultation on the Revision of Micronutrient Indicators",7757,"Andrew Seal",2009-09-29,"https://www.en-net.org/question/142.aspx",2
"Partnerships for research","Acute malnutrition in Rural Communities of SSA",339,"Hannah Gibson",2021-04-14,"https://www.en-net.org/question/4272.aspx",0
"Partnerships for research","therapeutic causes and socio-demographic factors associated with relapse and delays in CMAM",1242,"Justin Mafuko",2020-02-22,"https://www.en-net.org/question/3862.aspx",0
"Partnerships for research","NON-PHARMACOLOGICAL MANAGEMENT OF HYPERTENSION",1084,"Shaibu Issifu",2020-02-19,"https://www.en-net.org/question/3857.aspx",0
"Partnerships for research","Questionnaire",1385,"Evelyn Breuer",2019-11-17,"https://www.en-net.org/question/3801.aspx",1
"Partnerships for research","Male influence on household nutrition status",2223,"Mugasha Edgar",2018-11-30,"https://www.en-net.org/question/3500.aspx",1
"Partnerships for research","Request for links and articles or host laboratory",2268,"Anonymous 3108",2018-07-30,"https://www.en-net.org/question/3398.aspx",0
"Partnerships for research","Research in WASH and Nutrition",3441,"Winnie Alando",2018-04-09,"https://www.en-net.org/question/3283.aspx",7
"Partnerships for research","Questions pour études de recherche dans le cadre de programmes PCMA et ANJE",3671,"AS",2017-11-14,"https://www.en-net.org/question/3117.aspx",2
"Partnerships for research","Recherche au niveau du district",3874,"Annabel",2017-10-31,"https://www.en-net.org/question/3102.aspx",2
"Partnerships for research","Information and documentation on the issue of Family Planning and Nutrition, the possible links.",4007,"Papin MIANTOM",2017-07-06,"https://www.en-net.org/question/2986.aspx",0
"Partnerships for research","IYCF- Syrian refugees in Lebanon",4373,"Layal",2017-06-13,"https://www.en-net.org/question/2959.aspx",3
"Partnerships for research","Documentation on management of nutritional inputs",4462,"BESSI Ernest MAHAMAT",2017-03-05,"https://www.en-net.org/question/2831.aspx",1
"Partnerships for research","Dear experts in nutrition, I am about to take a subject thesis for my PhD in nutrition choices and I have focused on the topic of Impact of overweight on Economic Development of Mali.",4120,"Abdul",2017-01-22,"https://www.en-net.org/question/2787.aspx",0
"Partnerships for research","Which is the most appropriate journal to publish my thesis work?",4234,"Alexander",2017-01-11,"https://www.en-net.org/question/2780.aspx",1
"Partnerships for research","MATERNAL AND CHILD NUTRITION",4079,"Maryam Abdulsalam",2016-10-27,"https://www.en-net.org/question/2702.aspx",0
"Partnerships for research","Looking for survey participants: “ Understanding the contextual factors enabling evidence-based decision making in disasters: Organisational contexts and other disaster related contexts”.",4848,"Bonnix Kayabu",2016-10-24,"https://www.en-net.org/question/2697.aspx",1
"Partnerships for research","Folic acid deficiency in mothers and incidence of NTDs in emergency",4463,"André BITA",2016-09-28,"https://www.en-net.org/question/2661.aspx",2
"Partnerships for research","Nutrition and NCDs",4869,"RABECCA BANDA MWEWA",2016-09-12,"https://www.en-net.org/question/2628.aspx",2
"Partnerships for research","Effects of sub optimal complementary feeding practices on anaemia of children 6 - 24 months old",4833,"FAISAL A. NURU-AHMED",2016-03-23,"https://www.en-net.org/question/2420.aspx",1
"Management of wasting/acute malnutrition","Is there a recommended ratio for Community Health Workers to cases?",195,"Heqian K",2021-07-05,"https://www.en-net.org/question/4353.aspx",2
"Management of wasting/acute malnutrition","CMAM protocols in Spanish",251,"Bushra",2021-07-01,"https://www.en-net.org/question/4347.aspx",5
"Management of wasting/acute malnutrition","Z-SCORE of OTP.",346,"MOHAMMED AL-OTHMANI",2021-06-22,"https://www.en-net.org/question/4338.aspx",3
"Management of wasting/acute malnutrition","Using specialized nutrition products for the management of wasting in older children.",348,"Anonymous 16058",2021-06-18,"https://www.en-net.org/question/4332.aspx",1
"Management of wasting/acute malnutrition","Programme adaptation in the absence of RUF - feedback on information note 1",338,"Paul",2021-06-13,"https://www.en-net.org/question/4324.aspx",0
"Management of wasting/acute malnutrition","New WHO RUTF guideline",428,"Tamsin Walters",2021-06-10,"https://www.en-net.org/question/4322.aspx",1
"Management of wasting/acute malnutrition","Acute malnutrition in Rural Communities of sub-Saharan Africa",258,"Hannah Gibson",2021-05-24,"https://www.en-net.org/question/4306.aspx",0
"Management of wasting/acute malnutrition","Launch of a private sector engagement and innovation survey for child wasting",434,"Polly Walker",2021-04-22,"https://www.en-net.org/question/4281.aspx",0
"Management of wasting/acute malnutrition","Cure rate of HIV positive patients with wasting/acute malnutrition",358,"Anonymous 32012",2021-04-20,"https://www.en-net.org/question/4276.aspx",1
"Management of wasting/acute malnutrition","Discharge procedure for TSFP Beneficiary",787,"Naema",2021-03-18,"https://www.en-net.org/question/4252.aspx",3
"Management of wasting/acute malnutrition","PESO IDEAL EN NIÑOS CON DEFECTO POR REDUCCION / Ideal weight in children with reduction defect",506,"Spencer Rivadeneira",2021-02-24,"https://www.en-net.org/question/4212.aspx",1
"Management of wasting/acute malnutrition","Examples of CMAM capacity mapping/assessment tools",611,"Tamsin Walters",2021-02-15,"https://www.en-net.org/question/4205.aspx",1
"Management of wasting/acute malnutrition","Break of international supply chain in F100, North_West Nigeria",609,"Coulibaly Zana",2021-02-04,"https://www.en-net.org/question/4197.aspx",3
"Management of wasting/acute malnutrition","Relationship between weight and MUAC",1043,"Issa",2021-02-04,"https://www.en-net.org/question/4196.aspx",5
"Management of wasting/acute malnutrition","F-100 or F-75 as an Alternate of RUTF",627,"Anonymous 739",2021-02-04,"https://www.en-net.org/question/4195.aspx",3
"Management of wasting/acute malnutrition","Resources for mapping the ""last mile"" supply chain for therapeutic food",794,"Lani Trenouth",2021-02-03,"https://www.en-net.org/question/4194.aspx",4
"Management of wasting/acute malnutrition","undernutrition and Gender",627,"Tammam Ahmed",2021-02-03,"https://www.en-net.org/question/4192.aspx",5
"Management of wasting/acute malnutrition","Family MUAC Strategy",951,"Dr Abdoulaye DIALLO",2021-01-08,"https://www.en-net.org/question/4176.aspx",7
"Management of wasting/acute malnutrition","Any protocols or training materials relating to PLW programming",731,"Emily Hockenhull",2021-01-07,"https://www.en-net.org/question/4175.aspx",2
"Management of wasting/acute malnutrition","Tools for country and facility level cMAMI preparedness assessments?",811,"Polly Walker",2021-01-06,"https://www.en-net.org/question/4173.aspx",4
"Management of wasting/acute malnutrition","Therapeutic food preparation",805,"Anonymous 3944",2020-12-19,"https://www.en-net.org/question/4165.aspx",3
"Management of wasting/acute malnutrition","Therapeutic food for MDR-TB and HIV patients",862,"Mhiret Teshome",2020-12-17,"https://www.en-net.org/question/4157.aspx",5
"Management of wasting/acute malnutrition","How to conduct a mortality audit in stabilisation centres?",919,"Tamsin Walters",2020-11-12,"https://www.en-net.org/question/4129.aspx",2
"Management of wasting/acute malnutrition","What are the estimated durations of untreated moderate wasting and severe wasting? Are they both still considered to be 7.5 months?",1892,"Anonymous 24408",2020-11-06,"https://www.en-net.org/question/4124.aspx",3
"Management of wasting/acute malnutrition","Emergency Nutrition trainer training kits or toolkit",847,"EMMANUEL KALUFENYE NGENGELE",2020-11-02,"https://www.en-net.org/question/4119.aspx",2
"Management of wasting/acute malnutrition","Seeking any evidence/experience of using RUTF to manage wasting in infants <6 months",725,"Natasha Lelijveld",2020-10-21,"https://www.en-net.org/question/4110.aspx",0
"Management of wasting/acute malnutrition","Does anyone have an Indicator reference guide with all details for acute malnutrition?",907,"Noreen M Mucha",2020-10-19,"https://www.en-net.org/question/4108.aspx",3
"Management of wasting/acute malnutrition","What is the ingredient ratio for the RUTF recipe? and machinery needs and costs",1013,"Alejandro Orendain",2020-09-30,"https://www.en-net.org/question/4097.aspx",1
"Management of wasting/acute malnutrition","App or programme to calculate weight gain (g/kg/day) at each OTP visit",1476,"Kirrily de Polnay",2020-09-21,"https://www.en-net.org/question/4088.aspx",6
"Management of wasting/acute malnutrition","Diarrhea and malnutrition",800,"Mbaye Diop",2020-08-25,"https://www.en-net.org/question/4068.aspx",0
"Management of wasting/acute malnutrition","Minimum flexible discharge criteria for inpatient SAM children",900,"Asfia Azim",2020-08-04,"https://www.en-net.org/question/4056.aspx",1
"Management of wasting/acute malnutrition","Sphere standard for Relapse after severe acute malnutrition - WHO",1365,"Joseph Duduka",2020-08-03,"https://www.en-net.org/question/4055.aspx",3
"Management of wasting/acute malnutrition","Inpatient Therapeutic Care (ITC)",912,"Sher Singh Dahit",2020-08-03,"https://www.en-net.org/question/4053.aspx",1
"Management of wasting/acute malnutrition","CHWs toolkit BCC material: does it also include IYCF counselling?",1005,"Anonymous 40368",2020-07-29,"https://www.en-net.org/question/4046.aspx",2
"Management of wasting/acute malnutrition","Non-compliance factors of Moderate Acute Malnutrition",772,"Anonymous 40366",2020-07-27,"https://www.en-net.org/question/4044.aspx",0
"Management of wasting/acute malnutrition","SAM in a child with ileostomy",1036,"Emma Cartmell",2020-06-22,"https://www.en-net.org/question/4017.aspx",2
"Management of wasting/acute malnutrition","Looking for current national and international SAM/CMAM/IMAM guidelines for study!",1287,"Magdalena Engl",2020-06-08,"https://www.en-net.org/question/4002.aspx",0
"Management of wasting/acute malnutrition","Do we need to reconsider the CMAM admission and discharge criteria?; an analysis of CMAM data in South Sudan",1444,"Anonymous 6714",2020-04-22,"https://www.en-net.org/question/3959.aspx",2
"Management of wasting/acute malnutrition","2018 UNICEF NutriDash data added to the State of Acute Malnutrition website",1349,"Abhilasha (Vini) Vaid",2020-04-20,"https://www.en-net.org/question/3951.aspx",0
"Management of wasting/acute malnutrition","I'm looking for assessment tools for evaluating an SC?",1159,"Colleen Thomas",2020-04-08,"https://www.en-net.org/question/3938.aspx",2
"Management of wasting/acute malnutrition","How can we treat a case, in the current conditions, when the parents aren't cooperating?",1079,"Baba cheikh.  ONG",2020-04-02,"https://www.en-net.org/question/3928.aspx",0
"Management of wasting/acute malnutrition","GAM Among OTP cured",1512,"Anonymous 5324",2020-03-11,"https://www.en-net.org/question/3874.aspx",6
"Management of wasting/acute malnutrition","Definition of ""clinically well"" for discharge from OTP",2666,"Anonymous 31905",2020-03-06,"https://www.en-net.org/question/3872.aspx",1
"Management of wasting/acute malnutrition","MAM recovery criteria?",1559,"Anonymous 39645",2020-03-03,"https://www.en-net.org/question/3869.aspx",3
"Management of wasting/acute malnutrition","RUTF and iron supplementation",1607,"Spencer Rivadeneira",2020-02-28,"https://www.en-net.org/question/3868.aspx",2
"Management of wasting/acute malnutrition","Modified RUTF",1212,"Spencer Rivadeneira",2020-02-22,"https://www.en-net.org/question/3863.aspx",0
"Management of wasting/acute malnutrition","NOn Responder.",1406,"Mohammed Mudarrifu",2020-02-21,"https://www.en-net.org/question/3858.aspx",2
"Management of wasting/acute malnutrition","Bonjour. Je suis nutritionniste exerçant au Cameroun et j'aimerais avoir le protocole nationale de prise en charge de la malnutrition aiguë au Cameroun, cela m'aiderais dans mon travail. Voici mon email poueneyoungaem@yahoo.fr. merci d'avance",1369,"Pouene",2020-02-05,"https://www.en-net.org/question/3845.aspx",0
"Management of wasting/acute malnutrition","OTPs affecting SAM prevalence....",1385,"Anonymous 16058",2020-02-03,"https://www.en-net.org/question/3843.aspx",2
"Management of wasting/acute malnutrition","Toolkit request or physiopathology training module for acute malnutrition",1706,"EMMANUEL KALUFENYE NGENGELE",2019-11-21,"https://www.en-net.org/question/3802.aspx",1
"Management of wasting/acute malnutrition","RELACION PERIMETRO BRAQUIAL, P/T Y COMORBILIDAD: TRATAMIENTO",2491,"Spencer Rivadeneira",2019-09-30,"https://www.en-net.org/question/3773.aspx",8
"Management of wasting/acute malnutrition","Treatment of SAM for children with Thalassemia.",1734,"Brooke",2019-09-26,"https://www.en-net.org/question/3770.aspx",1
"Management of wasting/acute malnutrition","A new publication on efficacy of RUTF reduced dose in Burkina in PLoS Med",1901,"Cécile Salpéteur",2019-09-06,"https://www.en-net.org/question/3751.aspx",2
"Management of wasting/acute malnutrition","OTP - Reduced frequency of visits in insecure areas or non-functioning health system",1673,"Anonymous 32524",2019-08-28,"https://www.en-net.org/question/3739.aspx",4
"Management of wasting/acute malnutrition","Summary of cost per child treated and cost per child recovered",2264,"Lani Trenouth",2019-08-21,"https://www.en-net.org/question/3732.aspx",8
"Management of wasting/acute malnutrition","Where can I find data on death, default and cure rates from as many CMAM programmes globally?",2134,"Anonymous 33202",2019-08-07,"https://www.en-net.org/question/3728.aspx",4
"Management of wasting/acute malnutrition","Counting of PLW admitted to TSFP",1839,"Stephen",2019-08-01,"https://www.en-net.org/question/3725.aspx",2
"Management of wasting/acute malnutrition","RUTF stuck in a closed container over 90 days, is this safe to use?",1730,"Anonymous 748",2019-07-24,"https://www.en-net.org/question/3722.aspx",3
"Management of wasting/acute malnutrition","Home-made rehydration solution for the management of diarrhea",1921,"Edem",2019-07-20,"https://www.en-net.org/question/3720.aspx",3
"Management of wasting/acute malnutrition","How to manage a SAM inpatient case with F75 intolerance",1999,"Charity",2019-06-20,"https://www.en-net.org/question/3705.aspx",4
"Management of wasting/acute malnutrition","OTP Discharge Criteria in CMAM programme",1795,"Lovely Amin",2019-06-12,"https://www.en-net.org/question/3695.aspx",1
"Management of wasting/acute malnutrition","Coping strategy for use of RUTF",2490,"Anonymous 3258",2019-06-11,"https://www.en-net.org/question/3692.aspx",7
"Management of wasting/acute malnutrition","Iron folic acid supplementation in MAM children in SFP",2888,"Anonymous 32524",2019-06-07,"https://www.en-net.org/question/3689.aspx",2
"Management of wasting/acute malnutrition","Association between treatment outcome and length of stay",1742,"Anonymous 3800",2019-06-05,"https://www.en-net.org/question/3682.aspx",3
"Management of wasting/acute malnutrition","Routine antibiotics in community management of SAM",1881,"Spencer Rivadeneira",2019-05-29,"https://www.en-net.org/question/3676.aspx",1
"Management of wasting/acute malnutrition","RUSF and RUTF - malnourished PLW",2746,"Anonymous 24408",2019-05-24,"https://www.en-net.org/question/3667.aspx",5
"Management of wasting/acute malnutrition","studies regarding relationship between the age of the mother and child acute undernutrition incidence",1874,"Ana María García",2019-05-16,"https://www.en-net.org/question/3662.aspx",1
"Management of wasting/acute malnutrition","RUTF - SAM treatment",2136,"Anonymous 24408",2019-05-15,"https://www.en-net.org/question/3660.aspx",3
"Management of wasting/acute malnutrition","Call for input to 'Making nutrition an integral part of Universal Health Coverage' Tokyo 2020",1701,"Tamsin Walters",2019-05-10,"https://www.en-net.org/question/3645.aspx",0
"Management of wasting/acute malnutrition","The new Therapeutic milk",2070,"Desalegn",2019-05-02,"https://www.en-net.org/question/3638.aspx",2
"Management of wasting/acute malnutrition","MUAC vs W/H",2838,"Anonymous 24408",2019-04-28,"https://www.en-net.org/question/3632.aspx",6
"Management of wasting/acute malnutrition","The Harmonized Training Package (HTP): Resource Material for Training on Nutrition in Emergencies (in French)",2338,"EMMANUEL KALUFENYE NGENGELE",2019-04-24,"https://www.en-net.org/question/3629.aspx",5
"Management of wasting/acute malnutrition","Allergic Reactions to RUTF",2526,"Andrew",2019-04-23,"https://www.en-net.org/question/3627.aspx",6
