"Theme","Topic","Views","Author","Posted","Link","Replies"
"Announcements & Nutritionists needed","Medair is Recruiting for Nutrition Managers",78,"Mark Hawkes",2021-03-22,"https://www.en-net.org/question/4262.aspx",NA
"Announcements & Nutritionists needed","Medair is Recruiting for a Nutrition Project Manager in South Sudan, Renk",49,"Mark Hawkes",2021-03-22,"https://www.en-net.org/question/4261.aspx",NA
"Announcements & Nutritionists needed","Medair is Recruiting for a Nutrition Project Manager in South Sudan, Leer",69,"Mark Hawkes",2021-03-22,"https://www.en-net.org/question/4260.aspx",NA
"Announcements & Nutritionists needed","Medair is Recruiting for a Health & Nutrition Advisor in Yemen",73,"Mark Hawkes",2021-03-19,"https://www.en-net.org/question/4259.aspx",NA
"Announcements & Nutritionists needed","Medair is Recruiting for a Health & Nutrition Advisor in Syria",51,"Mark Hawkes",2021-03-19,"https://www.en-net.org/question/4258.aspx",NA
"Announcements & Nutritionists needed","Vacancy: Field Exchange Sub-Editor and Content Coordinator",100,"Office ENN",2021-03-19,"https://www.en-net.org/question/4257.aspx",NA
"Announcements & Nutritionists needed","Vacancy: Regional nutritionist - Nairobi",167,"Els Dehantschutter",2021-03-18,"https://www.en-net.org/question/4256.aspx",NA
"Announcements & Nutritionists needed","Alive & Thrive seeks a MIYCN Technical Advisor for Africa!",188,"Nathalie Likhite",2021-03-11,"https://www.en-net.org/question/4246.aspx",NA
"Announcements & Nutritionists needed","Consultancy - A Nutrition specialist for SMART / SENS nutrition survey for Chad",293,"Terry Theuri",2021-03-11,"https://www.en-net.org/question/4245.aspx",NA
"Announcements & Nutritionists needed","Humanitarian Nutrition Adviser",228,"A Beckingham",2021-03-08,"https://www.en-net.org/question/4236.aspx",NA
"Announcements & Nutritionists needed","Opportunity: Exhibition Booths and 'NED Talks' - CMAM Conference",142,"Jessica Worsdale",2021-03-02,"https://www.en-net.org/question/4224.aspx",NA
"Announcements & Nutritionists needed","Questionnaire on COVID's impact on nutrition and food security - COVID-19",483,"Fabian",2021-03-02,"https://www.en-net.org/question/4218.aspx",NA
"Announcements & Nutritionists needed","Priorities for guidelines on management of child obesity",162,"Tamsin Walters",2021-02-25,"https://www.en-net.org/question/4217.aspx",NA
"Announcements & Nutritionists needed","Nutrition Science Program Manager Needed",272,"Megan Bourassa",2021-02-22,"https://www.en-net.org/question/4211.aspx",NA
"Announcements & Nutritionists needed","Nutrition Consultant REF: ANT-M&E-24208",322,"Adem Ozgun",2021-02-22,"https://www.en-net.org/question/4210.aspx",NA
"Announcements & Nutritionists needed","Virtual CMAM conference 22-25 March",320,"Tamsin Walters",2021-02-18,"https://www.en-net.org/question/4209.aspx",NA
"Announcements & Nutritionists needed","MAMI Global Network Coordinator (Maternity cover)",226,"Office ENN",2021-02-17,"https://www.en-net.org/question/4208.aspx",NA
"Announcements & Nutritionists needed","Two funded PhD opportunities within “Edinburgh Neuroscience”, to be based in Malawi",733,"Tamsin Walters",2021-02-15,"https://www.en-net.org/question/4204.aspx",NA
"Announcements & Nutritionists needed","Present your agriculture/food systems/nutrition research at our upcoming ANH2021 conference",738,"Sylvia Levy",2021-02-09,"https://www.en-net.org/question/4201.aspx",NA
"Announcements & Nutritionists needed","Deputy Head of Nutrition needed at Action Against Hunger UK",318,"Alexandra Rutishauser-Perera",2021-02-06,"https://www.en-net.org/question/4200.aspx",NA
"Announcements & Nutritionists needed","National Project Coordinator for a Nutrition related project in Laos",347,"Tatiana Gheorghiu",2021-02-05,"https://www.en-net.org/question/4199.aspx",NA
"Announcements & Nutritionists needed","Institutional Capacity Building Expert/ Food & Nutrition Security in Laos",628,"Tatiana Gheorghiu",2021-02-05,"https://www.en-net.org/question/4198.aspx",NA
"Announcements & Nutritionists needed","New Funding Opportunity for Local Organizations in Burkina Faso | Request for Applications",513,"Katie Beck",2021-01-22,"https://www.en-net.org/question/4185.aspx",NA
"Announcements & Nutritionists needed","Vacancy - remote consultancy for a nutritionist with experience in developing SBCC materials",2143,"Anonymous 40530",2021-01-13,"https://www.en-net.org/question/4181.aspx",NA
"Announcements & Nutritionists needed","REACH Initiative is looking for a Nutrition Assessment Officer in Nigeria",457,"Saeed Rahman",2021-01-09,"https://www.en-net.org/question/4177.aspx",NA
"Announcements & Nutritionists needed","New Funding Opportunity for Local Organizations in Kenya | Request for Applications",369,"Katie Beck",2021-01-06,"https://www.en-net.org/question/4174.aspx",NA
"Announcements & Nutritionists needed","Event: How and why do people make food choices? Join us 14 Jan for the 1st webinar in our new series",370,"Sylvia Levy",2021-01-05,"https://www.en-net.org/question/4172.aspx",NA
"Announcements & Nutritionists needed","TASC is looking for consultants to ""Reaching the most marginalized""",390,"Rita Abi Akar",2021-01-05,"https://www.en-net.org/question/4171.aspx",NA
"Announcements & Nutritionists needed","ENN is recruiting a Finance Manager",452,"Office ENN",2020-12-23,"https://www.en-net.org/question/4167.aspx",NA
"Announcements & Nutritionists needed","Call for abstracts - MSF Paediatric Days",421,"Tamsin Walters",2020-12-18,"https://www.en-net.org/question/4164.aspx",NA
"Announcements & Nutritionists needed","ENN is searching for three new Trustees",455,"Office ENN",2020-12-18,"https://www.en-net.org/question/4163.aspx",NA
"Announcements & Nutritionists needed","Vacancy - Nutrition Coordinator - Syria, based in Amman",668,"Valentina Coniglio",2020-12-11,"https://www.en-net.org/question/4156.aspx",NA
"Announcements & Nutritionists needed","Ag-nutrition Funding Opportunity: IMMANA Grants Round 4",484,"Sylvia Levy",2020-12-11,"https://www.en-net.org/question/4155.aspx",NA
"Announcements & Nutritionists needed","ENN is recruiting a Project Manager - CLOSED",509,"Office ENN",2020-12-11,"https://www.en-net.org/question/4154.aspx",NA
"Announcements & Nutritionists needed","Invite to online update meeting on MAMI Ethiopia research programme",843,"Office ENN",2020-12-09,"https://www.en-net.org/question/4152.aspx",NA
"Announcements & Nutritionists needed","IYCF project UNHCR - Call for expression of Interest",538,"Valerie Belchior-Bellino",2020-12-08,"https://www.en-net.org/question/4151.aspx",NA
"Announcements & Nutritionists needed","REACH Initiative is looking for a Nutrition Assessment Officer for South Sudan",601,"Saeed Rahman",2020-12-06,"https://www.en-net.org/question/4148.aspx",NA
"Announcements & Nutritionists needed","IRC is hiring a Senior Health and Nutrition Coordinator in Yemen",617,"Casie Tesfai",2020-12-02,"https://www.en-net.org/question/4144.aspx",NA
"Announcements & Nutritionists needed","You are warmly invited to the GNC Technical Alliance official launch webinar!",465,"Ben Allen",2020-11-27,"https://www.en-net.org/question/4139.aspx",NA
"Announcements & Nutritionists needed","Link NCA Newsletter + Methodological review",1008,"Lenka Blanarova",2020-11-16,"https://www.en-net.org/question/4132.aspx",NA
"Announcements & Nutritionists needed","Contact of experts in nutrition mentorship/coaching programme development",1201,"Marlene Hebie",2020-11-12,"https://www.en-net.org/question/4130.aspx",NA
"Announcements & Nutritionists needed","Somalia Maternal Nutrition Action Plan- International Consultant Needed",561,"Ciara",2020-11-01,"https://www.en-net.org/question/4118.aspx",NA
"Announcements & Nutritionists needed","Recruiting Consultant to conduct a Maternal New-born and Child Health and Nutrition (MNCHN) Systems Assessment",633,"Marlene",2020-10-26,"https://www.en-net.org/question/4115.aspx",NA
"Announcements & Nutritionists needed","Global Nutrition Cluster is looking for a homebased  Inter-Sectoral Collaboration Helpdesk Consultant",642,"Global Nutrition Cluster",2020-10-22,"https://www.en-net.org/question/4114.aspx",NA
"Announcements & Nutritionists needed","ENN is recruiting a Project Officer",681,"Office ENN",2020-10-22,"https://www.en-net.org/question/4112.aspx",NA
"Announcements & Nutritionists needed","The Technical Rapid Response Team is looking for a senior nutrition consultant to support the development of a new National Nutrition Strategy in Vietnam.",707,"Office ENN",2020-10-19,"https://www.en-net.org/question/4107.aspx",NA
"Announcements & Nutritionists needed","Technical series on the conceptual framework for addressing acute malnutrition in Africa’s drylands",589,"Anne Radday",2020-10-14,"https://www.en-net.org/question/4106.aspx",NA
"Announcements & Nutritionists needed","CONCERN WORLDWIDE - Global CMAM Surge Advisor - Flexible Location",974,"Concern Worldwide",2020-10-08,"https://www.en-net.org/question/4102.aspx",NA
"Announcements & Nutritionists needed","Sr. Technical Advisor, Nutrition - Team Lead Open Postion at CRS",837,"Anonymous 40438",2020-10-05,"https://www.en-net.org/question/4100.aspx",NA
"Announcements & Nutritionists needed","Job Opportunity: Research Fellow or Assistant Professor",740,"Abel Endashaw",2020-09-29,"https://www.en-net.org/question/4095.aspx",NA
"Announcements & Nutritionists needed","Webinar Series on Kwashiorkor",819,"Alexandra Rutishauser-Perera",2020-09-21,"https://www.en-net.org/question/4089.aspx",NA
"Announcements & Nutritionists needed","Save the Children looking for a Nutritionist to lead module development and delivery of a joint IYCF and CASH training programme alongside technical experts within the organisation",1398,"Paul Rees-Thomas",2020-09-18,"https://www.en-net.org/question/4087.aspx",NA
"Announcements & Nutritionists needed","Consulting opportunity to provide technical assistance to the Government of Pakistan to formulate that National Food Fortification Act and Rules of Business",644,"Nutrition International - NTEAM",2020-09-16,"https://www.en-net.org/question/4083.aspx",NA
"Announcements & Nutritionists needed","Nutrition Advisor",885,"Concern Worldwide",2020-09-15,"https://www.en-net.org/question/4082.aspx",NA
"Announcements & Nutritionists needed","WHO seeks a consultant to support the wasting guideline development process",598,"Tamsin Walters",2020-09-15,"https://www.en-net.org/question/4081.aspx",NA
"Announcements & Nutritionists needed","Call for authors - Scoping review for WHO guideline on the prevention and treatment of wasting in infants and children",745,"Tamsin Walters",2020-09-15,"https://www.en-net.org/question/4080.aspx",NA
"Announcements & Nutritionists needed","Recruiting consultant to support the assessment of nutritional biomarkers in Senegal",658,"Nutrition International - NTEAM",2020-09-01,"https://www.en-net.org/question/4074.aspx",NA
"Announcements & Nutritionists needed","Recruiting five consultants to undertake assessments of technical assistance delivered under NTEAM’s TAN project  in Kenya, Ethiopia, Mozambique, Pakistan and Bangladesh",1256,"Nutrition International - NTEAM",2020-09-01,"https://www.en-net.org/question/4073.aspx",NA
"Announcements & Nutritionists needed","ENN seeking two Senior Technical Associates",633,"Office ENN",2020-08-28,"https://www.en-net.org/question/4070.aspx",NA
"Announcements & Nutritionists needed","GNR seeking Programme Manager",654,"Nathalie Willmott",2020-08-24,"https://www.en-net.org/question/4067.aspx",NA
"Announcements & Nutritionists needed","Official launch of the GNC/GTAM guidance on the cash and voucher assistance for NiE",832,"Office ENN",2020-08-17,"https://www.en-net.org/question/4064.aspx",NA
"Announcements & Nutritionists needed","ENN seeking an External Evaluator",778,"Office ENN",2020-08-05,"https://www.en-net.org/question/4057.aspx",NA
"Announcements & Nutritionists needed","Senior Nutrition Scientist - GNR",933,"Nathalie Willmott",2020-07-24,"https://www.en-net.org/question/4042.aspx",NA
"Announcements & Nutritionists needed","Knowledge Management & Evidence Generation Consultant, UNICEF, West and Central Africa Regional Office",668,"John Ntambi",2020-07-19,"https://www.en-net.org/question/4036.aspx",NA
"Announcements & Nutritionists needed","experienced H&N programme managers and specialists for 12-month contract or short-term remote support (staff or consultant)",1146,"Yvonne McNulty",2020-07-14,"https://www.en-net.org/question/4034.aspx",NA
"Announcements & Nutritionists needed","Nutrition Adviser Concern Worldwide (Bangladesh)",882,"Sajia Mehjabeen",2020-07-09,"https://www.en-net.org/question/4029.aspx",NA
"Announcements & Nutritionists needed","Consultancy opportunity to provide technical assistance to support Implementation of a Regional Nutrition Knowledge Sharing Platform for the East, Central and Southern Africa Health Community (ECSA-HC)",1238,"Nutrition International - NTEAM",2020-07-09,"https://www.en-net.org/question/4028.aspx",NA
"Announcements & Nutritionists needed","Consulting opportunity to provide technical assistance to the Government of Pakistan to formulate that National Food Fortification Act and Rules of Business",626,"Nutrition International - NTEAM",2020-07-09,"https://www.en-net.org/question/4027.aspx",NA
"Announcements & Nutritionists needed","30th June ENN Webinar: FEX 60/ GAP on child wasting",855,"Tamsin Walters",2020-06-26,"https://www.en-net.org/question/4022.aspx",NA
"Announcements & Nutritionists needed","ENN Senior Nutritionist – Fixed Term Contract",1226,"Office ENN",2020-06-18,"https://www.en-net.org/question/4010.aspx",NA
"Announcements & Nutritionists needed","Survey Team Leader - Provision of services for RAM/SMART survey comparison study",896,"Philip McKinney",2020-06-12,"https://www.en-net.org/question/4007.aspx",NA
"Announcements & Nutritionists needed","GTAM website",826,"Natalie Sessions",2020-06-09,"https://www.en-net.org/question/4004.aspx",NA
"Announcements & Nutritionists needed","ENN: MAMI Global Network Coordinator – Fixed Term Contract, Competitive package",1398,"Office ENN",2020-06-03,"https://www.en-net.org/question/3999.aspx",NA
"Announcements & Nutritionists needed","Webinar: Power and priorities: equitable partnerships in Agriculture, Nutrition and Health research",1556,"Abel Endashaw",2020-05-29,"https://www.en-net.org/question/3997.aspx",NA
"Announcements & Nutritionists needed","ANH2020",797,"Abel Endashaw",2020-05-28,"https://www.en-net.org/question/3996.aspx",NA
"Announcements & Nutritionists needed","Consulting opportunity to support implementation of a regional nutrition knowledge sharing platform",1064,"Nutrition International - NTEAM",2020-05-27,"https://www.en-net.org/question/3993.aspx",NA
"Announcements & Nutritionists needed","Adolescent nutrition mapping exercise - online survey",1091,"Tamsin Walters",2020-05-15,"https://www.en-net.org/question/3983.aspx",NA
"Announcements & Nutritionists needed","Coordinateur/trice Nutrition - Niger",930,"COOPI - Cooperazione Internazionale",2020-05-08,"https://www.en-net.org/question/3980.aspx",NA
"Announcements & Nutritionists needed","UNHCR: Senior Nutrition Officer, P4, Geneva",1232,"Anonymous 40",2020-05-06,"https://www.en-net.org/question/3978.aspx",NA
"Announcements & Nutritionists needed","Nutrition Coordinator - DRC",1114,"COOPI - Cooperazione Internazionale",2020-05-06,"https://www.en-net.org/question/3974.aspx",NA
"Announcements & Nutritionists needed","ENN is looking for a Treasurer",889,"Office ENN",2020-04-21,"https://www.en-net.org/question/3955.aspx",NA
"Announcements & Nutritionists needed","CORTASAM launches Landscape Review on completed, ongoing, and planned research in their priority research areas for acute malnutrition",889,"Abhilasha (Vini) Vaid",2020-04-21,"https://www.en-net.org/question/3954.aspx",NA
"Announcements & Nutritionists needed","Freelance translators (nutrition experience) needed",1431,"Office ENN",2020-04-21,"https://www.en-net.org/question/3953.aspx",NA
"Announcements & Nutritionists needed","Job: Agricultural Livelihoods & Markets Advisor for humanitarian contexts",825,"Charlotte Block",2020-04-16,"https://www.en-net.org/question/3947.aspx",NA
"Announcements & Nutritionists needed","ENN is recruiting a Project Manager and Project Officer",1668,"Office ENN",2020-04-14,"https://www.en-net.org/question/3945.aspx",NA
"Announcements & Nutritionists needed","Technical Advisor Vacancy - Humanitarian and Nutrition Programs (Save the Children US / USAID Advancing Nutrition)",1233,"Sarah (Butler) O'Flynn",2020-04-02,"https://www.en-net.org/question/3924.aspx",NA
"Announcements & Nutritionists needed","Webinar Thursday 26th March - Strengthening the Humanitarian-Development Nexus for Nutrition in Protracted Crises",1332,"Tamsin Walters",2020-03-23,"https://www.en-net.org/question/3902.aspx",NA
"Announcements & Nutritionists needed","Nutriton Adviser Concern Worldwide (HQ)",1164,"Regine Kopplow",2020-03-23,"https://www.en-net.org/question/3898.aspx",NA
"Announcements & Nutritionists needed","Nutrition Cluster Co-Coordinator for International Medical Corps in South Sudan",1068,"Iris Bollemeijer",2020-03-23,"https://www.en-net.org/question/3897.aspx",NA
"Announcements & Nutritionists needed","2 consultancy opportunities - home based with travels",1269,"Barbara",2020-03-21,"https://www.en-net.org/question/3894.aspx",NA
"Announcements & Nutritionists needed","Emergency Nutrition Advisor Vacancy (Save the Children US)",956,"Sarah (Butler) O'Flynn",2020-03-20,"https://www.en-net.org/question/3893.aspx",NA
"Announcements & Nutritionists needed","Consulting opportunity in Punjab, Pakistan",874,"Nutrition International - NTEAM",2020-03-20,"https://www.en-net.org/question/3891.aspx",NA
"Announcements & Nutritionists needed","CORTASAM launches Landscape Review on completed, ongoing, and planned research in their priority research areas for acute malnutrition",988,"Abhilasha (Vini) Vaid",2020-03-17,"https://www.en-net.org/question/3887.aspx",NA
"Announcements & Nutritionists needed","GTAM brief on COVID19 for the nutrition sector",1422,"Tamsin Walters",2020-03-17,"https://www.en-net.org/question/3886.aspx",NA
"Announcements & Nutritionists needed","UNHCR looking for a Nutrition SMART SENS Survey Specialist for Southern Chad and lakes region - Consultancy",906,"Anonymous 40",2020-03-17,"https://www.en-net.org/question/3885.aspx",NA
"Announcements & Nutritionists needed","UNHCR looking for a Nutrition SMART SENS Survey Specialist for Eastern Chad - Consultancy",890,"Anonymous 40",2020-03-17,"https://www.en-net.org/question/3884.aspx",NA
"Announcements & Nutritionists needed","Tech RRT is looking for a Program Officer to join the team!",1093,"Ben Allen",2020-03-16,"https://www.en-net.org/question/3883.aspx",NA
"Announcements & Nutritionists needed","Nutrition International issues special TAN update on the SUN Global Gathering",955,"Nutrition International - NTEAM",2020-03-16,"https://www.en-net.org/question/3882.aspx",NA
"Announcements & Nutritionists needed","Nutrition Specialist, UNICEF Afghanistan",962,"Suzanne Fuhrman",2020-03-16,"https://www.en-net.org/question/3881.aspx",NA
"Announcements & Nutritionists needed","Programme Manager Nutrition - Concern DRC",1169,"Regine Kopplow",2020-03-12,"https://www.en-net.org/question/3877.aspx",NA
"Announcements & Nutritionists needed","Programme Officer Nutrition - Concern DRC",1142,"Regine Kopplow",2020-03-12,"https://www.en-net.org/question/3876.aspx",NA
"Announcements & Nutritionists needed","Job opportunity: Senior Nutrition Research Coordinator (francophone)",968,"Bethany Marron",2020-03-11,"https://www.en-net.org/question/3875.aspx",NA
"Announcements & Nutritionists needed","Multi-sector nutrition programming webinar 19th March",1406,"Tamsin Walters",2020-03-04,"https://www.en-net.org/question/3871.aspx",NA
"Announcements & Nutritionists needed","USAID Advancing Nutrition Call for Consultant for Food Assistance Modalities",1023,"Collin Anderson",2020-02-26,"https://www.en-net.org/question/3866.aspx",NA
"Announcements & Nutritionists needed","Job Opportunity: Senior Nutrition Governance & Systems Reform Specialist",1006,"The Power of Nutrition",2020-02-26,"https://www.en-net.org/question/3865.aspx",NA
"Announcements & Nutritionists needed","Maternity Cover (12 months): Associate Director, Technical Development with Action Against Hunger UK",947,"Amy Mayberry",2020-02-21,"https://www.en-net.org/question/3860.aspx",NA
"Announcements & Nutritionists needed","Nutrition Advisor for International Medical Corps - Global",1305,"Iris Bollemeijer",2020-02-21,"https://www.en-net.org/question/3859.aspx",NA
"Announcements & Nutritionists needed","JOB OPENING: Nutrition Manager, Medair",1085,"Anonymous 39031",2020-02-13,"https://www.en-net.org/question/3851.aspx",NA
"Announcements & Nutritionists needed","JOB OPENING: Health and Nutrition Advisor, Medair",1026,"Anonymous 39031",2020-02-13,"https://www.en-net.org/question/3850.aspx",NA
"Announcements & Nutritionists needed","JOB OPENING: Health and Nutrition Advisor, Medair",918,"Anonymous 39031",2020-02-13,"https://www.en-net.org/question/3849.aspx",NA
"Announcements & Nutritionists needed","WFP is looking for Nutrition in Emergency specialist",1362,"Anonymous 31995",2020-02-11,"https://www.en-net.org/question/3847.aspx",NA
"Announcements & Nutritionists needed","Online public consultation - Draft of the Global Action Plan (GAP) on child wasting",1749,"Tamsin Walters",2020-01-31,"https://www.en-net.org/question/3842.aspx",NA
"Announcements & Nutritionists needed","Scope of Work Lead Facilitation Consultant DRC",898,"Anonymous 37229",2020-01-29,"https://www.en-net.org/question/3839.aspx",NA
"Announcements & Nutritionists needed","Consultancy UNICEF: Project Manager, Demand & Supply Information System,",1009,"Rie Hoffmann",2020-01-27,"https://www.en-net.org/question/3838.aspx",NA
"Announcements & Nutritionists needed","Stakeholder Engagement Consultant, Democratic Republic of Congo (DRC)",962,"Anonymous 37229",2020-01-23,"https://www.en-net.org/question/3836.aspx",NA
"Announcements & Nutritionists needed","Consultant for the Evaluation of the Global Hunger Index (m/f)",1184,"Regine Kopplow",2020-01-19,"https://www.en-net.org/question/3833.aspx",NA
"Announcements & Nutritionists needed","Tender for Facilitation Services in support of SUN ExCom Strategic Review",1234,"Marie McGrath",2020-01-09,"https://www.en-net.org/question/3827.aspx",NA
"Announcements & Nutritionists needed","Job Opportunity: Food Ration Basket Assessment Consultant",1262,"Anonymous 37229",2019-12-27,"https://www.en-net.org/question/3826.aspx",NA
"Announcements & Nutritionists needed","JOB OPPORTUNITY:  Tenure-track Assistant or Associate Professor of Global Health (Humanitarian Health)",1783,"Erina Moriarty",2019-12-18,"https://www.en-net.org/question/3824.aspx",NA
"Announcements & Nutritionists needed","ENN seeks Project Officer",1834,"Tamsin Walters",2019-12-16,"https://www.en-net.org/question/3823.aspx",NA
"Announcements & Nutritionists needed","December 12th - Devex Digital Panel on Scaling Nutrition: Advancing the Conversation",1386,"Nicki Connell",2019-12-11,"https://www.en-net.org/question/3821.aspx",NA
"Announcements & Nutritionists needed","Webinar: The cost and affordability of EAT–Lancet reference diet",1301,"Abel Endashaw",2019-12-02,"https://www.en-net.org/question/3815.aspx",NA
"Announcements & Nutritionists needed","Technical Assistance Opportunity in Indonesia",1247,"Nutrition International - NTEAM",2019-11-29,"https://www.en-net.org/question/3813.aspx",NA
"Announcements & Nutritionists needed","Technical Assistance Opportunity in Ethiopia",1224,"Nutrition International - NTEAM",2019-11-29,"https://www.en-net.org/question/3812.aspx",NA
"Announcements & Nutritionists needed","Job Opportunity: Research Uptake Manager",1228,"Abel Endashaw",2019-11-29,"https://www.en-net.org/question/3811.aspx",NA
"Announcements & Nutritionists needed","Job Opportunity: IMMANA Communications Officer",1073,"Abel Endashaw",2019-11-29,"https://www.en-net.org/question/3810.aspx",NA
"Announcements & Nutritionists needed","Job Opportunity: Research Fellow in Agriculture-Food Systems for Nutrition",1138,"Abel Endashaw",2019-11-29,"https://www.en-net.org/question/3809.aspx",NA
"Announcements & Nutritionists needed","Panel discussion 5th December: Influence or information? Advertising & healthcare professionals",3705,"Tamsin Walters",2019-11-26,"https://www.en-net.org/question/3807.aspx",NA
"Announcements & Nutritionists needed","Suaahara II evaluation: two international consultancy positions open",1211,"Tamsin Walters",2019-11-25,"https://www.en-net.org/question/3806.aspx",NA
"Announcements & Nutritionists needed","Job Opportunity: Junior and Senior staff positions in OPM's Nutrition Team",2059,"Aly Visram",2019-11-15,"https://www.en-net.org/question/3798.aspx",NA
"Announcements & Nutritionists needed","IYCF project UNHCR - Call for expression of Interest",1399,"Anonymous 40",2019-11-15,"https://www.en-net.org/question/3797.aspx",NA
"Announcements & Nutritionists needed","Sr TSFP Coordinator - Nutrition",1504,"Anonymous 35924",2019-11-11,"https://www.en-net.org/question/3796.aspx",NA
"Announcements & Nutritionists needed","WFP Stunting Reduction officer - Ethiopia / Addis",1600,"Anonymous 35924",2019-11-11,"https://www.en-net.org/question/3795.aspx",NA
"Announcements & Nutritionists needed","Nutrition Specialist  IRC Opportunity",1264,"Anonymous 3831",2019-11-08,"https://www.en-net.org/question/3793.aspx",NA
"Announcements & Nutritionists needed","Nutrition Specialist - Opportunity at IRC",1122,"Anonymous 3831",2019-11-06,"https://www.en-net.org/question/3790.aspx",NA
"Announcements & Nutritionists needed","Nutrition Technical Advisor - Opportunity at IRC",1191,"Anonymous 3831",2019-11-06,"https://www.en-net.org/question/3789.aspx",NA
